"Preparation_Date","Preparation_Time","Preparation_Time_Zone","Analysis_Date","Analysis_Time","Analysis_Time_Zone","County","Lake","Station","Activity_Start_Date","Activity_Start_Time","Activity_Time_Zone","Vol Filtered (L)","Ethanol (ml)","Tube #","750","664","647","630","750 (HCL)","665 (HCL)","Result_Value(ug/L)","Result_Comments","QAQC_Qualifier","WIN_Value_Qualifier","Holding_Qualifier","MDL_PQL_Qualifier","Data_Category","Run_ID","Study","Comments","StartDate","PrepDate","AnDate","Value_Qualifier","Sampling_Agency_Name","Project_ID"
,,,"10/15/2025",12:00:00,"EST",,,"MBLK1",,,,1,8,1,0.003,0.003,0.004,0.003,0.003,0.003,1,,,"TI",,"TI","QAQC","CHLC1014202510152025",,,,,2025-10-15,"U","Florida Lakewatch","21FLKWAT"
,,,"10/15/2025",12:00:00,"EST",,,"CCV1",,,,0.008,8,22,0.005,0.019,0.009,0.005,0.004,0.013,134,,,"",,,"QAQC","CHLC1014202510152025",,,,,2025-10-15,,"Florida Lakewatch","21FLKWAT"
,,,"10/15/2025",12:00:00,"EST",,,"MLBK2",,,,1,8,23,0.003,0.003,0.003,0.003,0.003,0.003,1,,,"TI",,"TI","QAQC","CHLC1014202510152025",,,,,2025-10-15,"U","Florida Lakewatch","21FLKWAT"
,,,"10/15/2025",12:00:00,"EST",,,"CCV2",,,,0.008,8,44,0.004,0.019,0.009,0.004,0.006,0.016,134,,,"",,,"QAQC","CHLC1014202510152025",,,,,2025-10-15,,"Florida Lakewatch","21FLKWAT"
,,,"10/15/2025",12:00:00,"EST",,,"MLBK3",,,,1,8,45,0.003,0.005,0.004,0.003,0.003,0.004,1,,,"TI",,"TI","QAQC","CHLC1014202510152025",,,,,2025-10-15,"U","Florida Lakewatch","21FLKWAT"
,,,"10/15/2025",12:00:00,"EST",,,"CCV3",,,,0.008,8,66,0.003,0.013,0.006,0.003,0.002,0.008,107,,,"",,,"QAQC","CHLC1014202510152025",,,,,2025-10-15,,"Florida Lakewatch","21FLKWAT"
,,,"10/15/2025",12:00:00,"EST",,,"MLBK4",,,,1,8,67,0.001,0.002,0.003,0.001,0.002,0.002,1,,,"TI",,"TI","QAQC","CHLC1014202510152025",,,,,2025-10-15,"U","Florida Lakewatch","21FLKWAT"
,,,"10/15/2025",12:00:00,"EST",,,"CCV4",,,,0.008,8,72,0.002,0.017,0.006,0.002,0.003,0.012,160,,,"",,,"Sample","CHLC1014202510152025",,,,,2025-10-15,,"Florida Lakewatch","21FLKWAT"
,,,"10/15/2025",12:00:00,"EST",,,"CCV4",,,,0.008,8,88,0.002,0.017,0.006,0.002,0.003,0.012,160,,,"",,,"QAQC","CHLC1014202510152025",,,,,2025-10-15,,"Florida Lakewatch","21FLKWAT"
,,,"10/15/2025",12:00:00,"EST",,,"MLBK5",,,,1,8,89,,,,,,,,,"V","",,,"QAQC","CHLC1014202510152025",,,,,2025-10-15,,"Florida Lakewatch","21FLKWAT"
,,,"10/15/2025",12:00:00,"EST",,,"CCV5",,,,0.008,8,110,,,,,,,,,,"",,,"QAQC","CHLC1014202510152025",,,,,2025-10-15,,"Florida Lakewatch","21FLKWAT"
,,,"10/01/2025",12:59:59,"EST",,,"MBLK1",,,,1,8,1,0.006,0.005,0.006,0.006,0.004,0.002,1,,,"TI",,"TI","QAQC","CHLC0930202510012025",,,,,2025-10-01,"U","Florida Lakewatch","21FLKWAT"
,,,"10/01/2025",12:59:59,"EST",,,"CCV1",,,,0.008,8,22,0.005,0.019,0.008,0.005,0.006,0.016,107,,,"",,,"QAQC","CHLC0930202510012025",,,,,2025-10-01,,"Florida Lakewatch","21FLKWAT"
,,,"10/01/2025",12:59:59,"EST",,,"MLBK2",,,,1,8,23,0.004,0.004,0.005,0.004,0.004,0.004,1,,,"TI",,"TI","QAQC","CHLC0930202510012025",,,,,2025-10-01,"U","Florida Lakewatch","21FLKWAT"
,,,"10/01/2025",12:59:59,"EST",,,"CCV2",,,,0.008,8,44,-0.001,0.016,0.005,-0.001,-0.001,0.009,187,,,"",,,"QAQC","CHLC0930202510012025",,,,,2025-10-01,,"Florida Lakewatch","21FLKWAT"
,,,"10/01/2025",12:59:59,"EST",,,"MLBK3",,,,1,8,45,0,0.002,0.002,0,0.002,0.002,1,,,"TI",,"TI","QAQC","CHLC0930202510012025",,,,,2025-10-01,"U","Florida Lakewatch","21FLKWAT"
,,,"10/01/2025",12:59:59,"EST",,,"CCV3",,,,0.008,8,66,0.003,0.02,0.009,0.003,0.003,0.012,214,,,"",,,"QAQC","CHLC0930202510012025",,,,,2025-10-01,,"Florida Lakewatch","21FLKWAT"
,,,"10/01/2025",12:59:59,"EST",,,"MLBK4",,,,1,8,67,-0.001,0.001,0.002,-0.001,0.001,0.001,1,,,"TI",,"TI","QAQC","CHLC0930202510012025",,,,,2025-10-01,"U","Florida Lakewatch","21FLKWAT"
,,,"10/01/2025",12:59:59,"EST",,,"CCV4",,,,0.008,8,72,0,0.016,0.006,0,0,0.01,160,,,"",,,"Sample","CHLC0930202510012025",,,,,2025-10-01,,"Florida Lakewatch","21FLKWAT"
,,,"10/01/2025",12:59:59,"EST",,,"CCV4",,,,0.008,8,88,,,,,,,,,,"",,,"QAQC","CHLC0930202510012025",,,,,2025-10-01,,"Florida Lakewatch","21FLKWAT"
,,,"10/01/2025",12:59:59,"EST",,,"MLBK5",,,,1,8,89,,,,,,,,,,"",,,"QAQC","CHLC0930202510012025",,,,,2025-10-01,,"Florida Lakewatch","21FLKWAT"
,,,"10/01/2025",12:59:59,"EST",,,"CCV5",,,,0.008,8,110,,,,,,,,,,"",,,"QAQC","CHLC0930202510012025",,,,,2025-10-01,,"Florida Lakewatch","21FLKWAT"
,,,"10/01/2025",09:29:59,"EST",,,"MBLK1",,,,1,8,1,0.001,0.001,0.002,0.001,0.001,0.001,1,,,"TI",,"TI","QAQC","CHLC0930202510012025",,,,,2025-10-01,"U","Florida Lakewatch","21FLKWAT"
,,,"10/01/2025",09:29:59,"EST",,,"CCV1",,,,0.008,8,22,0.002,0.017,0.007,0.002,0.001,0.009,187,,,"",,,"QAQC","CHLC0930202510012025",,,,,2025-10-01,,"Florida Lakewatch","21FLKWAT"
,,,"10/01/2025",09:29:59,"EST",,,"MLBK2",,,,1,8,23,0.007,0.01,0.01,0.007,0.007,0.007,1,,,"U",,"U","QAQC","CHLC0930202510012025",,,,,2025-10-01,"U","Florida Lakewatch","21FLKWAT"
,,,"10/01/2025",09:29:59,"EST",,,"CCV2",,,,0.008,8,44,0.003,0.018,0.008,0.003,0.001,0.01,160,,,"",,,"QAQC","CHLC0930202510012025",,,,,2025-10-01,,"Florida Lakewatch","21FLKWAT"
,,,"10/01/2025",09:29:59,"EST",,,"MLBK3",,,,1,8,45,0.004,0.006,0.006,0.004,0.004,0.004,1,,,"TI",,"TI","QAQC","CHLC0930202510012025",,,,,2025-10-01,"U","Florida Lakewatch","21FLKWAT"
,,,"10/01/2025",09:29:59,"EST",,,"CCV3",,,,0.008,8,66,0.002,0.017,0.007,0.002,0.002,0.011,160,,,"",,,"QAQC","CHLC0930202510012025",,,,,2025-10-01,,"Florida Lakewatch","21FLKWAT"
,,,"10/01/2025",09:29:59,"EST",,,"MLBK4",,,,1,8,67,0.003,0.005,0.006,0.003,0.004,0.005,1,,,"TI",,"TI","QAQC","CHLC0930202510012025",,,,,2025-10-01,"U","Florida Lakewatch","21FLKWAT"
,,,"10/01/2025",09:29:59,"EST",,,"CCV4",,,,0.008,8,70,0.001,0.015,0.005,0.001,0.003,0.013,107,,,"",,,"Sample","CHLC0930202510012025",,,,,2025-10-01,,"Florida Lakewatch","21FLKWAT"
,,,"10/01/2025",09:29:59,"EST",,,"CCV4",,,,0.008,8,88,,,,,,,,,,"",,,"QAQC","CHLC0930202510012025",,,,,2025-10-01,,"Florida Lakewatch","21FLKWAT"
,,,"10/01/2025",09:29:59,"EST",,,"MLBK5",,,,1,8,89,,,,,,,,,,"",,,"QAQC","CHLC0930202510012025",,,,,2025-10-01,,"Florida Lakewatch","21FLKWAT"
,,,"10/01/2025",09:29:59,"EST",,,"CCV5",,,,0.008,8,110,,,,,,,,,,"",,,"QAQC","CHLC0930202510012025",,,,,2025-10-01,,"Florida Lakewatch","21FLKWAT"
,,,"10/14/2025",12:00:00,"EST",,,"MBLK1",,,,1,8,1,0.005,0.004,0.004,0.005,0.004,0.004,1,,,"TI",,"TI","QAQC","CHLC1013202510142025",,,,,2025-10-14,"U","Florida Lakewatch","21FLKWAT"
,,,"10/14/2025",12:00:00,"EST",,,"CCV1",,,,0.008,8,22,0.003,0.022,0.009,0.003,0.007,0.019,187,,,"",,,"QAQC","CHLC1013202510142025",,,,,2025-10-14,,"Florida Lakewatch","21FLKWAT"
,,,"10/14/2025",12:00:00,"EST",,,"MLBK2",,,,1,8,23,0.004,0.008,0.007,0.004,0.004,0.005,1,,,"U",,"U","QAQC","CHLC1013202510142025",,,,,2025-10-14,"U","Florida Lakewatch","21FLKWAT"
,,,"10/14/2025",12:00:00,"EST",,,"CCV2",,,,0.008,8,44,0.005,0.019,0.008,0.005,0.006,0.015,134,,,"",,,"QAQC","CHLC1013202510142025",,,,,2025-10-14,,"Florida Lakewatch","21FLKWAT"
,,,"10/14/2025",12:00:00,"EST",,,"MLBK3",,,,1,8,45,0.003,0.004,0.004,0.003,0.003,0.003,1,,,"TI",,"TI","QAQC","CHLC1013202510142025",,,,,2025-10-14,"U","Florida Lakewatch","21FLKWAT"
,,,"10/14/2025",12:00:00,"EST",,,"CCV3",,,,0.008,8,66,0.003,0.018,0.007,0.003,0.003,0.012,160,,,"",,,"QAQC","CHLC1013202510142025",,,,,2025-10-14,,"Florida Lakewatch","21FLKWAT"
,,,"10/14/2025",12:00:00,"EST",,,"MLBK4",,,,1,8,67,0.004,0.005,0.005,0.004,0.003,0.004,1,,,"TI",,"TI","QAQC","CHLC1013202510142025",,,,,2025-10-14,"U","Florida Lakewatch","21FLKWAT"
,,,"10/14/2025",12:00:00,"EST",,,"CCV4",,,,0.008,8,72,0.003,0.018,0.007,0.003,0.001,0.01,160,,,"",,,"Sample","CHLC1013202510142025",,,,,2025-10-14,,"Florida Lakewatch","21FLKWAT"
,,,"10/14/2025",12:00:00,"EST",,,"CCV4",,,,0.008,8,88,0.003,0.018,0.007,0.003,0.001,0.01,160,,,"",,,"QAQC","CHLC1013202510142025",,,,,2025-10-14,,"Florida Lakewatch","21FLKWAT"
,,,"10/14/2025",12:00:00,"EST",,,"MLBK5",,,,1,8,89,,,,,,,,,,"",,,"QAQC","CHLC1013202510142025",,,,,2025-10-14,,"Florida Lakewatch","21FLKWAT"
,,,"10/14/2025",12:00:00,"EST",,,"CCV5",,,,0.008,8,110,,,,,,,,,,"",,,"QAQC","CHLC1013202510142025",,,,,2025-10-14,,"Florida Lakewatch","21FLKWAT"
,,,"10/16/2025",12:59:59,"EST",,,"MBLK1",,,,1,8,1,0.004,0.004,0.005,0.004,0.004,0.004,1,,,"TI",,"TI","QAQC","CHLC1015202510162025",,,,,2025-10-16,"U","Florida Lakewatch","21FLKWAT"
"04/29/2025",15:20:59,"EST","10/16/2025",12:59:59,"EST","Marion","Downstream1","1","04/29/2025",15:14:00,"EST",0.3,8,2,0.003,0.018,0.009,0.003,0.005,0.015,4,,,"Q","Q",,"Sample","CHLC1015202510162025","Student Project",,2025-04-29,2025-04-29,2025-10-16,"Q","Florida Lakewatch","21FLKWAT"
"04/29/2025",15:40:00,"EST","10/16/2025",12:59:59,"EST","Marion","Downstream2","1","04/29/2025",15:35:00,"EST",0.3,8,3,0.005,0.033,0.025,0.005,0.003,0.014,12,,,"Q","Q",,"Sample","CHLC1015202510162025","Student Project",,2025-04-29,2025-04-29,2025-10-16,"Q","Florida Lakewatch","21FLKWAT"
"04/29/2025",14:53:00,"EST","10/16/2025",12:59:59,"EST","Marion","Ponar1","1","04/29/2025",14:47:00,"EST",0.3,8,4,0.003,0.017,0.008,0.003,0.005,0.016,2,,,"Q","Q",,"Sample","CHLC1015202510162025","Student Project",,2025-04-29,2025-04-29,2025-10-16,"Q","Florida Lakewatch","21FLKWAT"
"04/29/2025",16:06:59,"EST","10/16/2025",12:59:59,"EST","Marion","Ponar2","1","04/29/2025",16:02:59,"EST",0.3,8,5,0.003,0.033,0.014,0.003,0.003,0.025,6,,,"Q","Q",,"Sample","CHLC1015202510162025","Student Project",,2025-04-29,2025-04-29,2025-10-16,"Q","Florida Lakewatch","21FLKWAT"
"04/29/2025",14:34:59,"EST","10/16/2025",12:59:59,"EST","Marion","Reservoir1","1","04/29/2025",14:29:59,"EST",0.3,8,6,0.005,0.02,0.011,0.005,0.006,0.017,3,,,"Q","Q",,"Sample","CHLC1015202510162025","Student Project",,2025-04-29,2025-04-29,2025-10-16,"Q","Florida Lakewatch","21FLKWAT"
"04/29/2025",16:35:00,"EST","10/16/2025",12:59:59,"EST","Marion","Reservoir2","1","04/29/2025",16:30:00,"EST",0.3,8,7,0.007,0.041,0.02,0.007,0.007,0.031,7,,,"Q","Q",,"Sample","CHLC1015202510162025","Student Project",,2025-04-29,2025-04-29,2025-10-16,"Q","Florida Lakewatch","21FLKWAT"
,,,"10/16/2025",12:59:59,"EST",,,"CCV1",,,,0.008,8,22,0.002,0.019,0.007,0.002,0.001,0.012,160,,,"",,,"QAQC","CHLC1015202510162025",,,,,2025-10-16,,"Florida Lakewatch","21FLKWAT"
,,,"10/16/2025",12:59:59,"EST",,,"MLBK2",,,,1,8,23,0.003,0.007,0.006,0.003,0.003,0.006,1,,,"TI",,"TI","QAQC","CHLC1015202510162025",,,,,2025-10-16,"U","Florida Lakewatch","21FLKWAT"
,,,"10/16/2025",12:59:59,"EST",,,"CCV2",,,,0.008,8,44,0.002,0.018,0.008,0.002,0.005,0.016,134,,,"",,,"QAQC","CHLC1015202510162025",,,,,2025-10-16,,"Florida Lakewatch","21FLKWAT"
,,,"10/16/2025",12:59:59,"EST",,,"MLBK3",,,,1,8,45,0.004,0.006,0.006,0.004,0.004,0.004,1,,,"TI",,"TI","QAQC","CHLC1015202510162025",,,,,2025-10-16,"U","Florida Lakewatch","21FLKWAT"
"04/29/2025",,"EST","10/16/2025",12:59:59,"EST","Sarasota","Willowbrook","1","04/29/2025",,"EST",0.5,8,63,0.003,0.143,0.055,0.003,0.007,0.11,16,,,"Q","Q",,"Sample","CHLC1015202510162025",,,2025-04-29,2025-04-29,2025-10-16,"Q","Florida Lakewatch","21FLKWAT"
"04/29/2025",,"EST","10/16/2025",12:59:59,"EST","Sarasota","Willowbrook","2","04/29/2025",,"EST",0.5,8,64,0.004,0.122,0.049,0.004,0.006,0.093,13,,,"Q","Q",,"Sample","CHLC1015202510162025",,,2025-04-29,2025-04-29,2025-10-16,"Q","Florida Lakewatch","21FLKWAT"
"06/19/2025",,"EST","10/16/2025",12:59:59,"EST","Sarasota","Willowbrook","1","06/19/2025",,"EST",0.5,8,65,0.007,0.191,0.078,0.007,0.005,0.14,21,,,"",,,"Sample","CHLC1015202510162025",,,2025-06-19,2025-06-19,2025-10-16,,"Florida Lakewatch","21FLKWAT"
,,,"10/16/2025",12:59:59,"EST",,,"CCV3",,,,0.008,8,66,0.002,0.019,0.008,0.002,0.004,0.014,187,,,"",,,"QAQC","CHLC1015202510162025",,,,,2025-10-16,,"Florida Lakewatch","21FLKWAT"
,,,"10/16/2025",12:59:59,"EST",,,"MLBK4",,,,1,8,67,0.005,0.008,0.008,0.005,0.005,0.006,1,,,"TI",,"TI","QAQC","CHLC1015202510162025",,,,,2025-10-16,"U","Florida Lakewatch","21FLKWAT"
"06/19/2025",,"EST","10/16/2025",12:59:59,"EST","Sarasota","Willowbrook","2","06/19/2025",,"EST",0.5,8,68,0.006,0.177,0.074,0.006,0.006,0.132,19,,,"",,,"Sample","CHLC1015202510162025",,,2025-06-19,2025-06-19,2025-10-16,,"Florida Lakewatch","21FLKWAT"
"07/22/2025",,"EST","10/16/2025",12:59:59,"EST","Sarasota","Willowbrook","1","07/22/2025",,"EST",0.5,8,69,0.007,0.101,0.049,0.007,0.005,0.071,12,,,"",,,"Sample","CHLC1015202510162025",,,2025-07-22,2025-07-22,2025-10-16,,"Florida Lakewatch","21FLKWAT"
"07/22/2025",,"EST","10/16/2025",12:59:59,"EST","Sarasota","Willowbrook","2","07/22/2025",,"EST",0.5,8,70,0.006,0.082,0.042,0.006,0.008,0.063,9,,,"",,,"Sample","CHLC1015202510162025",,,2025-07-22,2025-07-22,2025-10-16,,"Florida Lakewatch","21FLKWAT"
,,,"10/16/2025",12:59:59,"EST",,,"CCV4",,,,0.008,8,71,0.001,0.017,0.006,0.001,0.002,0.013,134,,,"",,,"Sample","CHLC1015202510162025",,,,,2025-10-16,,"Florida Lakewatch","21FLKWAT"
,,,"10/16/2025",12:59:59,"EST",,,"CCV4",,,,0.008,8,88,,,,,,,,,,"",,,"QAQC","CHLC1015202510162025",,,,,2025-10-16,,"Florida Lakewatch","21FLKWAT"
,,,"10/16/2025",12:59:59,"EST",,,"MLBK5",,,,1,8,89,,,,,,,,,,"",,,"QAQC","CHLC1015202510162025",,,,,2025-10-16,,"Florida Lakewatch","21FLKWAT"
,,,"10/16/2025",12:59:59,"EST",,,"CCV5",,,,0.008,8,110,,,,,,,,,,"",,,"QAQC","CHLC1015202510162025",,,,,2025-10-16,,"Florida Lakewatch","21FLKWAT"
,,,"10/02/2025",09:29:59,"EST",,,"MBLK1",,,,1,8,1,0.001,0,0.001,0.001,0.001,0.001,1,,,"TI",,"TI","QAQC","CHLC1001202510022025","Student Project",,,,2025-10-02,"U","Florida Lakewatch","21FLKWAT"
"07/24/2025",14:29:59,"EST","10/02/2025",09:29:59,"EST","Alachua","USGS Ponds","A1","07/24/2025",13:27:00,"EST",0.1,8,2,0.006,0.137,0.044,0.006,0.01,0.09,109,,,"",,,"Sample","CHLC1001202510022025","Student Project",,2025-07-24,2025-07-24,2025-10-02,,"Florida Lakewatch","21FLKWAT"
"07/24/2025",14:32:00,"EST","10/02/2025",09:29:59,"EST","Alachua","USGS Ponds","A2","07/24/2025",13:08:00,"EST",0.2,8,3,0.006,0.012,0.009,0.006,0.006,0.008,4,,,"",,,"Sample","CHLC1001202510022025","Student Project",,2025-07-24,2025-07-24,2025-10-02,,"Florida Lakewatch","21FLKWAT"
"07/24/2025",14:35:59,"EST","10/02/2025",09:29:59,"EST","Alachua","USGS Ponds","A3","07/24/2025",11:34:00,"EST",0.2,8,4,0.007,0.028,0.017,0.007,0.007,0.023,5,,,"",,,"Sample","CHLC1001202510022025","Student Project",,2025-07-24,2025-07-24,2025-10-02,,"Florida Lakewatch","21FLKWAT"
"07/24/2025",14:40:00,"EST","10/02/2025",09:29:59,"EST","Alachua","USGS Ponds","A4","07/24/2025",10:07:00,"EST",0.1,8,5,0.006,0.016,0.01,0.006,0.007,0.015,4,,,"",,,"Sample","CHLC1001202510022025","Student Project",,2025-07-24,2025-07-24,2025-10-02,,"Florida Lakewatch","21FLKWAT"
"07/24/2025",14:45:00,"EST","10/02/2025",09:29:59,"EST","Alachua","USGS Ponds","A5","07/24/2025",09:39:00,"EST",0.1,8,6,0.006,0.139,0.057,0.006,0.005,0.095,92,,,"",,,"Sample","CHLC1001202510022025","Student Project",,2025-07-24,2025-07-24,2025-10-02,,"Florida Lakewatch","21FLKWAT"
"07/24/2025",14:50:00,"EST","10/02/2025",09:29:59,"EST","Alachua","USGS Ponds","A6","07/24/2025",11:11:00,"EST",0.1,8,7,0.008,0.054,0.027,0.008,0.009,0.039,34,,,"",,,"Sample","CHLC1001202510022025","Student Project",,2025-07-24,2025-07-24,2025-10-02,,"Florida Lakewatch","21FLKWAT"
"07/24/2025",14:55:00,"EST","10/02/2025",09:29:59,"EST","Alachua","USGS Ponds","A7","07/24/2025",10:50:00,"EST",0.1,8,8,0.01,0.092,0.038,0.01,0.009,0.062,62,,,"",,,"Sample","CHLC1001202510022025","Student Project",,2025-07-24,2025-07-24,2025-10-02,,"Florida Lakewatch","21FLKWAT"
"07/24/2025",15:00:00,"EST","10/02/2025",09:29:59,"EST","Alachua","USGS Ponds","A8","07/24/2025",09:20:59,"EST",0.1,8,9,0.007,0.053,0.035,0.007,0.007,0.037,34,,,"",,,"Sample","CHLC1001202510022025","Student Project",,2025-07-24,2025-07-24,2025-10-02,,"Florida Lakewatch","21FLKWAT"
"07/24/2025",15:05:00,"EST","10/02/2025",09:29:59,"EST","Alachua","USGS Ponds","A9","07/24/2025",09:02:59,"EST",0.1,8,10,0.006,0.072,0.029,0.006,0.008,0.051,49,,,"",,,"Sample","CHLC1001202510022025","Student Project",,2025-07-24,2025-07-24,2025-10-02,,"Florida Lakewatch","21FLKWAT"
"06/23/2025",,"EST","10/02/2025",09:29:59,"EST","Alachua","Lochloosa_Lynch_Student Project","OP1","06/23/2025",,"EST",0.115,8,11,0.011,0.076,0.034,0.011,0.012,0.055,41,,,"",,,"Sample","CHLC1001202510022025","Student Project",,2025-06-23,2025-06-23,2025-10-02,,"Florida Lakewatch","21FLKWAT"
"06/23/2025",,"EST","10/02/2025",09:29:59,"EST","Alachua","Lochloosa_Lynch_Student Project","OP2","06/23/2025",,"EST",0.105,8,12,0.009,0.085,0.037,0.009,0.007,0.057,53,,,"",,,"Sample","CHLC1001202510022025","Student Project",,2025-06-23,2025-06-23,2025-10-02,,"Florida Lakewatch","21FLKWAT"
"06/23/2025",,"EST","10/02/2025",09:29:59,"EST","Alachua","Lochloosa_Lynch_Student Project","OP3","06/23/2025",,"EST",0.1,8,13,0.005,0.061,0.027,0.005,0.007,0.045,38,,,"",,,"Sample","CHLC1001202510022025","Student Project",,2025-06-23,2025-06-23,2025-10-02,,"Florida Lakewatch","21FLKWAT"
"06/23/2025",,"EST","10/02/2025",09:29:59,"EST","Alachua","Lochloosa_Lynch_Student Project","LC","06/23/2025",,"EST",0.25,8,14,0.005,0.152,0.058,0.005,0.008,0.106,42,,,"",,,"Sample","CHLC1001202510022025","Student Project",,2025-06-23,2025-06-23,2025-10-02,,"Florida Lakewatch","21FLKWAT"
"06/23/2025",,"EST","10/02/2025",09:29:59,"EST","Alachua","Lochloosa_Lynch_Student Project","L2","06/23/2025",,"EST",0.15,8,15,0.007,0.076,0.038,0.007,0.009,0.058,28,,,"",,,"Sample","CHLC1001202510022025","Student Project",,2025-06-23,2025-06-23,2025-10-02,,"Florida Lakewatch","21FLKWAT"
"06/23/2025",,"EST","10/02/2025",09:29:59,"EST","Alachua","Lochloosa_Lynch_Student Project","L4","06/23/2025",,"EST",0.15,8,16,0,0.066,0.022,0,0.004,0.047,33,,,"",,,"Sample","CHLC1001202510022025","Student Project",,2025-06-23,2025-06-23,2025-10-02,,"Florida Lakewatch","21FLKWAT"
"06/23/2025",,"EST","10/02/2025",09:29:59,"EST","Alachua","Lochloosa_Lynch_Student Project","L5","06/23/2025",,"EST",0.15,8,17,0.006,0.071,0.028,0.006,0.006,0.053,26,,,"",,,"Sample","CHLC1001202510022025","Student Project",,2025-06-23,2025-06-23,2025-10-02,,"Florida Lakewatch","21FLKWAT"
"07/24/2025",,"EST","10/02/2025",09:29:59,"EST","Alachua","Lochloosa_Lynch_Student Project","OP1","07/24/2025",,"EST",0.1,8,18,0.003,0.079,0.027,0.003,0.004,0.052,60,,,"",,,"Sample","CHLC1001202510022025","Student Project",,2025-07-24,2025-07-24,2025-10-02,,"Florida Lakewatch","21FLKWAT"
"07/24/2025",,"EST","10/02/2025",09:29:59,"EST","Alachua","Lochloosa_Lynch_Student Project","OP2","07/24/2025",,"EST",0.1,8,19,0.005,0.098,0.034,0.005,0,0.062,66,,,"",,,"Sample","CHLC1001202510022025","Student Project",,2025-07-24,2025-07-24,2025-10-02,,"Florida Lakewatch","21FLKWAT"
"07/24/2025",,"EST","10/02/2025",09:29:59,"EST","Alachua","Lochloosa_Lynch_Student Project","OP3","07/24/2025",,"EST",0.1,8,20,0.002,0.075,0.025,0.002,0.004,0.05,58,,,"",,,"Sample","CHLC1001202510022025","Student Project",,2025-07-24,2025-07-24,2025-10-02,,"Florida Lakewatch","21FLKWAT"
"07/24/2025",,"EST","10/02/2025",09:29:59,"EST","Alachua","Lochloosa_Lynch_Student Project","LC","07/24/2025",,"EST",0.425,8,21,0.006,0.144,0.052,0.006,0.007,0.099,23,,,"",,,"Sample","CHLC1001202510022025","Student Project",,2025-07-24,2025-07-24,2025-10-02,,"Florida Lakewatch","21FLKWAT"
,,,"10/02/2025",09:29:59,"EST",,,"CCV1",,,,0.008,8,22,0.001,0.018,0.006,0.001,0.005,0.015,187,,,"",,,"QAQC","CHLC1001202510022025","Student Project",,,,2025-10-02,,"Florida Lakewatch","21FLKWAT"
,,,"10/02/2025",09:29:59,"EST",,,"MLBK2",,,,1,8,23,0.001,0.003,0.003,0.001,0.001,0.003,1,,,"TI",,"TI","QAQC","CHLC1001202510022025","Student Project",,,,2025-10-02,"U","Florida Lakewatch","21FLKWAT"
"07/24/2025",,"EST","10/02/2025",09:29:59,"EST","Alachua","Lochloosa_Lynch_Student Project","L2","07/24/2025",,"EST",0.115,8,24,0.011,0.111,0.045,0.011,0.01,0.076,63,,,"",,,"Sample","CHLC1001202510022025","Student Project",,2025-07-24,2025-07-24,2025-10-02,,"Florida Lakewatch","21FLKWAT"
"07/24/2025",,"EST","10/02/2025",09:29:59,"EST","Alachua","Lochloosa_Lynch_Student Project","L4","07/24/2025",,"EST",0.16,8,25,0.005,0.097,0.035,0.005,0.007,0.067,43,,,"",,,"Sample","CHLC1001202510022025","Student Project",,2025-07-24,2025-07-24,2025-10-02,,"Florida Lakewatch","21FLKWAT"
"07/24/2025",,"EST","10/02/2025",09:29:59,"EST","Alachua","Lochloosa_Lynch_Student Project","L5","07/24/2025",,"EST",0.155,8,26,0.002,0.09,0.033,0.002,0.002,0.063,37,,,"",,,"Sample","CHLC1001202510022025","Student Project",,2025-07-24,2025-07-24,2025-10-02,,"Florida Lakewatch","21FLKWAT"
"08/20/2025",,"EST","10/02/2025",09:29:59,"EST","Alachua","Lochloosa_Lynch_Student Project","OP1","08/20/2025",,"EST",0.065,8,27,0.003,0.083,0.028,0.003,0.007,0.059,92,,,"",,,"Sample","CHLC1001202510022025","Student Project",,2025-08-20,2025-08-20,2025-10-02,,"Florida Lakewatch","21FLKWAT"
"08/20/2025",,"EST","10/02/2025",09:29:59,"EST","Alachua","Lochloosa_Lynch_Student Project","OP2","08/20/2025",,"EST",0.07,8,28,0.002,0.069,0.022,0.002,0,0.042,76,,,"",,,"Sample","CHLC1001202510022025","Student Project",,2025-08-20,2025-08-20,2025-10-02,,"Florida Lakewatch","21FLKWAT"
"08/20/2025",,"EST","10/02/2025",09:29:59,"EST","Alachua","Lochloosa_Lynch_Student Project","OP3","08/20/2025",,"EST",0.09,8,29,0.004,0.078,0.027,0.004,0.003,0.049,66,,,"",,,"Sample","CHLC1001202510022025","Student Project",,2025-08-20,2025-08-20,2025-10-02,,"Florida Lakewatch","21FLKWAT"
"08/20/2025",,"EST","10/02/2025",09:29:59,"EST","Alachua","Lochloosa_Lynch_Student Project","LC","08/20/2025",,"EST",0.45,8,30,0.003,0.204,0.069,0.003,0.004,0.136,33,,,"",,,"Sample","CHLC1001202510022025","Student Project",,2025-08-20,2025-08-20,2025-10-02,,"Florida Lakewatch","21FLKWAT"
"08/20/2025",,"EST","10/02/2025",09:29:59,"EST","Alachua","Lochloosa_Lynch_Student Project","L2","08/20/2025",,"EST",0.16,8,31,0.001,0.077,0.026,0.001,0.006,0.055,36,,,"",,,"Sample","CHLC1001202510022025","Student Project",,2025-08-20,2025-08-20,2025-10-02,,"Florida Lakewatch","21FLKWAT"
"08/20/2025",,"EST","10/02/2025",09:29:59,"EST","Alachua","Lochloosa_Lynch_Student Project","L4","08/20/2025",,"EST",0.12,8,32,0.002,0.082,0.028,0.002,0.002,0.054,50,,,"",,,"Sample","CHLC1001202510022025","Student Project",,2025-08-20,2025-08-20,2025-10-02,,"Florida Lakewatch","21FLKWAT"
"08/20/2025",,"EST","10/02/2025",09:29:59,"EST","Alachua","Lochloosa_Lynch_Student Project","L5","08/20/2025",,"EST",0.15,8,33,0.008,0.1,0.041,0.008,0.006,0.068,43,,,"",,,"Sample","CHLC1001202510022025","Student Project",,2025-08-20,2025-08-20,2025-10-02,,"Florida Lakewatch","21FLKWAT"
"09/23/2025",,"EST","10/02/2025",09:29:59,"EST","Alachua","Lochloosa_Lynch_Student Project","OP1","09/23/2025",,"EST",0.095,8,34,0.003,0.054,0.02,0.003,0.007,0.041,38,,,"",,,"Sample","CHLC1001202510022025","Student Project",,2025-09-23,2025-09-23,2025-10-02,,"Florida Lakewatch","21FLKWAT"
"09/23/2025",,"EST","10/02/2025",09:29:59,"EST","Alachua","Lochloosa_Lynch_Student Project","OP2","09/23/2025",,"EST",0.07,8,35,0.007,0.057,0.024,0.007,0.01,0.043,52,,,"",,,"Sample","CHLC1001202510022025","Student Project",,2025-09-23,2025-09-23,2025-10-02,,"Florida Lakewatch","21FLKWAT"
"09/23/2025",,"EST","10/02/2025",09:29:59,"EST","Alachua","Lochloosa_Lynch_Student Project","OP3","09/23/2025",,"EST",0.105,8,36,0.006,0.064,0.024,0.006,0.007,0.044,43,,,"",,,"Sample","CHLC1001202510022025","Student Project",,2025-09-23,2025-09-23,2025-10-02,,"Florida Lakewatch","21FLKWAT"
"09/23/2025",,"EST","10/02/2025",09:29:59,"EST","Alachua","Lochloosa_Lynch_Student Project","LC","09/23/2025",,"EST",0.265,8,37,0.009,0.248,0.078,0.009,0.001,0.156,68,,,"",,,"Sample","CHLC1001202510022025","Student Project",,2025-09-23,2025-09-23,2025-10-02,,"Florida Lakewatch","21FLKWAT"
"09/23/2025",,"EST","10/02/2025",09:29:59,"EST","Alachua","Lochloosa_Lynch_Student Project","L2","09/23/2025",,"EST",0.175,8,38,0.006,0.092,0.033,0.006,0.005,0.059,39,,,"",,,"Sample","CHLC1001202510022025","Student Project",,2025-09-23,2025-09-23,2025-10-02,,"Florida Lakewatch","21FLKWAT"
"09/23/2025",,"EST","10/02/2025",09:29:59,"EST","Alachua","Lochloosa_Lynch_Student Project","L4","09/23/2025",,"EST",0.1,8,39,0.008,0.063,0.025,0.008,0.002,0.036,45,,,"",,,"Sample","CHLC1001202510022025","Student Project",,2025-09-23,2025-09-23,2025-10-02,,"Florida Lakewatch","21FLKWAT"
"09/23/2025",,"EST","10/02/2025",09:29:59,"EST","Alachua","Lochloosa_Lynch_Student Project","L5","09/23/2025",,"EST",0.135,8,40,0.006,0.074,0.028,0.006,0.006,0.05,38,,,"",,,"Sample","CHLC1001202510022025","Student Project",,2025-09-23,2025-09-23,2025-10-02,,"Florida Lakewatch","21FLKWAT"
"06/29/2025",,"EST","10/02/2025",09:29:59,"EST","Alachua","Hatchet Creek","1","06/29/2025",,"EST",0.3,8,42,0.004,0.034,0.016,0.004,0.005,0.025,7,,,"",,,"Sample","CHLC1001202510022025","Student Project",,2025-06-29,2025-06-29,2025-10-02,,"Florida Lakewatch","21FLKWAT"
"07/16/2025",,"EST","10/02/2025",09:29:59,"EST","Alachua","Sweetwater Will","1","07/16/2025",,"EST",0.5,8,43,0,0.031,0.011,0,0.005,0.027,4,,,"",,,"Sample","CHLC1001202510022025","Student Project",,2025-07-16,2025-07-16,2025-10-02,,"Florida Lakewatch","21FLKWAT"
,,,"10/02/2025",09:29:59,"EST",,,"CCV2",,,,0.008,8,44,0.003,0.018,0.007,0.003,0.001,0.01,160,,,"",,,"QAQC","CHLC1001202510022025","Student Project",,,,2025-10-02,,"Florida Lakewatch","21FLKWAT"
,,,"10/02/2025",09:29:59,"EST",,,"MLBK3",,,,1,8,45,0.003,0.004,0.004,0.003,0.001,0.003,1,,,"TI",,"TI","QAQC","CHLC1001202510022025","Student Project",,,,2025-10-02,"U","Florida Lakewatch","21FLKWAT"
"07/17/2025",,"EST","10/02/2025",09:29:59,"EST","Alachua","Sweetwater Duck","1","07/17/2025",,"EST",1,8,46,0.002,0.01,0.006,0.002,0.005,0.008,1,,,"U",,"U","Sample","CHLC1001202510022025","Student Project",,2025-07-17,2025-07-17,2025-10-02,"U","Florida Lakewatch","21FLKWAT"
"07/15/2025",,"EST","10/02/2025",09:29:59,"EST","Alachua","Three Lakes Creek","1","07/15/2025",,"EST",0.935,8,47,0.004,0.009,0.007,0.004,0.005,0.009,1,,,"TI",,"TI","Sample","CHLC1001202510022025","Student Project",,2025-07-15,2025-07-15,2025-10-02,"U","Florida Lakewatch","21FLKWAT"
"07/17/2025",,"EST","10/02/2025",09:29:59,"EST","Alachua","Tumblin Creek","1","07/17/2025",,"EST",0.495,8,48,0.003,0.049,0.02,0.003,0.005,0.035,7,,,"",,,"Sample","CHLC1001202510022025","Student Project",,2025-07-17,2025-07-17,2025-10-02,,"Florida Lakewatch","21FLKWAT"
"07/24/2025",,"EST","10/02/2025",09:29:59,"EST","Alachua","Beville","1","07/24/2025",,"EST",0.5,8,50,0.003,0.007,0.006,0.003,0.005,0.005,2,,,"",,,"Sample","CHLC1001202510022025","Student Project",,2025-07-24,2025-07-24,2025-10-02,,"Florida Lakewatch","21FLKWAT"
"08/09/2025",,"EST","10/02/2025",09:29:59,"EST","Alachua","Blues Creek Up","1","08/09/2025",,"EST",0.5,8,51,0.004,0.009,0.006,0.004,0.001,0.005,1,,,"TI",,"TI","Sample","CHLC1001202510022025","Student Project",,2025-08-09,2025-08-09,2025-10-02,"U","Florida Lakewatch","21FLKWAT"
"07/25/2025",,"EST","10/02/2025",09:29:59,"EST","Alachua","Hogtown Head","1","07/25/2025",,"EST",0.5,8,52,0.002,0.021,0.01,0.002,0.003,0.016,3,,,"",,,"Sample","CHLC1001202510022025","Student Project",,2025-07-25,2025-07-25,2025-10-02,,"Florida Lakewatch","21FLKWAT"
"07/29/2025",,"EST","10/02/2025",09:29:59,"EST","Alachua","Hogtown Ring","1","07/29/2025",,"EST",0.5,8,53,0.005,0.013,0.008,0.005,0.001,0.007,1,,,"U",,"U","Sample","CHLC1001202510022025","Student Project",,2025-07-29,2025-07-29,2025-10-02,"U","Florida Lakewatch","21FLKWAT"
"07/30/2025",,"EST","10/02/2025",09:29:59,"EST","Alachua","Possum Creek","1","07/30/2025",,"EST",0.5,8,54,0.003,0.005,0.005,0.003,0.003,0.003,1,,,"U",,"U","Sample","CHLC1001202510022025","Student Project",,2025-07-30,2025-07-30,2025-10-02,"U","Florida Lakewatch","21FLKWAT"
"08/12/2025",19:19:59,"EST","10/02/2025",09:29:59,"EST","Alachua","Orange","5","08/12/2025",12:00:00,"EST",0.2,8,59,0.12,0.376,0.157,0.12,0.107,0.339,26,,,"",,,"Sample","CHLC1001202510022025","Student Project",,2025-08-12,2025-08-12,2025-10-02,,"Florida Lakewatch","21FLKWAT"
"08/17/2025",18:00:00,"EST","10/02/2025",09:29:59,"EST","Leon","Miccusukee","1","08/17/2025",15:30:00,"EST",0.4,8,60,0.009,0.038,0.02,0.009,0.009,0.031,4,,,"",,,"Sample","CHLC1001202510022025","Student Project",,2025-08-17,2025-08-17,2025-10-02,,"Florida Lakewatch","21FLKWAT"
"08/17/2025",18:05:00,"EST","10/02/2025",09:29:59,"EST","Leon","Miccusukee","2","08/17/2025",15:35:00,"EST",0.2,8,61,0.105,0.184,0.084,0.105,0.097,0.17,6,,,"",,,"Sample","CHLC1001202510022025","Student Project",,2025-08-17,2025-08-17,2025-10-02,,"Florida Lakewatch","21FLKWAT"
"08/17/2025",18:10:00,"EST","10/02/2025",09:29:59,"EST","Leon","Miccusukee","3","08/17/2025",15:40:00,"EST",0.125,8,62,0.097,0.194,0.086,0.097,0.092,0.177,21,,,"",,,"Sample","CHLC1001202510022025","Student Project",,2025-08-17,2025-08-17,2025-10-02,,"Florida Lakewatch","21FLKWAT"
"08/17/2025",18:14:59,"EST","10/02/2025",09:29:59,"EST","Leon","Miccusukee","4","08/17/2025",15:59:59,"EST",0.2,8,63,0.008,0.084,0.034,0.008,0.009,0.066,20,,,"",,,"Sample","CHLC1001202510022025","Student Project",,2025-08-17,2025-08-17,2025-10-02,,"Florida Lakewatch","21FLKWAT"
"08/17/2025",18:20:00,"EST","10/02/2025",09:29:59,"EST","Leon","Miccusukee","5","08/17/2025",16:15:00,"EST",0.2,8,64,0.083,0.203,0.09,0.083,0.078,0.185,14,,,"",,,"Sample","CHLC1001202510022025","Student Project",,2025-08-17,2025-08-17,2025-10-02,,"Florida Lakewatch","21FLKWAT"
,,,"10/02/2025",09:29:59,"EST",,,"CCV3",,,,0.008,8,65,0.003,0.019,0.007,0.003,0.003,0.013,160,,,"",,,"Sample","CHLC1001202510022025","Student Project",,,,2025-10-02,,"Florida Lakewatch","21FLKWAT"
,,,"10/02/2025",09:29:59,"EST",,,,,,,,8,66,,,,,,,,,,"",,,"QAQC","CHLC1001202510022025","Student Project",,,,2025-10-02,,"Florida Lakewatch","21FLKWAT"
,,,"10/02/2025",09:29:59,"EST",,,,,,,,8,67,,,,,,,,,,"",,,"QAQC","CHLC1001202510022025","Student Project",,,,2025-10-02,,"Florida Lakewatch","21FLKWAT"
,,,"10/02/2025",09:29:59,"EST",,,"CCV4",,,,0.008,8,73,,,,,,,,,,"",,,"Sample","CHLC1001202510022025","Student Project",,,,2025-10-02,,"Florida Lakewatch","21FLKWAT"
,,,"10/02/2025",09:29:59,"EST",,,"CCV4",,,,0.008,8,88,,,,,,,,,,"",,,"QAQC","CHLC1001202510022025","Student Project",,,,2025-10-02,,"Florida Lakewatch","21FLKWAT"
,,,"10/02/2025",09:29:59,"EST",,,"MLBK5",,,,1,8,89,,,,,,,,,,"",,,"QAQC","CHLC1001202510022025","Student Project",,,,2025-10-02,,"Florida Lakewatch","21FLKWAT"
,,,"10/02/2025",09:29:59,"EST",,,"CCV5",,,,0.008,8,110,,,,,,,,,,"",,,"QAQC","CHLC1001202510022025","Student Project",,,,2025-10-02,,"Florida Lakewatch","21FLKWAT"
,,,"10/22/2025",10:00:00,"EST",,,"MBLK1",,,,1,8,1,0.003,0.004,0.004,0.003,0.002,0.003,1,,,"TI",,"TI","QAQC","CHLC1020202510222025",,,,,2025-10-22,"U","Florida Lakewatch","21FLKWAT"
,,,"10/22/2025",10:00:00,"EST",,,"CCV1",,,,0.008,8,22,0.006,0.022,0.01,0.006,0.004,0.015,134,,,"",,,"QAQC","CHLC1020202510222025",,,,,2025-10-22,,"Florida Lakewatch","21FLKWAT"
,,,"10/22/2025",10:00:00,"EST",,,"MLBK2",,,,1,8,23,0.006,0.01,0.009,0.006,0.006,0.009,1,,,"TI",,"TI","QAQC","CHLC1020202510222025",,,,,2025-10-22,"U","Florida Lakewatch","21FLKWAT"
,,,"10/22/2025",10:00:00,"EST",,,"CCV2",,,,0.008,8,39,,,,,,,,,,"",,,"Sample","CHLC1020202510222025",,,,,2025-10-22,,"Florida Lakewatch","21FLKWAT"
,,,"10/22/2025",10:00:00,"EST",,,"CCV2",,,,0.008,8,44,0.004,0.021,0.009,0.004,0.002,0.012,187,,,"",,,"QAQC","CHLC1020202510222025",,,,,2025-10-22,,"Florida Lakewatch","21FLKWAT"
,,,"10/22/2025",10:00:00,"EST",,,"MLBK3",,,,1,8,45,,,,,,,,,,"",,,"QAQC","CHLC1020202510222025",,,,,2025-10-22,,"Florida Lakewatch","21FLKWAT"
,,,"10/22/2025",10:00:00,"EST",,,"CCV3",,,,0.008,8,66,,,,,,,,,,"",,,"QAQC","CHLC1020202510222025",,,,,2025-10-22,,"Florida Lakewatch","21FLKWAT"
,,,"10/22/2025",10:00:00,"EST",,,"MLBK4",,,,1,8,67,,,,,,,,,,"",,,"QAQC","CHLC1020202510222025",,,,,2025-10-22,,"Florida Lakewatch","21FLKWAT"
,,,"10/22/2025",10:00:00,"EST",,,"CCV4",,,,0.008,8,73,,,,,,,,,,"",,,"Sample","CHLC1020202510222025",,,,,2025-10-22,,"Florida Lakewatch","21FLKWAT"
,,,"10/22/2025",10:00:00,"EST",,,"CCV4",,,,0.008,8,88,,,,,,,,,,"",,,"QAQC","CHLC1020202510222025",,,,,2025-10-22,,"Florida Lakewatch","21FLKWAT"
,,,"10/22/2025",10:00:00,"EST",,,"MLBK5",,,,1,8,89,,,,,,,,,,"",,,"QAQC","CHLC1020202510222025",,,,,2025-10-22,,"Florida Lakewatch","21FLKWAT"
,,,"10/22/2025",10:00:00,"EST",,,"CCV5",,,,0.008,8,110,,,,,,,,,,"",,,"QAQC","CHLC1020202510222025",,,,,2025-10-22,,"Florida Lakewatch","21FLKWAT"
,,,"10/22/2025",12:30:00,"EST",,,"MBLK1",,,,1,8,1,0.002,0.002,0.003,0.002,0.002,0.002,1,,,"TI",,"TI","QAQC","CHLC1020202510222025",,,,,2025-10-22,"U","Florida Lakewatch","21FLKWAT"
,,,"10/22/2025",12:30:00,"EST",,,"CCV1",,,,0.008,8,22,0.003,0.02,0.008,0.003,0.003,0.012,214,,,"",,,"QAQC","CHLC1020202510222025",,,,,2025-10-22,,"Florida Lakewatch","21FLKWAT"
,,,"10/22/2025",12:30:00,"EST",,,"MLBK2",,,,1,8,23,0.005,0.008,0.008,0.005,0.005,0.007,1,,,"TI",,"TI","QAQC","CHLC1020202510222025",,,,,2025-10-22,"U","Florida Lakewatch","21FLKWAT"
,,,"10/22/2025",12:30:00,"EST",,,"CCV2",,,,0.008,8,44,0.008,0.024,0.011,0.008,0.002,0.012,160,,,"",,,"QAQC","CHLC1020202510222025",,,,,2025-10-22,,"Florida Lakewatch","21FLKWAT"
,,,"10/22/2025",12:30:00,"EST",,,"MLBK3",,,,1,8,45,0.004,0.007,0.005,0.004,0.004,0.005,1,,,"TI",,"TI","QAQC","CHLC1020202510222025",,,,,2025-10-22,"U","Florida Lakewatch","21FLKWAT"
,,,"10/22/2025",12:30:00,"EST",,,"CCV3",,,,0.008,8,66,0.005,0.021,0.009,0.005,0.005,0.015,160,,,"",,,"QAQC","CHLC1020202510222025",,,,,2025-10-22,,"Florida Lakewatch","21FLKWAT"
,,,"10/22/2025",12:30:00,"EST",,,"MLBK4",,,,1,8,67,0.003,0.004,0.006,0.003,0.007,0.01,1,,,"TI",,"TI","QAQC","CHLC1020202510222025",,,,,2025-10-22,"U","Florida Lakewatch","21FLKWAT"
,,,"10/22/2025",12:30:00,"EST",,,"CCV4",,,,0.008,8,71,0.005,0.02,0.009,0.005,0.005,0.015,134,,,"",,,"Sample","CHLC1020202510222025",,,,,2025-10-22,,"Florida Lakewatch","21FLKWAT"
,,,"10/22/2025",12:30:00,"EST",,,"CCV4",,,,0.008,8,88,,,,,,,,,,"",,,"QAQC","CHLC1020202510222025",,,,,2025-10-22,,"Florida Lakewatch","21FLKWAT"
,,,"10/22/2025",12:30:00,"EST",,,"MLBK5",,,,1,8,89,,,,,,,,,,"",,,"QAQC","CHLC1020202510222025",,,,,2025-10-22,,"Florida Lakewatch","21FLKWAT"
,,,"10/22/2025",12:30:00,"EST",,,"CCV5",,,,0.008,8,110,,,,,,,,,,"",,,"QAQC","CHLC1020202510222025",,,,,2025-10-22,,"Florida Lakewatch","21FLKWAT"
,,,"10/24/2025",14:00:00,"EST",,,"MBLK1",,,,1,8,1,0.004,0.004,0.005,0.004,0.004,0.004,1,,,"TI",,"TI","QAQC","CHLC1023202510242025",,,,,2025-10-24,"U","Florida Lakewatch","21FLKWAT"
,,,"10/24/2025",14:00:00,"EST",,,"CCV1",,,,0.008,8,22,0.006,0.021,0.011,0.006,0.006,0.017,107,,,"",,,"QAQC","CHLC1023202510242025",,,,,2025-10-24,,"Florida Lakewatch","21FLKWAT"
,,,"10/24/2025",14:00:00,"EST",,,"MLBK2",,,,1,8,23,0.004,0.004,0.004,0.004,0.004,0.003,1,,,"TI",,"TI","QAQC","CHLC1023202510242025",,,,,2025-10-24,"U","Florida Lakewatch","21FLKWAT"
,,,"10/24/2025",14:00:00,"EST",,,"CCV2",,,,0.008,8,44,0.005,0.019,0.009,0.005,0.005,0.012,187,,,"",,,"QAQC","CHLC1023202510242025",,,,,2025-10-24,,"Florida Lakewatch","21FLKWAT"
,,,"10/24/2025",14:00:00,"EST",,,"MLBK3",,,,1,8,45,0.007,0.01,0.01,0.007,0.007,0.007,1,,,"U",,"U","QAQC","CHLC1023202510242025",,,,,2025-10-24,"U","Florida Lakewatch","21FLKWAT"
,,,"10/24/2025",14:00:00,"EST",,,"CCV3",,,,0.008,8,66,0,0.014,0.004,0,0,0.008,160,,,"",,,"QAQC","CHLC1023202510242025",,,,,2025-10-24,,"Florida Lakewatch","21FLKWAT"
,,,"10/24/2025",14:00:00,"EST",,,"MLBK4",,,,1,8,67,0.007,0.009,0.009,0.007,0.009,0.009,1,,,"TI",,"TI","QAQC","CHLC1023202510242025",,,,,2025-10-24,"U","Florida Lakewatch","21FLKWAT"
,,,"10/24/2025",14:00:00,"EST",,,"CCV4",,,,0.008,8,71,0.002,0.016,0.007,0.002,0.002,0.011,134,,,"",,,"Sample","CHLC1023202510242025",,,,,2025-10-24,,"Florida Lakewatch","21FLKWAT"
,,,"10/24/2025",14:00:00,"EST",,,"CCV4",,,,0.008,8,88,,,,,,,,,,"",,,"QAQC","CHLC1023202510242025",,,,,2025-10-24,,"Florida Lakewatch","21FLKWAT"
,,,"10/24/2025",14:00:00,"EST",,,"MLBK5",,,,1,8,89,,,,,,,,,,"",,,"QAQC","CHLC1023202510242025",,,,,2025-10-24,,"Florida Lakewatch","21FLKWAT"
,,,"10/24/2025",14:00:00,"EST",,,"CCV5",,,,0.008,8,110,,,,,,,,,,"",,,"QAQC","CHLC1023202510242025",,,,,2025-10-24,,"Florida Lakewatch","21FLKWAT"
,,,"10/03/2025",09:29:59,"EST",,,"MBLK1",,,,1,8,1,0.002,0.002,0.003,0.002,0.002,0.002,1,,,"TI",,"TI","QAQC","CHLC1002202510032025",,,,,2025-10-03,"U","Florida Lakewatch","21FLKWAT"
,,,"10/03/2025",09:29:59,"EST",,,"CCV1",,,,0.008,8,22,0.002,0.019,0.007,0.002,0.003,0.012,214,,,"",,,"QAQC","CHLC1002202510032025",,,,,2025-10-03,,"Florida Lakewatch","21FLKWAT"
,,,"10/03/2025",09:29:59,"EST",,,"MLBK2",,,,1,8,23,0.005,0.007,0.007,0.005,0.005,0.005,1,,,"TI",,"TI","QAQC","CHLC1002202510032025",,,,,2025-10-03,"U","Florida Lakewatch","21FLKWAT"
,,,"10/03/2025",09:29:59,"EST",,,"CCV2",,,,0.008,8,44,0.006,0.022,0.011,0.006,0.002,0.011,187,,,"",,,"QAQC","CHLC1002202510032025",,,,,2025-10-03,,"Florida Lakewatch","21FLKWAT"
,,,"10/03/2025",09:29:59,"EST",,,"MLBK3",,,,1,8,45,0.004,0.005,0.005,0.004,0.005,0.005,1,,,"TI",,"TI","QAQC","CHLC1002202510032025",,,,,2025-10-03,"U","Florida Lakewatch","21FLKWAT"
,,,"10/03/2025",09:29:59,"EST",,,"CCV3",,,,0.008,8,66,0.003,0.019,0.007,0.003,0.003,0.012,187,,,"",,,"QAQC","CHLC1002202510032025",,,,,2025-10-03,,"Florida Lakewatch","21FLKWAT"
,,,"10/03/2025",09:29:59,"EST",,,"MLBK4",,,,1,8,67,0,0.001,0.001,0,0,0,1,,,"TI",,"TI","QAQC","CHLC1002202510032025",,,,,2025-10-03,"U","Florida Lakewatch","21FLKWAT"
,,,"10/03/2025",09:29:59,"EST",,,"CCV4",,,,0.008,8,71,0.002,0.017,0.006,0.002,0.002,0.011,160,,,"",,,"Sample","CHLC1002202510032025",,,,,2025-10-03,,"Florida Lakewatch","21FLKWAT"
,,,"10/03/2025",09:29:59,"EST",,,"CCV4",,,,0.008,8,88,,,,,,,,,,"",,,"QAQC","CHLC1002202510032025",,,,,2025-10-03,,"Florida Lakewatch","21FLKWAT"
,,,"10/03/2025",09:29:59,"EST",,,"MLBK5",,,,1,8,89,,,,,,,,,,"",,,"QAQC","CHLC1002202510032025",,,,,2025-10-03,,"Florida Lakewatch","21FLKWAT"
,,,"10/03/2025",09:29:59,"EST",,,"CCV5",,,,0.008,8,110,,,,,,,,,,"",,,"QAQC","CHLC1002202510032025",,,,,2025-10-03,,"Florida Lakewatch","21FLKWAT"
,,,"10/03/2025",11:30:00,"EST",,,"MBLK1",,,,1,8,1,0.002,0.002,0.003,0.002,0.002,0.002,1,,,"TI",,"TI","QAQC","CHLC1002202510032025","Student Project",,,,2025-10-03,"U","Florida Lakewatch","21FLKWAT"
"08/13/2025",15:40:00,,"10/03/2025",11:30:00,"EST","Marion","Downstream","1","08/13/2025",15:35:00,"EST",0.25,8,2,0.007,0.031,0.016,0.007,0.008,0.026,5,,,"",,,"Sample","CHLC1002202510032025","Student Project",,2025-08-13,2025-08-13,2025-10-03,,"Florida Lakewatch","21FLKWAT"
"08/13/2025",15:59:59,"EST","10/03/2025",11:30:00,"EST","Marion","Downstream","2","08/13/2025",15:55:00,"EST",0.25,8,3,0.016,0.066,0.034,0.016,0.014,0.047,15,,,"",,,"Sample","CHLC1002202510032025","Student Project",,2025-08-13,2025-08-13,2025-10-03,,"Florida Lakewatch","21FLKWAT"
"04/30/2025",11:52:00,"EST","10/03/2025",11:30:00,"EST","Marion","Downstream","3","04/30/2025",11:49:00,"EST",0.3,8,4,0.009,0.116,0.042,0.009,0.008,0.082,23,,,"Q","Q",,"Sample","CHLC1002202510032025","Student Project",,2025-04-30,2025-04-30,2025-10-03,"Q","Florida Lakewatch","21FLKWAT"
"04/30/2025",11:28:00,"EST","10/03/2025",11:30:00,"EST","Marion","Downstream","4","04/30/2025",11:26:00,"EST",0.3,8,5,0.009,0.103,0.037,0.009,0.009,0.072,22,,,"Q","Q",,"Sample","CHLC1002202510032025","Student Project",,2025-04-30,2025-04-30,2025-10-03,"Q","Florida Lakewatch","21FLKWAT"
"04/30/2025",12:17:59,"EST","10/03/2025",11:30:00,"EST","Marion","Downstream","5","04/30/2025",12:11:00,"EST",0.3,8,6,0.007,0.103,0.037,0.007,0.008,0.073,22,,,"Q","Q",,"Sample","CHLC1002202510032025","Student Project",,2025-04-30,2025-04-30,2025-10-03,"Q","Florida Lakewatch","21FLKWAT"
"04/30/2025",14:29:59,"EST","10/03/2025",11:30:00,"EST","Marion","Downstream","6","04/30/2025",14:25:00,"EST",0.3,8,7,0.004,0.116,0.038,0.004,0.008,0.082,27,,,"Q","Q",,"Sample","CHLC1002202510032025","Student Project",,2025-04-30,2025-04-30,2025-10-03,"Q","Florida Lakewatch","21FLKWAT"
"08/13/2025",09:55:00,"EST","10/03/2025",11:30:00,"EST","Marion","Upstream","1","08/13/2025",09:52:00,"EST",0.25,8,8,0.008,0.08,0.032,0.008,0.01,0.064,15,,,"",,,"Sample","CHLC1002202510032025","Student Project",,2025-08-13,2025-08-13,2025-10-03,,"Florida Lakewatch","21FLKWAT"
"08/13/2025",10:23:00,"EST","10/03/2025",11:30:00,"EST","Marion","Upstream","2","08/13/2025",10:21:00,"EST",0.25,8,9,0.005,0.04,0.017,0.005,0.003,0.031,6,,,"",,,"Sample","CHLC1002202510032025","Student Project",,2025-08-13,2025-08-13,2025-10-03,,"Florida Lakewatch","21FLKWAT"
"08/13/2025",11:33:00,"EST","10/03/2025",11:30:00,"EST","Marion","Upstream","3","08/13/2025",11:31:00,"EST",0.25,8,10,0.007,0.092,0.036,0.007,0.011,0.074,19,,,"",,,"Sample","CHLC1002202510032025","Student Project",,2025-08-13,2025-08-13,2025-10-03,,"Florida Lakewatch","21FLKWAT"
"08/13/2025",12:35:00,"EST","10/03/2025",11:30:00,"EST","Marion","Upstream","4","08/13/2025",12:32:00,"EST",0.25,8,11,0.007,0.031,0.016,0.007,0.006,0.023,6,,,"",,,"Sample","CHLC1002202510032025","Student Project",,2025-08-13,2025-08-13,2025-10-03,,"Florida Lakewatch","21FLKWAT"
"04/29/2025",09:38:00,"EST","10/03/2025",11:30:00,"EST","Marion","Upstream","1","04/29/2025",09:32:59,"EST",0.25,8,12,0.008,0.077,0.031,0.008,0.01,0.058,18,,,"Q","Q",,"Sample","CHLC1002202510032025","Student Project",,2025-04-29,2025-04-29,2025-10-03,"Q","Florida Lakewatch","21FLKWAT"
"04/29/2025",09:58:00,"EST","10/03/2025",11:30:00,"EST","Marion","Upstream","2","04/29/2025",09:56:00,"EST",0.5,8,13,0.004,0.021,0.009,0.004,0.006,0.018,2,,,"Q","Q",,"Sample","CHLC1002202510032025","Student Project",,2025-04-29,2025-04-29,2025-10-03,"Q","Florida Lakewatch","21FLKWAT"
"04/29/2025",11:15:00,"EST","10/03/2025",11:30:00,"EST","Marion","Upstream","3","04/29/2025",11:11:00,"EST",0.5,8,14,0.011,0.025,0.016,0.011,0.009,0.021,1,,,"QU","Q","U","Sample","CHLC1002202510032025","Student Project",,2025-04-29,2025-04-29,2025-10-03,"QU","Florida Lakewatch","21FLKWAT"
"04/29/2025",12:33:00,"EST","10/03/2025",11:30:00,"EST","Marion","Upstream","4","04/29/2025",12:27:00,"EST",0.5,8,15,0.005,0.018,0.01,0.005,0.007,0.017,1,,,"QU","Q","U","Sample","CHLC1002202510032025","Student Project",,2025-04-29,2025-04-29,2025-10-03,"QU","Florida Lakewatch","21FLKWAT"
"08/13/2025",,"EST","10/03/2025",11:30:00,"EST","Marion","Ponar","1","08/13/2025",15:00:00,"EST",0.25,8,16,0.009,0.034,0.019,0.009,0.009,0.026,7,,,"",,,"Sample","CHLC1002202510032025","Student Project",,2025-08-13,2025-08-13,2025-10-03,,"Florida Lakewatch","21FLKWAT"
"08/13/2025",,"EST","10/03/2025",11:30:00,"EST","Marion","Ponar","2","08/13/2025",14:55:00,"EST",0.25,8,17,0.004,0.037,0.016,0.004,0.004,0.026,9,,,"",,,"Sample","CHLC1002202510032025","Student Project",,2025-08-13,2025-08-13,2025-10-03,,"Florida Lakewatch","21FLKWAT"
"08/13/2025",,"EST","10/03/2025",11:30:00,"EST","Marion","Ponar","3","08/13/2025",15:14:59,"EST",0.25,8,18,0.002,0.04,0.016,0.002,0.006,0.031,11,,,"",,,"Sample","CHLC1002202510032025","Student Project",,2025-08-13,2025-08-13,2025-10-03,,"Florida Lakewatch","21FLKWAT"
"04/29/2025",14:05:00,"EST","10/03/2025",11:30:00,"EST","Marion","Ponar","3","04/29/2025",14:05:00,"EST",0.3,8,19,0.006,0.043,0.019,0.006,0.009,0.035,8,,,"Q","Q",,"Sample","CHLC1002202510032025","Student Project",,2025-04-29,2025-04-29,2025-10-03,"Q","Florida Lakewatch","21FLKWAT"
"08/12/2025",09:39:00,"EST","10/03/2025",11:30:00,"EST","Marion","Canal","1","08/12/2025",09:35:00,"EST",0.5,8,20,0.004,0.067,0.025,0.004,0.006,0.061,3,,,"",,,"Sample","CHLC1002202510032025","Student Project",,2025-08-12,2025-08-12,2025-10-03,,"Florida Lakewatch","21FLKWAT"
"08/12/2025",10:22:00,"EST","10/03/2025",11:30:00,"EST","Marion","Canal","2","08/12/2025",10:21:00,"EST",0.5,8,21,0.007,0.042,0.019,0.007,0.006,0.031,4,,,"",,,"Sample","CHLC1002202510032025","Student Project",,2025-08-12,2025-08-12,2025-10-03,,"Florida Lakewatch","21FLKWAT"
,,,"10/03/2025",11:30:00,"EST",,,"CCV1",,,,0.008,8,22,0.003,0.019,0.008,0.003,0.004,0.013,187,,,"",,,"QAQC","CHLC1002202510032025","Student Project",,,,2025-10-03,,"Florida Lakewatch","21FLKWAT"
,,,"10/03/2025",11:30:00,"EST",,,"MLBK2",,,,1,8,23,0.005,0.007,0.006,0.005,0.005,0.007,1,,,"TI",,"TI","QAQC","CHLC1002202510032025","Student Project",,,,2025-10-03,"U","Florida Lakewatch","21FLKWAT"
"08/12/2025",10:49:00,"EST","10/03/2025",11:30:00,"EST","Marion","Canal","3","08/12/2025",10:47:00,"EST",0.5,8,24,0.008,0.113,0.04,0.008,0.011,0.078,16,,,"",,,"Sample","CHLC1002202510032025","Student Project",,2025-08-12,2025-08-12,2025-10-03,,"Florida Lakewatch","21FLKWAT"
"04/30/2025",09:29:59,"EST","10/03/2025",11:30:00,"EST","Marion","Canal","1","04/30/2025",09:24:00,"EST",0.3,8,25,0.007,0.035,0.017,0.007,0.005,0.024,6,,,"Q","Q",,"Sample","CHLC1002202510032025","Student Project",,2025-04-30,2025-04-30,2025-10-03,"Q","Florida Lakewatch","21FLKWAT"
"04/30/2025",10:12:00,"EST","10/03/2025",11:30:00,"EST","Marion","Canal","2","04/30/2025",10:09:00,"EST",0.3,8,26,0.004,0.022,0.011,0.004,0.006,0.019,4,,,"Q","Q",,"Sample","CHLC1002202510032025","Student Project",,2025-04-30,2025-04-30,2025-10-03,"Q","Florida Lakewatch","21FLKWAT"
"04/30/2025",11:06:00,"EST","10/03/2025",11:30:00,"EST","Marion","Canal","3","04/30/2025",10:59:00,"EST",0.3,8,27,0.004,0.101,0.034,0.004,0.004,0.068,23,,,"Q","Q",,"Sample","CHLC1002202510032025","Student Project",,2025-04-30,2025-04-30,2025-10-03,"Q","Florida Lakewatch","21FLKWAT"
"08/13/2025",13:48:59,"EST","10/03/2025",11:30:00,"EST","Marion","Reservoir","1","08/13/2025",13:46:00,"EST",0.25,8,28,0.003,0.016,0.008,0.003,0.003,0.01,5,,,"",,,"Sample","CHLC1002202510032025","Student Project",,2025-08-13,2025-08-13,2025-10-03,,"Florida Lakewatch","21FLKWAT"
"08/13/2025",14:34:59,"EST","10/03/2025",11:30:00,"EST","Marion","Reservoir","2","08/13/2025",14:32:00,"EST",0.25,8,29,0.007,0.252,0.081,0.007,0.006,0.156,81,,,"",,,"Sample","CHLC1002202510032025","Student Project",,2025-08-13,2025-08-13,2025-10-03,,"Florida Lakewatch","21FLKWAT"
"08/13/2025",16:35:00,"EST","10/03/2025",11:30:00,"EST","Marion","Reservoir","3","08/13/2025",16:35:00,"EST",0.25,8,30,0.005,0.041,0.018,0.005,0.007,0.031,10,,,"",,,"Sample","CHLC1002202510032025","Student Project",,2025-08-13,2025-08-13,2025-10-03,,"Florida Lakewatch","21FLKWAT"
"04/29/2025",13:44:59,"EST","10/03/2025",11:30:00,"EST","Marion","Reservoir","1","04/29/2025",13:39:00,"EST",0.3,8,31,0.002,0.026,0.011,0.002,0.006,0.024,4,,,"Q","Q",,"Sample","CHLC1002202510032025","Student Project",,2025-04-29,2025-04-29,2025-10-03,"Q","Florida Lakewatch","21FLKWAT"
"08/12/2025",12:11:00,"EST","10/03/2025",11:30:00,"EST","Marion","St. Johns","1","08/12/2025",,"EST",0.15,8,32,0.003,0.094,0.029,0.003,0.006,0.064,47,,,"",,,"Sample","CHLC1002202510032025","Student Project",,2025-08-12,2025-08-12,2025-10-03,,"Florida Lakewatch","21FLKWAT"
"08/12/2025",13:16:00,"EST","10/03/2025",11:30:00,"EST","Marion","St. Johns","2","08/12/2025",,"EST",0.15,8,33,0.002,0.066,0.021,0.002,0.005,0.046,33,,,"",,,"Sample","CHLC1002202510032025","Student Project",,2025-08-12,2025-08-12,2025-10-03,,"Florida Lakewatch","21FLKWAT"
"08/12/2025",13:37:00,"EST","10/03/2025",11:30:00,"EST","Marion","St. Johns","3","08/12/2025",,"EST",0.15,8,34,0.004,0.09,0.032,0.004,0.009,0.065,43,,,"",,,"Sample","CHLC1002202510032025","Student Project",,2025-08-12,2025-08-12,2025-10-03,,"Florida Lakewatch","21FLKWAT"
"08/12/2025",14:02:00,"EST","10/03/2025",11:30:00,"EST","Marion","St. Johns","4","08/12/2025",,"EST",0.15,8,35,0.007,0.034,0.018,0.007,0.008,0.027,11,,,"",,,"Sample","CHLC1002202510032025","Student Project",,2025-08-12,2025-08-12,2025-10-03,,"Florida Lakewatch","21FLKWAT"
,,,"10/03/2025",11:30:00,"EST",,,"CCV2",,,,0.008,8,36,0.006,0.022,0.01,0.006,0.006,0.016,160,,,"",,,"Sample","CHLC1002202510032025","Student Project",,,,2025-10-03,,"Florida Lakewatch","21FLKWAT"
,,,"10/03/2025",11:30:00,"EST",,,"CCV2",,,,0.008,8,44,,,,,,,,,,"",,,"QAQC","CHLC1002202510032025","Student Project",,,,2025-10-03,,"Florida Lakewatch","21FLKWAT"
,,,"10/03/2025",11:30:00,"EST",,,"MLBK3",,,,1,8,45,,,,,,,,,,"",,,"QAQC","CHLC1002202510032025","Student Project",,,,2025-10-03,,"Florida Lakewatch","21FLKWAT"
,,,"10/03/2025",11:30:00,"EST",,,"CCV3",,,,0.008,8,66,,,,,,,,,,"",,,"QAQC","CHLC1002202510032025","Student Project",,,,2025-10-03,,"Florida Lakewatch","21FLKWAT"
,,,"10/03/2025",11:30:00,"EST",,,"MLBK4",,,,1,8,67,,,,,,,,,,"",,,"QAQC","CHLC1002202510032025","Student Project",,,,2025-10-03,,"Florida Lakewatch","21FLKWAT"
,,,"10/03/2025",11:30:00,"EST",,,"CCV4",,,,0.008,8,73,,,,,,,,,,"",,,"Sample","CHLC1002202510032025","Student Project",,,,2025-10-03,,"Florida Lakewatch","21FLKWAT"
,,,"10/03/2025",11:30:00,"EST",,,"CCV4",,,,0.008,8,88,,,,,,,,,,"",,,"QAQC","CHLC1002202510032025","Student Project",,,,2025-10-03,,"Florida Lakewatch","21FLKWAT"
,,,"10/03/2025",11:30:00,"EST",,,"MLBK5",,,,1,8,89,,,,,,,,,,"",,,"QAQC","CHLC1002202510032025","Student Project",,,,2025-10-03,,"Florida Lakewatch","21FLKWAT"
,,,"10/03/2025",11:30:00,"EST",,,"CCV5",,,,0.008,8,110,,,,,,,,,,"",,,"QAQC","CHLC1002202510032025","Student Project",,,,2025-10-03,,"Florida Lakewatch","21FLKWAT"
,,,"10/07/2025",09:29:59,"EST",,,"MBLK1",,,,1,8,1,0.002,0.002,0.003,0.002,0.002,0.002,1,,,"TI",,"TI","QAQC","CHLC1006202510072025","Project Coast",,,,2025-10-07,"U","Florida Lakewatch","21FLKWAT"
"09/16/2025",09:25:00,"EST","10/07/2025",09:29:59,"EST","Citrus","CIT-CRY","1","09/16/2025",09:23:00,"EST",0.25,8,2,0.005,0.019,0.01,0.005,0.002,0.014,2,,,"",,,"Sample","CHLC1006202510072025","Project Coast",,2025-09-16,2025-09-16,2025-10-07,,"Florida Lakewatch","21FLKWAT"
"09/16/2025",09:11:00,"EST","10/07/2025",09:29:59,"EST","Citrus","CIT-CRY","2","09/16/2025",09:09:00,"EST",0.25,8,3,0.004,0.019,0.01,0.004,0.001,0.011,4,,,"",,,"Sample","CHLC1006202510072025","Project Coast",,2025-09-16,2025-09-16,2025-10-07,,"Florida Lakewatch","21FLKWAT"
"09/16/2025",08:58:00,"EST","10/07/2025",09:29:59,"EST","Citrus","CIT-CRY","3","09/16/2025",08:56:00,"EST",0.25,8,4,0.002,0.025,0.009,0.002,0.004,0.02,6,,,"",,,"Sample","CHLC1006202510072025","Project Coast",,2025-09-16,2025-09-16,2025-10-07,,"Florida Lakewatch","21FLKWAT"
"09/16/2025",08:34:00,"EST","10/07/2025",09:29:59,"EST","Citrus","CIT-CRY","4","09/16/2025",08:32:00,"EST",0.25,8,5,0.004,0.047,0.017,0.004,0.005,0.033,13,,,"",,,"Sample","CHLC1006202510072025","Project Coast",,2025-09-16,2025-09-16,2025-10-07,,"Florida Lakewatch","21FLKWAT"
"09/16/2025",09:39:59,"EST","10/07/2025",09:29:59,"EST","Citrus","CIT-CRY","5","09/16/2025",09:37:00,"EST",0.25,8,6,0.001,0.012,0.006,0.001,0.004,0.011,3,,,"",,,"Sample","CHLC1006202510072025","Project Coast",,2025-09-16,2025-09-16,2025-10-07,,"Florida Lakewatch","21FLKWAT"
"09/16/2025",09:55:00,"EST","10/07/2025",09:29:59,"EST","Citrus","CIT-CRY","6","09/16/2025",09:32:59,"EST",0.25,8,7,0.005,0.02,0.011,0.005,0.003,0.014,3,,,"",,,"Sample","CHLC1006202510072025","Project Coast",,2025-09-16,2025-09-16,2025-10-07,,"Florida Lakewatch","21FLKWAT"
"09/16/2025",10:59:59,"EST","10/07/2025",09:29:59,"EST","Citrus","CIT-CRY","7","09/16/2025",10:57:59,"EST",0.25,8,8,0.011,0.038,0.022,0.011,0.014,0.033,7,,,"",,,"Sample","CHLC1006202510072025","Project Coast",,2025-09-16,2025-09-16,2025-10-07,,"Florida Lakewatch","21FLKWAT"
"09/16/2025",10:10:00,"EST","10/07/2025",09:29:59,"EST","Citrus","CIT-CRY","8","09/16/2025",10:08:00,"EST",0.25,8,9,0.004,0.029,0.013,0.004,0.004,0.023,5,,,"",,,"Sample","CHLC1006202510072025","Project Coast",,2025-09-16,2025-09-16,2025-10-07,,"Florida Lakewatch","21FLKWAT"
"09/16/2025",10:22:00,"EST","10/07/2025",09:29:59,"EST","Citrus","CIT-CRY","9","09/16/2025",10:20:00,"EST",0.25,8,10,0.005,0.031,0.015,0.005,0.004,0.022,7,,,"",,,"Sample","CHLC1006202510072025","Project Coast",,2025-09-16,2025-09-16,2025-10-07,,"Florida Lakewatch","21FLKWAT"
"09/16/2025",10:44:00,"EST","10/07/2025",09:29:59,"EST","Citrus","CIT-CRY","10","09/16/2025",10:42:00,"EST",0.25,8,11,0.012,0.041,0.024,0.012,0.014,0.034,8,,,"",,,"Sample","CHLC1006202510072025","Project Coast",,2025-09-16,2025-09-16,2025-10-07,,"Florida Lakewatch","21FLKWAT"
"09/11/2025",09:26:00,"EST","10/07/2025",09:29:59,"EST","Citrus","CIT-HOM","1","09/11/2025",09:24:00,"EST",0.25,8,12,0.009,0.022,0.016,0.009,0.013,0.018,7,,,"",,,"Sample","CHLC1006202510072025","Project Coast",,2025-09-11,2025-09-11,2025-10-07,,"Florida Lakewatch","21FLKWAT"
"09/11/2025",10:50:59,"EST","10/07/2025",09:29:59,"EST","Citrus","CIT-HOM","2","09/11/2025",10:49:00,"EST",0.5,8,13,0.01,0.027,0.016,0.01,0.006,0.02,1,,,"U",,"U","Sample","CHLC1006202510072025","Project Coast",,2025-09-11,2025-09-11,2025-10-07,"U","Florida Lakewatch","21FLKWAT"
"09/11/2025",09:10:00,"EST","10/07/2025",09:29:59,"EST","Citrus","CIT-HOM","3","09/11/2025",09:08:00,"EST",0.25,8,14,0.005,0.011,0.008,0.005,0.005,0.01,1,,,"U",,"U","Sample","CHLC1006202510072025","Project Coast",,2025-09-11,2025-09-11,2025-10-07,"U","Florida Lakewatch","21FLKWAT"
"09/11/2025",08:54:00,"EST","10/07/2025",09:29:59,"EST","Citrus","CIT-HOM","4","09/11/2025",08:52:00,"EST",0.25,8,15,0.002,0.026,0.012,0.002,0.006,0.024,5,,,"",,,"Sample","CHLC1006202510072025","Project Coast",,2025-09-11,2025-09-11,2025-10-07,,"Florida Lakewatch","21FLKWAT"
"09/11/2025",07:58:00,"EST","10/07/2025",09:29:59,"EST","Citrus","CIT-HOM","5","09/11/2025",07:56:00,"EST",0.25,8,16,0.005,0.037,0.017,0.005,0.005,0.029,7,,,"",,,"Sample","CHLC1006202510072025","Project Coast",,2025-09-11,2025-09-11,2025-10-07,,"Florida Lakewatch","21FLKWAT"
"09/11/2025",11:56:59,"EST","10/07/2025",09:29:59,"EST","Citrus","CIT-HOM","6","09/11/2025",11:54:59,"EST",0.75,8,17,0.003,0.01,0.007,0.003,0.005,0.01,1,,,"U",,"U","Sample","CHLC1006202510072025","Project Coast",,2025-09-11,2025-09-11,2025-10-07,"U","Florida Lakewatch","21FLKWAT"
"09/11/2025",12:10:00,"EST","10/07/2025",09:29:59,"EST","Citrus","CIT-HOM","7","09/11/2025",12:08:00,"EST",0.25,8,18,0.007,0.02,0.013,0.007,0.005,0.014,3,,,"",,,"Sample","CHLC1006202510072025","Project Coast",,2025-09-11,2025-09-11,2025-10-07,,"Florida Lakewatch","21FLKWAT"
"09/11/2025",14:41:00,"EST","10/07/2025",09:29:59,"EST","Citrus","CIT-HOM","8","09/11/2025",14:39:00,"EST",0.25,8,19,0.004,0.021,0.011,0.004,0.002,0.014,4,,,"",,,"Sample","CHLC1006202510072025","Project Coast",,2025-09-11,2025-09-11,2025-10-07,,"Florida Lakewatch","21FLKWAT"
"09/11/2025",12:20:59,"EST","10/07/2025",09:29:59,"EST","Citrus","CIT-HOM","9","09/11/2025",12:18:59,"EST",0.25,8,20,0.003,0.013,0.007,0.003,0.005,0.012,3,,,"",,,"Sample","CHLC1006202510072025","Project Coast",,2025-09-11,2025-09-11,2025-10-07,,"Florida Lakewatch","21FLKWAT"
"09/11/2025",14:28:00,"EST","10/07/2025",09:29:59,"EST","Citrus","CIT-HOM","10","09/11/2025",14:26:00,"EST",0.25,8,21,0.021,0.03,0.025,0.021,0.023,0.025,6,,,"",,,"Sample","CHLC1006202510072025","Project Coast",,2025-09-11,2025-09-11,2025-10-07,,"Florida Lakewatch","21FLKWAT"
,,,"10/07/2025",09:29:59,"EST",,,"CCV1",,,,0.008,8,22,0.003,0.019,0.007,0.003,0.003,0.014,134,,,"",,,"QAQC","CHLC1006202510072025","Project Coast",,,,2025-10-07,,"Florida Lakewatch","21FLKWAT"
,,,"10/07/2025",09:29:59,"EST",,,"MLBK2",,,,1,8,23,0.003,0.003,0.003,0.003,0.003,0.003,1,,,"TI",,"TI","QAQC","CHLC1006202510072025","Project Coast",,,,2025-10-07,"U","Florida Lakewatch","21FLKWAT"
"09/03/2025",10:38:00,"EST","10/07/2025",09:29:59,"EST","Citrus","CIT-WIT","1","09/03/2025",10:36:00,"EST",0.25,8,24,0.008,0.021,0.014,0.008,0.01,0.02,3,,,"",,,"Sample","CHLC1006202510072025","Project Coast",,2025-09-03,2025-09-03,2025-10-07,,"Florida Lakewatch","21FLKWAT"
"09/03/2025",09:29:00,"EST","10/07/2025",09:29:59,"EST","Citrus","CIT-WIT","2","09/03/2025",09:27:00,"EST",0.25,8,25,0.005,0.031,0.015,0.005,0.004,0.024,5,,,"",,,"Sample","CHLC1006202510072025","Project Coast",,2025-09-03,2025-09-03,2025-10-07,,"Florida Lakewatch","21FLKWAT"
"09/03/2025",08:20:00,"EST","10/07/2025",09:29:59,"EST","Citrus","CIT-WIT","3","09/03/2025",08:18:00,"EST",0.25,8,26,0.008,0.034,0.019,0.008,0.006,0.029,3,,,"",,,"Sample","CHLC1006202510072025","Project Coast",,2025-09-03,2025-09-03,2025-10-07,,"Florida Lakewatch","21FLKWAT"
"09/03/2025",10:56:00,"EST","10/07/2025",09:29:59,"EST","Citrus","CIT-WIT","4","09/03/2025",10:54:00,"EST",0.25,8,27,0.007,0.019,0.012,0.007,0.009,0.017,3,,,"",,,"Sample","CHLC1006202510072025","Project Coast",,2025-09-03,2025-09-03,2025-10-07,,"Florida Lakewatch","21FLKWAT"
"09/03/2025",10:21:00,"EST","10/07/2025",09:29:59,"EST","Citrus","CIT-WIT","5","09/03/2025",10:19:00,"EST",0.25,8,28,0.004,0.016,0.009,0.004,0.006,0.015,3,,,"",,,"Sample","CHLC1006202510072025","Project Coast",,2025-09-03,2025-09-03,2025-10-07,,"Florida Lakewatch","21FLKWAT"
"09/03/2025",10:03:00,"EST","10/07/2025",09:29:59,"EST","Citrus","CIT-WIT","6","09/03/2025",10:01:00,"EST",0.27,8,29,0.003,0.041,0.016,0.003,0.003,0.033,6,,,"",,,"Sample","CHLC1006202510072025","Project Coast",,2025-09-03,2025-09-03,2025-10-07,,"Florida Lakewatch","21FLKWAT"
"09/03/2025",11:09:59,"EST","10/07/2025",09:29:59,"EST","Citrus","CIT-WIT","7","09/03/2025",11:08:00,"EST",0.26,8,30,0.003,0.016,0.008,0.003,0.003,0.012,3,,,"",,,"Sample","CHLC1006202510072025","Project Coast",,2025-09-03,2025-09-03,2025-10-07,,"Florida Lakewatch","21FLKWAT"
"09/03/2025",12:03:00,"EST","10/07/2025",09:29:59,"EST","Citrus","CIT-WIT","8","09/03/2025",12:01:00,"EST",0.25,8,31,0.001,0.024,0.01,0.001,0.003,0.021,4,,,"",,,"Sample","CHLC1006202510072025","Project Coast",,2025-09-03,2025-09-03,2025-10-07,,"Florida Lakewatch","21FLKWAT"
"09/03/2025",11:51:00,"EST","10/07/2025",09:29:59,"EST","Citrus","CIT-WIT","9","09/03/2025",11:49:00,"EST",0.25,8,32,0.003,0.036,0.015,0.003,0.003,0.027,8,,,"",,,"Sample","CHLC1006202510072025","Project Coast",,2025-09-03,2025-09-03,2025-10-07,,"Florida Lakewatch","21FLKWAT"
"09/03/2025",11:29:00,"EST","10/07/2025",09:29:59,"EST","Citrus","CIT-WIT","10","09/03/2025",11:27:00,"EST",0.5,8,33,0.005,0.016,0.011,0.005,0.006,0.014,1,,,"U",,"U","Sample","CHLC1006202510072025","Project Coast",,2025-09-03,2025-09-03,2025-10-07,"U","Florida Lakewatch","21FLKWAT"
"09/11/2025",13:48:59,"EST","10/07/2025",09:29:59,"EST","Hernando","HER-CHA","1","09/11/2025",13:47:00,"EST",0.25,8,34,0.007,0.023,0.013,0.007,0.008,0.02,3,,,"",,,"Sample","CHLC1006202510072025","Project Coast",,2025-09-11,2025-09-11,2025-10-07,,"Florida Lakewatch","21FLKWAT"
"09/11/2025",13:38:00,"EST","10/07/2025",09:29:59,"EST","Hernando","HER-CHA","2","09/11/2025",13:36:00,"EST",0.25,8,35,0.015,0.058,0.031,0.015,0.015,0.044,12,,,"",,,"Sample","CHLC1006202510072025","Project Coast",,2025-09-11,2025-09-11,2025-10-07,,"Florida Lakewatch","21FLKWAT"
"09/11/2025",13:29:00,"EST","10/07/2025",09:29:59,"EST","Hernando","HER-CHA","3","09/11/2025",13:27:00,"EST",0.25,8,36,0.005,0.02,0.012,0.005,0.007,0.019,3,,,"",,,"Sample","CHLC1006202510072025","Project Coast",,2025-09-11,2025-09-11,2025-10-07,,"Florida Lakewatch","21FLKWAT"
"09/11/2025",13:18:00,"EST","10/07/2025",09:29:59,"EST","Hernando","HER-CHA","4","09/11/2025",13:16:00,"EST",0.25,8,37,0.002,0.02,0.009,0.002,0.001,0.014,4,,,"",,,"Sample","CHLC1006202510072025","Project Coast",,2025-09-11,2025-09-11,2025-10-07,,"Florida Lakewatch","21FLKWAT"
"09/11/2025",13:06:59,"EST","10/07/2025",09:29:59,"EST","Hernando","HER-CHA","5","09/11/2025",13:04:59,"EST",0.25,8,38,0.008,0.021,0.013,0.008,0.003,0.012,3,,,"",,,"Sample","CHLC1006202510072025","Project Coast",,2025-09-11,2025-09-11,2025-10-07,,"Florida Lakewatch","21FLKWAT"
"09/11/2025",14:08:00,"EST","10/07/2025",09:29:59,"EST","Hernando","HER-CHA","6","09/11/2025",14:06:00,"EST",0.25,8,39,0.001,0.013,0.006,0.001,0.004,0.012,3,,,"",,,"Sample","CHLC1006202510072025","Project Coast",,2025-09-11,2025-09-11,2025-10-07,,"Florida Lakewatch","21FLKWAT"
"09/11/2025",14:15:00,"EST","10/07/2025",09:29:59,"EST","Hernando","HER-CHA","7","09/11/2025",14:13:00,"EST",0.25,8,40,0.004,0.009,0.006,0.004,0.003,0.007,1,,,"U",,"U","Sample","CHLC1006202510072025","Project Coast",,2025-09-11,2025-09-11,2025-10-07,"U","Florida Lakewatch","21FLKWAT"
"09/11/2025",12:58:00,"EST","10/07/2025",09:29:59,"EST","Hernando","HER-CHA","8","09/11/2025",12:56:00,"EST",0.25,8,41,0.002,0.011,0.006,0.002,0.005,0.011,3,,,"",,,"Sample","CHLC1006202510072025","Project Coast",,2025-09-11,2025-09-11,2025-10-07,,"Florida Lakewatch","21FLKWAT"
"09/11/2025",12:48:00,"EST","10/07/2025",09:29:59,"EST","Hernando","HER-CHA","9","09/11/2025",12:46:00,"EST",0.25,8,42,0.003,0.008,0.006,0.003,0.005,0.006,3,,,"",,,"Sample","CHLC1006202510072025","Project Coast",,2025-09-11,2025-09-11,2025-10-07,,"Florida Lakewatch","21FLKWAT"
"09/11/2025",12:32:00,"EST","10/07/2025",09:29:59,"EST","Hernando","HER-CHA","10","09/11/2025",12:30:00,"EST",0.25,8,43,0,0.006,0.003,0,0.002,0.003,4,,,"",,,"Sample","CHLC1006202510072025","Project Coast",,2025-09-11,2025-09-11,2025-10-07,,"Florida Lakewatch","21FLKWAT"
,,,"10/07/2025",09:29:59,"EST",,,"CCV2",,,,0.008,8,44,0.005,0.02,0.009,0.005,0.003,0.013,134,,,"",,,"QAQC","CHLC1006202510072025","Project Coast",,,,2025-10-07,,"Florida Lakewatch","21FLKWAT"
,,,"10/07/2025",09:29:59,"EST",,,"MLBK3",,,,1,8,45,0.002,0.003,0.003,0.002,0.002,0.002,1,,,"TI",,"TI","QAQC","CHLC1006202510072025","Project Coast",,,,2025-10-07,"U","Florida Lakewatch","21FLKWAT"
"09/25/2025",08:37:00,"EST","10/07/2025",09:29:59,"EST","Hernando","HER-WEE","1","09/25/2025",08:35:00,"EST",2,8,46,0.003,0.013,0.007,0.003,0.004,0.013,1,,,"TI",,"TI","Sample","CHLC1006202510072025","Project Coast",,2025-09-25,2025-09-25,2025-10-07,"U","Florida Lakewatch","21FLKWAT"
"09/25/2025",10:04:00,"EST","10/07/2025",09:29:59,"EST","Hernando","HER-WEE","2","09/25/2025",10:02:00,"EST",0.25,8,47,0.004,0.011,0.008,0.004,0.006,0.007,5,,,"",,,"Sample","CHLC1006202510072025","Project Coast",,2025-09-25,2025-09-25,2025-10-07,,"Florida Lakewatch","21FLKWAT"
"09/25/2025",09:37:00,"EST","10/07/2025",09:29:59,"EST","Hernando","HER-WEE","3","09/25/2025",09:35:00,"EST",0.25,8,48,0.004,0.01,0.007,0.004,0.006,0.007,4,,,"",,,"Sample","CHLC1006202510072025","Project Coast",,2025-09-25,2025-09-25,2025-10-07,,"Florida Lakewatch","21FLKWAT"
"09/25/2025",10:36:00,"EST","10/07/2025",09:29:59,"EST","Hernando","HER-WEE","4","09/25/2025",10:34:00,"EST",0.25,8,49,0.003,0.008,0.005,0.003,0.002,0.006,1,,,"U",,"U","Sample","CHLC1006202510072025","Project Coast",,2025-09-25,2025-09-25,2025-10-07,"U","Florida Lakewatch","21FLKWAT"
"09/25/2025",11:19:00,"EST","10/07/2025",09:29:59,"EST","Hernando","HER-WEE","5","09/25/2025",11:17:00,"EST",0.5,8,50,0.006,0.01,0.007,0.006,0.003,0.006,1,,,"TI",,"TI","Sample","CHLC1006202510072025","Project Coast",,2025-09-25,2025-09-25,2025-10-07,"U","Florida Lakewatch","21FLKWAT"
"09/25/2025",10:50:59,"EST","10/07/2025",09:29:59,"EST","Hernando","HER-WEE","6","09/25/2025",10:49:00,"EST",0.5,8,51,0.003,0.007,0.005,0.003,0.003,0.005,1,,,"U",,"U","Sample","CHLC1006202510072025","Project Coast",,2025-09-25,2025-09-25,2025-10-07,"U","Florida Lakewatch","21FLKWAT"
"09/25/2025",12:02:00,"EST","10/07/2025",09:29:59,"EST","Hernando","HER-WEE","7","09/25/2025",12:00:00,"EST",0.5,8,52,0.002,0.009,0.005,0.002,0.003,0.008,1,,,"U",,"U","Sample","CHLC1006202510072025","Project Coast",,2025-09-25,2025-09-25,2025-10-07,"U","Florida Lakewatch","21FLKWAT"
"09/25/2025",11:54:00,"EST","10/07/2025",09:29:59,"EST","Hernando","HER-WEE","8","09/25/2025",11:52:00,"EST",0.5,8,53,0.002,0.007,0.004,0.002,0.003,0.006,1,,,"U",,"U","Sample","CHLC1006202510072025","Project Coast",,2025-09-25,2025-09-25,2025-10-07,"U","Florida Lakewatch","21FLKWAT"
"09/25/2025",11:42:59,"EST","10/07/2025",09:29:59,"EST","Hernando","HER-WEE","9","09/25/2025",11:41:00,"EST",0.25,8,54,0.002,0.004,0.003,0.002,0.003,0.003,2,,,"",,,"Sample","CHLC1006202510072025","Project Coast",,2025-09-25,2025-09-25,2025-10-07,,"Florida Lakewatch","21FLKWAT"
"09/25/2025",11:32:00,"EST","10/07/2025",09:29:59,"EST","Hernando","HER-WEE","10","09/25/2025",11:30:00,"EST",0.5,8,55,0.002,0.007,0.005,0.002,0.003,0.007,1,,,"TI",,"TI","Sample","CHLC1006202510072025","Project Coast",,2025-09-25,2025-09-25,2025-10-07,"U","Florida Lakewatch","21FLKWAT"
"09/04/2025",12:10:00,"EST","10/07/2025",09:29:59,"EST","Pasco","PAS-ANC","1","09/04/2025",12:08:00,"EST",0.25,8,56,0.002,0.029,0.012,0.002,0.005,0.024,7,,,"",,,"Sample","CHLC1006202510072025","Project Coast",,2025-09-04,2025-09-04,2025-10-07,,"Florida Lakewatch","21FLKWAT"
"09/04/2025",12:35:00,"EST","10/07/2025",09:29:59,"EST","Pasco","PAS-ANC","2","09/04/2025",12:33:00,"EST",0.25,8,57,0.003,0.025,0.012,0.003,0.004,0.02,5,,,"",,,"Sample","CHLC1006202510072025","Project Coast",,2025-09-04,2025-09-04,2025-10-07,,"Florida Lakewatch","21FLKWAT"
"09/04/2025",11:06:00,"EST","10/07/2025",09:29:59,"EST","Pasco","PAS-ANC","3","09/04/2025",11:04:00,"EST",0.25,8,58,0.003,0.01,0.006,0.003,0.005,0.008,3,,,"",,,"Sample","CHLC1006202510072025","Project Coast",,2025-09-04,2025-09-04,2025-10-07,,"Florida Lakewatch","21FLKWAT"
"09/04/2025",12:20:59,"EST","10/07/2025",09:29:59,"EST","Pasco","PAS-ANC","4","09/04/2025",12:18:59,"EST",0.25,8,59,0.003,0.016,0.008,0.003,0.006,0.016,3,,,"",,,"Sample","CHLC1006202510072025","Project Coast",,2025-09-04,2025-09-04,2025-10-07,,"Florida Lakewatch","21FLKWAT"
"09/04/2025",11:30:00,"EST","10/07/2025",09:29:59,"EST","Pasco","PAS-ANC","5","09/04/2025",11:28:00,"EST",0.5,8,60,0.003,0.014,0.008,0.003,0.004,0.013,1,,,"U",,"U","Sample","CHLC1006202510072025","Project Coast",,2025-09-04,2025-09-04,2025-10-07,"U","Florida Lakewatch","21FLKWAT"
"09/04/2025",11:42:59,"EST","10/07/2025",09:29:59,"EST","Pasco","PAS-ANC","6","09/04/2025",11:41:00,"EST",0.25,8,61,0.001,0.01,0.005,0.001,0.004,0.007,5,,,"",,,"Sample","CHLC1006202510072025","Project Coast",,2025-09-04,2025-09-04,2025-10-07,,"Florida Lakewatch","21FLKWAT"
"09/04/2025",11:56:59,"EST","10/07/2025",09:29:59,"EST","Pasco","PAS-ANC","7","09/04/2025",11:54:59,"EST",0.25,8,62,0.005,0.017,0.01,0.005,0.006,0.016,2,,,"",,,"Sample","CHLC1006202510072025","Project Coast",,2025-09-04,2025-09-04,2025-10-07,,"Florida Lakewatch","21FLKWAT"
"09/04/2025",11:16:00,"EST","10/07/2025",09:29:59,"EST","Pasco","PAS-ANC","8","09/04/2025",11:14:00,"EST",0.5,8,63,0.002,0.008,0.005,0.002,0.005,0.005,3,,,"",,,"Sample","CHLC1006202510072025","Project Coast",,2025-09-04,2025-09-04,2025-10-07,,"Florida Lakewatch","21FLKWAT"
"09/04/2025",10:52:00,"EST","10/07/2025",09:29:59,"EST","Pasco","PAS-ANC","9","09/04/2025",10:50:00,"EST",0.25,8,64,0.003,0.021,0.01,0.003,0.004,0.016,5,,,"",,,"Sample","CHLC1006202510072025","Project Coast",,2025-09-04,2025-09-04,2025-10-07,,"Florida Lakewatch","21FLKWAT"
"09/04/2025",12:48:00,"EST","10/07/2025",09:29:59,"EST","Pasco","PAS-ANC","10","09/04/2025",12:46:00,"EST",0.5,8,65,0.003,0.011,0.006,0.003,0.002,0.007,1,,,"U",,"U","Sample","CHLC1006202510072025","Project Coast",,2025-09-04,2025-09-04,2025-10-07,"U","Florida Lakewatch","21FLKWAT"
,,,"10/07/2025",09:29:59,"EST",,,"CCV3",,,,0.008,8,66,0.005,0.021,0.009,0.005,0.004,0.015,134,,,"",,,"QAQC","CHLC1006202510072025","Project Coast",,,,2025-10-07,,"Florida Lakewatch","21FLKWAT"
,,,"10/07/2025",09:29:59,"EST",,,,,,,,8,67,,,,,,,,,,"",,,"QAQC","CHLC1006202510072025","Project Coast",,,,2025-10-07,,"Florida Lakewatch","21FLKWAT"
,,,"10/07/2025",09:29:59,"EST",,,"CCV4",,,,0.008,8,73,,,,,,,,,,"",,,"Sample","CHLC1006202510072025","Project Coast",,,,2025-10-07,,"Florida Lakewatch","21FLKWAT"
,,,"10/07/2025",09:29:59,"EST",,,"CCV4",,,,0.008,8,88,,,,,,,,,,"",,,"QAQC","CHLC1006202510072025","Project Coast",,,,2025-10-07,,"Florida Lakewatch","21FLKWAT"
,,,"10/07/2025",09:29:59,"EST",,,"MLBK5",,,,1,8,89,,,,,,,,,,"",,,"QAQC","CHLC1006202510072025","Project Coast",,,,2025-10-07,,"Florida Lakewatch","21FLKWAT"
,,,"10/07/2025",09:29:59,"EST",,,"CCV5",,,,0.008,8,110,,,,,,,,,,"",,,"QAQC","CHLC1006202510072025","Project Coast",,,,2025-10-07,,"Florida Lakewatch","21FLKWAT"
,,,"08/26/2025",09:29:59,"EST",,,"MBLK1",,,,1,8,1,0.001,0.001,0.001,0.001,0.001,0.001,1,,,"TI",,"TI","QAQC","CHLC0825202508262025",,,,,2025-08-26,"U","Florida Lakewatch","21FLKWAT"
,,,"08/26/2025",09:29:59,"EST",,,"CCV1",,,,0.008,8,22,0.003,0.021,0.008,0.003,-0.001,0.01,187,,,"",,,"QAQC","CHLC0825202508262025",,,,,2025-08-26,,"Florida Lakewatch","21FLKWAT"
,,,"08/26/2025",09:29:59,"EST",,,"MLBK2",,,,1,8,23,0.003,0.005,0.005,0.003,0.004,0.005,1,,,"TI",,"TI","QAQC","CHLC0825202508262025",,,,,2025-08-26,"U","Florida Lakewatch","21FLKWAT"
,,,"08/26/2025",09:29:59,"EST",,,"CCV2",,,,0.008,8,44,0.002,0.02,0.007,0.002,0.002,0.013,187,,,"",,,"QAQC","CHLC0825202508262025",,,,,2025-08-26,,"Florida Lakewatch","21FLKWAT"
,,,"08/26/2025",09:29:59,"EST",,,"MLBK3",,,,1,8,45,0.005,0.008,0.007,0.005,0.005,0.007,1,,,"TI",,"TI","QAQC","CHLC0825202508262025",,,,,2025-08-26,"U","Florida Lakewatch","21FLKWAT"
,,,"08/26/2025",09:29:59,"EST",,,"CCV3",,,,0.008,8,66,0.003,0.018,0.007,0.003,0.006,0.015,160,,,"",,,"QAQC","CHLC0825202508262025",,,,,2025-08-26,,"Florida Lakewatch","21FLKWAT"
,,,"08/26/2025",09:29:59,"EST",,,"MLBK4",,,,1,8,67,0.003,0.004,0.004,0.003,-0.001,0,1,,,"TI",,"TI","QAQC","CHLC0825202508262025",,,,,2025-08-26,"U","Florida Lakewatch","21FLKWAT"
,,,"08/26/2025",09:29:59,"EST",,,"CCV4",,,,0.008,8,72,0.003,0.019,0.007,0.003,0.001,0.011,160,,,"",,,"Sample","CHLC0825202508262025",,,,,2025-08-26,,"Florida Lakewatch","21FLKWAT"
,,,"08/26/2025",09:29:59,"EST",,,"CCV4",,,,0.008,8,88,,,,,,,,,,"",,,"QAQC","CHLC0825202508262025",,,,,2025-08-26,,"Florida Lakewatch","21FLKWAT"
,,,"08/26/2025",09:29:59,"EST",,,"MLBK5",,,,1,8,89,,,,,,,,,,"",,,"QAQC","CHLC0825202508262025",,,,,2025-08-26,,"Florida Lakewatch","21FLKWAT"
,,,"08/26/2025",09:29:59,"EST",,,"CCV5",,,,0.008,8,110,,,,,,,,,,"",,,"QAQC","CHLC0825202508262025",,,,,2025-08-26,,"Florida Lakewatch","21FLKWAT"
,,,"09/23/2025",10:00:00,"EST",,,"MBLK1",,,,1,8,1,0.006,0.007,0.006,0.006,0.002,0.002,1,,,"TI",,"TI","QAQC","CHLC0922202509232025",,,,,2025-09-23,"U","Florida Lakewatch","21FLKWAT"
,,,"09/23/2025",10:00:00,"EST",,,"CCV1",,,,0.008,8,22,0.002,0.023,0.008,0.002,0.003,0.018,160,,,"",,,"QAQC","CHLC0922202509232025",,,,,2025-09-23,,"Florida Lakewatch","21FLKWAT"
,,,"09/23/2025",10:00:00,"EST",,,"MLBK2",,,,1,8,23,0.002,0.004,0.004,0.002,0.002,0.004,1,,,"TI",,"TI","QAQC","CHLC0922202509232025",,,,,2025-09-23,"U","Florida Lakewatch","21FLKWAT"
"07/22/2025",12:02:00,"EST","09/23/2025",10:00:00,"EST","Pasco","Wistana","1","07/22/2025",11:44:00,"EST",0.1,8,33,0.006,0.031,0.015,0.006,0.005,0.022,17,,,"",,,"Sample","CHLC0922202509232025",,,2025-07-22,2025-07-22,2025-09-23,,"Florida Lakewatch","21FLKWAT"
"07/22/2025",12:07:00,"EST","09/23/2025",10:00:00,"EST","Pasco","Wistana","2","07/22/2025",11:33:00,"EST",0.1,8,34,0.003,0.026,0.011,0.003,0.006,0.021,17,,,"",,,"Sample","CHLC0922202509232025",,,2025-07-22,2025-07-22,2025-09-23,,"Florida Lakewatch","21FLKWAT"
"07/22/2025",12:13:00,"EST","09/23/2025",10:00:00,"EST","Pasco","Wistana","3","07/22/2025",11:26:00,"EST",0.1,8,35,0.005,0.028,0.012,0.005,0.003,0.019,15,,,"",,,"Sample","CHLC0922202509232025",,,2025-07-22,2025-07-22,2025-09-23,,"Florida Lakewatch","21FLKWAT"
,,,"09/23/2025",10:00:00,"EST",,,"CCV2",,,,0.008,8,39,0.007,0.027,0.013,0.007,0.004,0.016,214,,,"",,,"Sample","CHLC0922202509232025",,,,,2025-09-23,,"Florida Lakewatch","21FLKWAT"
,,,"09/23/2025",10:00:00,"EST",,,"CCV2",,,,0.008,8,44,,,,,,,,,,"",,,"QAQC","CHLC0922202509232025",,,,,2025-09-23,,"Florida Lakewatch","21FLKWAT"
,,,"09/23/2025",10:00:00,"EST",,,"MLBK3",,,,1,8,45,,,,,,,,,,"",,,"QAQC","CHLC0922202509232025",,,,,2025-09-23,,"Florida Lakewatch","21FLKWAT"
,,,"09/23/2025",10:00:00,"EST",,,"CCV3",,,,0.008,8,66,,,,,,,,,,"",,,"QAQC","CHLC0922202509232025",,,,,2025-09-23,,"Florida Lakewatch","21FLKWAT"
,,,"09/23/2025",10:00:00,"EST",,,"MLBK4",,,,1,8,67,,,,,,,,,,"",,,"QAQC","CHLC0922202509232025",,,,,2025-09-23,,"Florida Lakewatch","21FLKWAT"
,,,"09/23/2025",10:00:00,"EST",,,"CCV4",,,,0.008,8,73,,,,,,,,,,"",,,"Sample","CHLC0922202509232025",,,,,2025-09-23,,"Florida Lakewatch","21FLKWAT"
,,,"09/23/2025",10:00:00,"EST",,,"CCV4",,,,0.008,8,88,,,,,,,,,,"",,,"QAQC","CHLC0922202509232025",,,,,2025-09-23,,"Florida Lakewatch","21FLKWAT"
,,,"09/23/2025",10:00:00,"EST",,,"MLBK5",,,,1,8,89,,,,,,,,,,"",,,"QAQC","CHLC0922202509232025",,,,,2025-09-23,,"Florida Lakewatch","21FLKWAT"
,,,"09/23/2025",10:00:00,"EST",,,"CCV5",,,,0.008,8,110,,,,,,,,,,"",,,"QAQC","CHLC0922202509232025",,,,,2025-09-23,,"Florida Lakewatch","21FLKWAT"
,,,"09/23/2025",12:00:00,"EST",,,"MBLK1",,,,1,8,1,-0.001,-0.001,0,-0.001,0,0,1,,,"TI",,"TI","QAQC","CHLC0922202509232025",,,,,2025-09-23,"U","Florida Lakewatch","21FLKWAT"
,,,"09/23/2025",12:00:00,"EST",,,"CCV1",,,,0.008,8,22,0.003,0.024,0.009,0.003,0.001,0.012,267,,,"",,,"QAQC","CHLC0922202509232025",,,,,2025-09-23,,"Florida Lakewatch","21FLKWAT"
,,,"09/23/2025",12:00:00,"EST",,,"MLBK2",,,,1,8,23,0.005,0.007,0.008,0.005,0.005,0.005,1,,,"TI",,"TI","QAQC","CHLC0922202509232025",,,,,2025-09-23,"U","Florida Lakewatch","21FLKWAT"
"06/15/2025",10:28:00,"CST","09/23/2025",12:00:00,"EST","Bay","Lynn Haven Bayou","1","06/13/2025",10:32:59,"CST",0.7,8,31,0.006,0.019,0.011,0.006,0.005,0.014,1,,,"U",,"U","Sample","CHLC0922202509232025",,,2025-06-13,2025-06-15,2025-09-23,"U","ST. ANDREW BAY RESOURCE MANAGEMENT ASSOCIATION INC.","21FLKWAT"
,,,"09/23/2025",12:00:00,"EST",,,"CCV2",,,,0.008,8,44,0.002,0.022,0.008,0.002,0.004,0.016,214,,,"",,,"QAQC","CHLC0922202509232025",,,,,2025-09-23,,"Florida Lakewatch","21FLKWAT"
,,,"09/23/2025",12:00:00,"EST",,,"MLBK3",,,,1,8,45,0.008,0.01,0.01,0.008,0.008,0.008,1,,,"TI",,"TI","QAQC","CHLC0922202509232025",,,,,2025-09-23,"U","Florida Lakewatch","21FLKWAT"
,,,"09/23/2025",12:00:00,"EST",,,"CCV3",,,,0.008,8,66,0.006,0.026,0.012,0.006,0.002,0.014,214,,,"",,,"QAQC","CHLC0922202509232025",,,,,2025-09-23,,"Florida Lakewatch","21FLKWAT"
,,,"09/23/2025",12:00:00,"EST",,,"MLBK4",,,,1,8,67,0.007,0.01,0.011,0.007,0.007,0.007,1,,,"U",,"U","QAQC","CHLC0922202509232025",,,,,2025-09-23,"U","Florida Lakewatch","21FLKWAT"
,,,"09/23/2025",12:00:00,"EST",,,"CCV4",,,,0.008,8,72,0.007,0.026,0.012,0.007,0.005,0.017,187,,,"",,,"Sample","CHLC0922202509232025",,,,,2025-09-23,,"Florida Lakewatch","21FLKWAT"
,,,"09/23/2025",12:00:00,"EST",,,"CCV4",,,,0.008,8,88,,,,,,,,,,"",,,"QAQC","CHLC0922202509232025",,,,,2025-09-23,,"Florida Lakewatch","21FLKWAT"
,,,"09/23/2025",12:00:00,"EST",,,"MLBK5",,,,1,8,89,,,,,,,,,,"",,,"QAQC","CHLC0922202509232025",,,,,2025-09-23,,"Florida Lakewatch","21FLKWAT"
,,,"09/23/2025",12:00:00,"EST",,,"CCV5",,,,0.008,8,110,,,,,,,,,,"",,,"QAQC","CHLC0922202509232025",,,,,2025-09-23,,"Florida Lakewatch","21FLKWAT"
,,,"09/26/2025",09:29:59,"EST",,,"MBLK1",,,,1,8,1,0.003,0.003,0.004,0.003,0.002,0.002,1,,,"TI",,"TI","QAQC","CHLC0925202509262025",,,,,2025-09-26,"U","Florida Lakewatch","21FLKWAT"
,,,"09/26/2025",09:29:59,"EST",,,"CCV1",,,,0.008,8,22,0.004,0.021,0.009,0.004,0,0.011,160,,,"",,,"QAQC","CHLC0925202509262025",,,,,2025-09-26,,"Florida Lakewatch","21FLKWAT"
,,,"09/26/2025",09:29:59,"EST",,,"MLBK2",,,,1,8,23,0.003,0.004,0.004,0.003,0.003,0.003,1,,,"TI",,"TI","QAQC","CHLC0925202509262025",,,,,2025-09-26,"U","Florida Lakewatch","21FLKWAT"
,,,"09/26/2025",09:29:59,"EST",,,"CCV2",,,,0.008,8,26,0.003,0.02,0.008,0.003,0.001,0.012,160,,,"",,,"Sample","CHLC0925202509262025",,,,,2025-09-26,,"Florida Lakewatch","21FLKWAT"
,,,"09/26/2025",09:29:59,"EST",,,"CCV2",,,,0.008,8,44,,,,,,,,,,"",,,"QAQC","CHLC0925202509262025",,,,,2025-09-26,,"Florida Lakewatch","21FLKWAT"
,,,"09/26/2025",09:29:59,"EST",,,"MLBK3",,,,1,8,45,,,,,,,,,,"",,,"QAQC","CHLC0925202509262025",,,,,2025-09-26,,"Florida Lakewatch","21FLKWAT"
,,,"09/26/2025",09:29:59,"EST",,,"CCV3",,,,0.008,8,66,,,,,,,,,,"",,,"QAQC","CHLC0925202509262025",,,,,2025-09-26,,"Florida Lakewatch","21FLKWAT"
,,,"09/26/2025",09:29:59,"EST",,,"MLBK4",,,,1,8,67,,,,,,,,,,"",,,"QAQC","CHLC0925202509262025",,,,,2025-09-26,,"Florida Lakewatch","21FLKWAT"
,,,"09/26/2025",09:29:59,"EST",,,"CCV4",,,,0.008,8,73,,,,,,,,,,"",,,"Sample","CHLC0925202509262025",,,,,2025-09-26,,"Florida Lakewatch","21FLKWAT"
,,,"09/26/2025",09:29:59,"EST",,,"CCV4",,,,0.008,8,88,,,,,,,,,,"",,,"QAQC","CHLC0925202509262025",,,,,2025-09-26,,"Florida Lakewatch","21FLKWAT"
,,,"09/26/2025",09:29:59,"EST",,,"MLBK5",,,,1,8,89,,,,,,,,,,"",,,"QAQC","CHLC0925202509262025",,,,,2025-09-26,,"Florida Lakewatch","21FLKWAT"
,,,"09/26/2025",09:29:59,"EST",,,"CCV5",,,,0.008,8,110,,,,,,,,,,"",,,"QAQC","CHLC0925202509262025",,,,,2025-09-26,,"Florida Lakewatch","21FLKWAT"
,,,"09/26/2025",12:00:00,"EST",,,"MBLK1",,,,1,8,1,0.002,0.001,0.002,0.002,0.002,0.001,1,,,"TI",,"TI","QAQC","CHLC0925202509262025",,,,,2025-09-26,"U","Florida Lakewatch","21FLKWAT"
,,,"09/26/2025",12:00:00,"EST",,,"CCV1",,,,0.008,8,22,0.006,0.022,0.01,0.006,0.006,0.015,187,,,"",,,"QAQC","CHLC0925202509262025",,,,,2025-09-26,,"Florida Lakewatch","21FLKWAT"
,,,"09/26/2025",12:00:00,"EST",,,"MLBK2",,,,1,8,23,0.002,0.003,0.003,0.002,0.002,0.002,1,,,"TI",,"TI","QAQC","CHLC0925202509262025",,,,,2025-09-26,"U","Florida Lakewatch","21FLKWAT"
,,,"09/26/2025",12:00:00,"EST",,,"CCV2",,,,0.008,8,44,0.006,0.022,0.011,0.006,0.007,0.017,160,,,"",,,"QAQC","CHLC0925202509262025",,,,,2025-09-26,,"Florida Lakewatch","21FLKWAT"
,,,"09/26/2025",12:00:00,"EST",,,"MLBK3",,,,1,8,45,0.005,0.005,0.006,0.005,0.005,0.005,1,,,"TI",,"TI","QAQC","CHLC0925202509262025",,,,,2025-09-26,"U","Florida Lakewatch","21FLKWAT"
,,,"09/26/2025",12:00:00,"EST",,,"CCV3",,,,0.008,8,66,0.006,0.022,0.011,0.006,0.004,0.014,160,,,"",,,"QAQC","CHLC0925202509262025",,,,,2025-09-26,,"Florida Lakewatch","21FLKWAT"
,,,"09/26/2025",12:00:00,"EST",,,"MLBK4",,,,1,8,67,0.005,0.006,0.006,0.005,0.005,0.005,1,,,"TI",,"TI","QAQC","CHLC0925202509262025",,,,,2025-09-26,"U","Florida Lakewatch","21FLKWAT"
,,,"09/26/2025",12:00:00,"EST",,,"CCV4",,,,0.008,8,72,0.005,0.021,0.01,0.005,0.005,0.015,160,,,"",,,"Sample","CHLC0925202509262025",,,,,2025-09-26,,"Florida Lakewatch","21FLKWAT"
,,,"09/26/2025",12:00:00,"EST",,,"CCV4",,,,0.008,8,88,,,,,,,,,,"",,,"QAQC","CHLC0925202509262025",,,,,2025-09-26,,"Florida Lakewatch","21FLKWAT"
,,,"09/26/2025",12:00:00,"EST",,,"MLBK5",,,,1,8,89,,,,,,,,,,"",,,"QAQC","CHLC0925202509262025",,,,,2025-09-26,,"Florida Lakewatch","21FLKWAT"
,,,"09/26/2025",12:00:00,"EST",,,"CCV5",,,,0.008,8,110,,,,,,,,,,"",,,"QAQC","CHLC0925202509262025",,,,,2025-09-26,,"Florida Lakewatch","21FLKWAT"
,,,"09/26/2025",14:29:59,"EST",,,"MBLK1",,,,1,8,1,0.004,0.003,0.004,0.004,0.003,0.003,1,,,"TI",,"TI","QAQC","CHLC0925202509262025",,,,,2025-09-26,"U","Florida Lakewatch","21FLKWAT"
,,,"09/26/2025",14:29:59,"EST",,,"CCV1",,,,0.008,8,22,0.004,0.021,0.01,0.004,0.007,0.017,187,,,"",,,"QAQC","CHLC0925202509262025",,,,,2025-09-26,,"Florida Lakewatch","21FLKWAT"
,,,"09/26/2025",14:29:59,"EST",,,"MLBK2",,,,1,8,23,0.008,0.009,0.009,0.008,0.007,0.008,1,,,"TI",,"TI","QAQC","CHLC0925202509262025",,,,,2025-09-26,"U","Florida Lakewatch","21FLKWAT"
"05/14/2025",12:55:00,"EST","09/26/2025",14:29:59,"EST","Putnam","Rosa","1","05/14/2025",12:34:00,"EST",0.3,8,43,0.005,0.011,0.008,0.005,0.006,0.011,1,,,"U",,"U","Sample","CHLC0925202509262025",,,2025-05-14,2025-05-14,2025-09-26,"U","Florida Lakewatch","21FLKWAT"
,,,"09/26/2025",14:29:59,"EST",,,"CCV2",,,,0.008,8,44,0.002,0.018,0.007,0.002,0.007,0.017,160,,,"",,,"QAQC","CHLC0925202509262025",,,,,2025-09-26,,"Florida Lakewatch","21FLKWAT"
,,,"09/26/2025",14:29:59,"EST",,,"MLBK3",,,,1,8,45,0.002,0.003,0.003,0.002,0.002,0.002,1,,,"TI",,"TI","QAQC","CHLC0925202509262025",,,,,2025-09-26,"U","Florida Lakewatch","21FLKWAT"
"05/14/2025",12:59:59,"EST","09/26/2025",14:29:59,"EST","Putnam","Rosa","2","05/14/2025",12:40:00,"EST",0.3,8,46,0.002,0.007,0.005,0.002,0.003,0.006,1,,,"U",,"U","Sample","CHLC0925202509262025",,,2025-05-14,2025-05-14,2025-09-26,"U","Florida Lakewatch","21FLKWAT"
"05/14/2025",13:03:59,"EST","09/26/2025",14:29:59,"EST","Putnam","Rosa","3","05/14/2025",12:45:00,"EST",0.3,8,47,0.005,0.01,0.008,0.005,0.002,0.006,1,,,"U",,"U","Sample","CHLC0925202509262025",,,2025-05-14,2025-05-14,2025-09-26,"U","Florida Lakewatch","21FLKWAT"
"06/10/2025",13:09:00,"EST","09/26/2025",14:29:59,"EST","Putnam","Rosa","1","06/10/2025",12:37:00,"EST",0.35,8,48,0.002,0.008,0.005,0.002,0.002,0.004,2,,,"",,,"Sample","CHLC0925202509262025",,,2025-06-10,2025-06-10,2025-09-26,,"Florida Lakewatch","21FLKWAT"
"06/10/2025",13:13:00,"EST","09/26/2025",14:29:59,"EST","Putnam","Rosa","2","06/10/2025",12:44:00,"EST",0.3,8,49,0.002,0.005,0.003,0.002,0.002,0.002,2,,,"",,,"Sample","CHLC0925202509262025",,,2025-06-10,2025-06-10,2025-09-26,,"Florida Lakewatch","21FLKWAT"
"06/10/2025",13:17:00,"EST","09/26/2025",14:29:59,"EST","Putnam","Rosa","3","06/10/2025",12:51:00,"EST",0.3,8,50,0.006,0.009,0.007,0.006,0.005,0.008,1,,,"TI",,"TI","Sample","CHLC0925202509262025",,,2025-06-10,2025-06-10,2025-09-26,"U","Florida Lakewatch","21FLKWAT"
,,,"09/26/2025",14:29:59,"EST",,,"CCV3",,,,0.008,8,66,0.005,0.021,0.01,0.005,0.009,0.018,187,,,"",,,"QAQC","CHLC0925202509262025",,,,,2025-09-26,,"Florida Lakewatch","21FLKWAT"
,,,"09/26/2025",14:29:59,"EST",,,"MLBK4",,,,1,8,67,0.006,0.007,0.007,0.006,0.006,0.007,1,,,"TI",,"TI","QAQC","CHLC0925202509262025",,,,,2025-09-26,"U","Florida Lakewatch","21FLKWAT"
,,,"09/26/2025",14:29:59,"EST",,,"CCV4",,,,0.008,8,71,0.001,0.017,0.006,0.001,0.003,0.012,187,,,"",,,"Sample","CHLC0925202509262025",,,,,2025-09-26,,"Florida Lakewatch","21FLKWAT"
,,,"09/26/2025",14:29:59,"EST",,,"CCV4",,,,0.008,8,88,,,,,,,,,,"",,,"QAQC","CHLC0925202509262025",,,,,2025-09-26,,"Florida Lakewatch","21FLKWAT"
,,,"09/26/2025",14:29:59,"EST",,,"MLBK5",,,,1,8,89,,,,,,,,,,"",,,"QAQC","CHLC0925202509262025",,,,,2025-09-26,,"Florida Lakewatch","21FLKWAT"
,,,"09/26/2025",14:29:59,"EST",,,"CCV5",,,,0.008,8,110,,,,,,,,,,"",,,"QAQC","CHLC0925202509262025",,,,,2025-09-26,,"Florida Lakewatch","21FLKWAT"
,,,"10/10/2025",10:00:00,"EST",,,"MBLK1",,,,1,8,1,0.002,0.002,0.002,0.003,0.001,0.001,1,,,"TI",,"TI","QAQC","CHLC1009202510102025",,,,,2025-10-10,"U","Florida Lakewatch","21FLKWAT"
"06/07/2025",13:40:00,"EST","10/10/2025",10:00:00,"EST","Pinellas","Jungle Outlet","2","06/07/2025",12:50:00,"EST",0.5,8,17,0.006,0.421,0.174,0.107,0.006,0.275,62,,,"",,,"Sample","CHLC1009202510102025",,,2025-06-07,2025-06-07,2025-10-10,,"Florida Lakewatch","21FLKWAT"
,,,"10/10/2025",10:00:00,"EST",,,"CCV1",,,,0.008,8,22,0,0.017,0.005,0.005,0.002,0.012,187,,,"",,,"QAQC","CHLC1009202510102025",,,,,2025-10-10,,"Florida Lakewatch","21FLKWAT"
,,,"10/10/2025",10:00:00,"EST",,,"MLBK2",,,,1,8,23,0.002,0.008,0.006,0.006,0.002,0.008,1,,,"TI",,"TI","QAQC","CHLC1009202510102025",,,,,2025-10-10,"U","Florida Lakewatch","21FLKWAT"
,,,"10/10/2025",10:00:00,"EST",,,"CCV2",,,,0.008,8,38,0.003,0.019,0.008,0.007,0.004,0.014,160,,,"",,,"Sample","CHLC1009202510102025",,,,,2025-10-10,,"Florida Lakewatch","21FLKWAT"
,,,"10/10/2025",10:00:00,"EST",,,"CCV2",,,,0.008,8,44,,,,,,,,,,"",,,"QAQC","CHLC1009202510102025",,,,,2025-10-10,,"Florida Lakewatch","21FLKWAT"
,,,"10/10/2025",10:00:00,"EST",,,"MLBK3",,,,1,8,45,,,,,,,,,,"",,,"QAQC","CHLC1009202510102025",,,,,2025-10-10,,"Florida Lakewatch","21FLKWAT"
,,,"10/10/2025",10:00:00,"EST",,,"CCV3",,,,0.008,8,66,,,,,,,,,,"",,,"QAQC","CHLC1009202510102025",,,,,2025-10-10,,"Florida Lakewatch","21FLKWAT"
,,,"10/10/2025",10:00:00,"EST",,,"MLBK4",,,,1,8,67,,,,,,,,,,"",,,"QAQC","CHLC1009202510102025",,,,,2025-10-10,,"Florida Lakewatch","21FLKWAT"
,,,"10/10/2025",10:00:00,"EST",,,"CCV4",,,,0.008,8,73,,,,,,,,,,"",,,"Sample","CHLC1009202510102025",,,,,2025-10-10,,"Florida Lakewatch","21FLKWAT"
,,,"10/10/2025",10:00:00,"EST",,,"CCV4",,,,0.008,8,88,,,,,,,,,,"",,,"QAQC","CHLC1009202510102025",,,,,2025-10-10,,"Florida Lakewatch","21FLKWAT"
,,,"10/10/2025",10:00:00,"EST",,,"MLBK5",,,,1,8,89,,,,,,,,,,"",,,"QAQC","CHLC1009202510102025",,,,,2025-10-10,,"Florida Lakewatch","21FLKWAT"
,,,"10/10/2025",10:00:00,"EST",,,"CCV5",,,,0.008,8,110,,,,,,,,,,"",,,"QAQC","CHLC1009202510102025",,,,,2025-10-10,,"Florida Lakewatch","21FLKWAT"
,,,"10/14/2025",09:29:59,"EST",,,"MBLK1",,,,1,8,1,0.001,0.001,0.002,0.002,0.001,0.001,1,,,"TI",,"TI","QAQC","CHLC1013202510142025",,,,,2025-10-14,"U","Florida Lakewatch","21FLKWAT"
,,,"10/14/2025",09:29:59,"EST",,,"CCV1",,,,0.008,8,22,0.004,0.019,0.007,0.007,0.003,0.013,134,,,"",,,"QAQC","CHLC1013202510142025",,,,,2025-10-14,,"Florida Lakewatch","21FLKWAT"
,,,"10/14/2025",09:29:59,"EST",,,"MLBK2",,,,1,8,23,0.005,0.008,0.008,0.009,0.005,0.008,1,,,"TI",,"TI","QAQC","CHLC1013202510142025",,,,,2025-10-14,"U","Florida Lakewatch","21FLKWAT"
,,,"10/14/2025",09:29:59,"EST",,,"CCV2",,,,0.008,8,43,0.008,0.022,0.01,0.009,0.003,0.013,107,,,"",,,"Sample","CHLC1013202510142025",,,,,2025-10-14,,"Florida Lakewatch","21FLKWAT"
,,,"10/14/2025",09:29:59,"EST",,,,,,,,8,44,,,,,,,,,,"",,,"QAQC","CHLC1013202510142025",,,,,2025-10-14,,"Florida Lakewatch","21FLKWAT"
,,,"10/14/2025",09:29:59,"EST",,,,,,,,8,45,,,,,,,,,,"",,,"QAQC","CHLC1013202510142025",,,,,2025-10-14,,"Florida Lakewatch","21FLKWAT"
,,,"10/14/2025",09:29:59,"EST",,,"CCV3",,,,0.008,8,66,,,,,,,,,,"",,,"QAQC","CHLC1013202510142025",,,,,2025-10-14,,"Florida Lakewatch","21FLKWAT"
,,,"10/14/2025",09:29:59,"EST",,,"MLBK4",,,,1,8,67,,,,,,,,,,"",,,"QAQC","CHLC1013202510142025",,,,,2025-10-14,,"Florida Lakewatch","21FLKWAT"
,,,"10/14/2025",09:29:59,"EST",,,"CCV4",,,,0.008,8,73,,,,,,,,,,"",,,"Sample","CHLC1013202510142025",,,,,2025-10-14,,"Florida Lakewatch","21FLKWAT"
,,,"10/14/2025",09:29:59,"EST",,,"CCV4",,,,0.008,8,88,,,,,,,,,,"",,,"QAQC","CHLC1013202510142025",,,,,2025-10-14,,"Florida Lakewatch","21FLKWAT"
,,,"10/14/2025",09:29:59,"EST",,,"MLBK5",,,,1,8,89,,,,,,,,,,"",,,"QAQC","CHLC1013202510142025",,,,,2025-10-14,,"Florida Lakewatch","21FLKWAT"
,,,"10/14/2025",09:29:59,"EST",,,"CCV5",,,,0.008,8,110,,,,,,,,,,"",,,"QAQC","CHLC1013202510142025",,,,,2025-10-14,,"Florida Lakewatch","21FLKWAT"
,,,"10/24/2025",11:30:00,"EST",,,"MBLK1",,,,1,8,1,0.003,0.003,0.004,0.004,0.003,0.003,1,,,"TI",,"TI","QAQC","CHLC1023202510242025",,,,,2025-10-24,"U","Florida Lakewatch","21FLKWAT"
,,,"10/24/2025",11:30:00,"EST",,,"CCV1",,,,0.008,8,22,0.001,0.017,0.006,0.005,-0.001,0.009,160,,,"",,,"QAQC","CHLC1023202510242025",,,,,2025-10-24,,"Florida Lakewatch","21FLKWAT"
,,,"10/24/2025",11:30:00,"EST",,,"MLBK2",,,,1,8,23,0.005,0.005,0.005,0.005,0.005,0.004,1,,,"TI",,"TI","QAQC","CHLC1023202510242025",,,,,2025-10-24,"U","Florida Lakewatch","21FLKWAT"
,,,"10/24/2025",11:30:00,"EST",,,"CCV2",,,,0.008,8,44,0.001,0.016,0.005,0.005,-0.002,0.007,160,,,"",,,"QAQC","CHLC1023202510242025",,,,,2025-10-24,,"Florida Lakewatch","21FLKWAT"
,,,"10/24/2025",11:30:00,"EST",,,"MLBK3",,,,1,8,45,0.005,0.007,0.007,0.007,0.005,0.005,1,,,"TI",,"TI","QAQC","CHLC1023202510242025",,,,,2025-10-24,"U","Florida Lakewatch","21FLKWAT"
,,,"10/24/2025",11:30:00,"EST",,,"CCV3",,,,0.008,8,66,0.002,0.018,0.007,0.006,0.003,0.012,187,,,"",,,"QAQC","CHLC1023202510242025",,,,,2025-10-24,,"Florida Lakewatch","21FLKWAT"
,,,"10/24/2025",11:30:00,"EST",,,"MLBK4",,,,1,8,67,0.002,0.005,0.004,0.004,0.002,0.003,1,,,"TI",,"TI","QAQC","CHLC1023202510242025",,,,,2025-10-24,"U","Florida Lakewatch","21FLKWAT"
,,,"10/24/2025",11:30:00,"EST",,,"CCV4",,,,0.008,8,73,0.003,0.019,0.008,0.007,0,0.01,160,,,"",,,"Sample","CHLC1023202510242025",,,,,2025-10-24,,"Florida Lakewatch","21FLKWAT"
,,,"10/24/2025",11:30:00,"EST",,,"CCV4",,,,0.008,8,88,,,,,,,,,,"",,,"QAQC","CHLC1023202510242025",,,,,2025-10-24,,"Florida Lakewatch","21FLKWAT"
,,,"10/24/2025",11:30:00,"EST",,,"MLBK5",,,,1,8,89,,,,,,,,,,"",,,"QAQC","CHLC1023202510242025",,,,,2025-10-24,,"Florida Lakewatch","21FLKWAT"
,,,"10/24/2025",11:30:00,"EST",,,"CCV5",,,,0.008,8,110,,,,,,,,,,"",,,"QAQC","CHLC1023202510242025",,,,,2025-10-24,,"Florida Lakewatch","21FLKWAT"
,,,"10/29/2025",11:30:00,"EST",,,"MBLK1",,,,1,8,1,0.003,0.003,0.003,0.003,0.003,0.003,1,,,"TI",,"TI","QAQC","CHLC1027202510292025",,,,,2025-10-29,"U","Florida Lakewatch","21FLKWAT"
,,,"10/29/2025",11:30:00,"EST",,,"CCV1",,,,0.008,8,22,0.003,0.019,0.007,0.007,0.005,0.015,160,,,"",,,"QAQC","CHLC1027202510292025",,,,,2025-10-29,,"Florida Lakewatch","21FLKWAT"
,,,"10/29/2025",11:30:00,"EST",,,"MBLK2",,,,1,8,23,0.005,0.008,0.008,0.008,0.005,0.006,1,,,"TI",,"TI","QAQC","CHLC1027202510292025",,,,,2025-10-29,"U","Florida Lakewatch","21FLKWAT"
,,,"10/29/2025",11:30:00,"EST",,,"CCV2",,,,0.008,8,44,0.007,0.022,0.011,0.01,0.001,0.011,134,,,"",,,"QAQC","CHLC1027202510292025",,,,,2025-10-29,,"Florida Lakewatch","21FLKWAT"
,,,"10/29/2025",11:30:00,"EST",,,"MBLK3",,,,1,8,45,0.003,0.005,0.004,0.004,0.003,0.004,1,,,"TI",,"TI","QAQC","CHLC1027202510292025",,,,,2025-10-29,"U","Florida Lakewatch","21FLKWAT"
,,,"10/29/2025",11:30:00,"EST",,,"CCV3",,,,0.008,8,66,0.005,0.021,0.01,0.009,0,0.01,160,,,"",,,"QAQC","CHLC1027202510292025",,,,,2025-10-29,,"Florida Lakewatch","21FLKWAT"
,,,"10/29/2025",11:30:00,"EST",,,"MBLK4",,,,1,8,67,0,0.002,0.002,0.002,0,0.001,1,,,"TI",,"TI","QAQC","CHLC1027202510292025",,,,,2025-10-29,"U","Florida Lakewatch","21FLKWAT"
,,,"10/29/2025",11:30:00,"EST",,,"CCV4",,,,0.008,8,72,-0.002,0.013,0.003,0.002,0,0.009,160,,,"",,,"Sample","CHLC1027202510292025",,,,,2025-10-29,,"Florida Lakewatch","21FLKWAT"
,,,"10/29/2025",11:30:00,"EST",,,"CCV4",,,,0.008,8,88,,,,,,,,,,"",,,"QAQC","CHLC1027202510292025",,,,,2025-10-29,,"Florida Lakewatch","21FLKWAT"
,,,"10/29/2025",11:30:00,"EST",,,"MBLK5",,,,1,8,89,,,,,,,,,,"",,,"QAQC","CHLC1027202510292025",,,,,2025-10-29,,"Florida Lakewatch","21FLKWAT"
,,,"10/29/2025",11:30:00,"EST",,,"CCV5",,,,0.008,8,110,,,,,,,,,,"",,,"QAQC","CHLC1027202510292025",,,,,2025-10-29,,"Florida Lakewatch","21FLKWAT"
,,,"10/30/2025",13:00:00,"EST",,,"MBLK1",,,,1,8,1,0.002,0.003,0.003,0.003,0.002,0.002,1,,,"TI",,"TI","QAQC","CHLC1029202510302025",,,,,2025-10-30,"U","Florida Lakewatch","21FLKWAT"
,,,"10/30/2025",13:00:00,"EST",,,"CCV1",,,,0.008,8,22,0.001,0.019,0.007,0.006,0,0.013,134,,,"",,,"QAQC","CHLC1029202510302025",,,,,2025-10-30,,"Florida Lakewatch","21FLKWAT"
,,,"10/30/2025",13:00:00,"EST",,,"MBLK2",,,,1,8,23,0.004,0.004,0.004,0.004,0.004,0.004,1,,,"TI",,"TI","QAQC","CHLC1029202510302025",,,,,2025-10-30,"U","Florida Lakewatch","21FLKWAT"
"08/20/2025",15:36:00,"EST","10/30/2025",13:00:00,"EST","Pasco","Blanton","4","08/20/2025",14:22:00,"EST",0.2,8,37,0.009,0.079,0.033,0.026,0.007,0.054,25,,,"",,,"Sample","CHLC1029202510302025",,,2025-08-20,2025-08-20,2025-10-30,,"Florida Lakewatch","21FLKWAT"
"09/17/2025",15:30:00,"EST","10/30/2025",13:00:00,"EST","Pasco","Blanton","4","09/17/2025",14:18:00,"EST",0.2,8,41,0.003,0.058,0.022,0.017,0.001,0.038,19,,,"",,,"Sample","CHLC1029202510302025",,,2025-09-17,2025-09-17,2025-10-30,,"Florida Lakewatch","21FLKWAT"
,,,"10/30/2025",13:00:00,"EST",,,"CCV2",,,,0.008,8,44,-0.002,0.013,0.003,0.002,0.001,0.01,160,,,"",,,"QAQC","CHLC1029202510302025",,,,,2025-10-30,,"Florida Lakewatch","21FLKWAT"
,,,"10/30/2025",13:00:00,"EST",,,"MBLK3",,,,1,8,45,0.001,0.003,0.002,0.003,0.001,0.002,1,,,"TI",,"TI","QAQC","CHLC1029202510302025",,,,,2025-10-30,"U","Florida Lakewatch","21FLKWAT"
,,,"10/30/2025",13:00:00,"EST",,,"CCV3",,,,0.008,8,66,0.001,0.017,0.006,0.005,0.002,0.012,160,,,"",,,"QAQC","CHLC1029202510302025",,,,,2025-10-30,,"Florida Lakewatch","21FLKWAT"
,,,"10/30/2025",13:00:00,"EST",,,"MBLK4",,,,1,8,67,0.004,0.007,0.007,0.007,0.003,0.006,1,,,"TI",,"TI","QAQC","CHLC1029202510302025",,,,,2025-10-30,"U","Florida Lakewatch","21FLKWAT"
,,,"10/30/2025",13:00:00,"EST",,,"CCV4",,,,0.008,8,73,0.001,0.016,0.006,0.005,0.003,0.013,134,,,"",,,"Sample","CHLC1029202510302025",,,,,2025-10-30,,"Florida Lakewatch","21FLKWAT"
,,,"10/30/2025",13:00:00,"EST",,,"CCV4",,,,0.008,8,88,,,,,,,,,,"",,,"QAQC","CHLC1029202510302025",,,,,2025-10-30,,"Florida Lakewatch","21FLKWAT"
,,,"10/30/2025",13:00:00,"EST",,,"MBLK5",,,,1,8,89,,,,,,,,,,"",,,"QAQC","CHLC1029202510302025",,,,,2025-10-30,,"Florida Lakewatch","21FLKWAT"
,,,"10/30/2025",13:00:00,"EST",,,"CCV5",,,,0.008,8,110,,,,,,,,,,"",,,"QAQC","CHLC1029202510302025",,,,,2025-10-30,,"Florida Lakewatch","21FLKWAT"
,,,"10/31/2025",10:00:00,"EST",,,"MBLK1",,,,1,8,1,0.001,0.001,0.002,0.003,0.001,0.001,1,,,"TI",,"TI","QAQC","CHLC1030202510312025",,,,,2025-10-31,"U","Florida Lakewatch","21FLKWAT"
,,,"10/31/2025",10:00:00,"EST",,,"CCV1",,,,0.008,8,22,0.004,0.022,0.01,0.009,0.004,0.017,134,,,"",,,"QAQC","CHLC1030202510312025",,,,,2025-10-31,,"Florida Lakewatch","21FLKWAT"
,,,"10/31/2025",10:00:00,"EST",,,"MBLK2",,,,1,8,23,0.005,0.005,0.005,0.005,0.004,0.005,1,,,"TI",,"TI","QAQC","CHLC1030202510312025",,,,,2025-10-31,"U","Florida Lakewatch","21FLKWAT"
,,,"10/31/2025",10:00:00,"EST",,,"CCV2",,,,0.008,8,44,-0.001,0.014,0.004,0.003,0,0.008,187,,,"",,,"QAQC","CHLC1030202510312025",,,,,2025-10-31,,"Florida Lakewatch","21FLKWAT"
,,,"10/31/2025",10:00:00,"EST",,,"MBLK3",,,,1,8,45,0.004,0.007,0.006,0.007,0.005,0.006,1,,,"TI",,"TI","QAQC","CHLC1030202510312025",,,,,2025-10-31,"U","Florida Lakewatch","21FLKWAT"
,,,"10/31/2025",10:00:00,"EST",,,"CCV3",,,,0.008,8,66,-0.002,0.012,0.002,0.001,0.002,0.012,107,,,"",,,"QAQC","CHLC1030202510312025",,,,,2025-10-31,,"Florida Lakewatch","21FLKWAT"
,,,"10/31/2025",10:00:00,"EST",,,"MBLK4",,,,1,8,67,0.007,0.009,0.009,0.01,0.006,0.009,1,,,"TI",,"TI","QAQC","CHLC1030202510312025",,,,,2025-10-31,"U","Florida Lakewatch","21FLKWAT"
,,,"10/31/2025",10:00:00,"EST",,,"CCV4",,,,0.008,8,73,0.002,0.015,0.007,0.005,0.002,0.009,160,,,"",,,"Sample","CHLC1030202510312025",,,,,2025-10-31,,"Florida Lakewatch","21FLKWAT"
,,,"10/31/2025",10:00:00,"EST",,,"CCV4",,,,0.008,8,88,,,,,,,,,,"",,,"QAQC","CHLC1030202510312025",,,,,2025-10-31,,"Florida Lakewatch","21FLKWAT"
,,,"10/31/2025",10:00:00,"EST",,,"MBLK5",,,,1,8,89,,,,,,,,,,"",,,"QAQC","CHLC1030202510312025",,,,,2025-10-31,,"Florida Lakewatch","21FLKWAT"
,,,"10/31/2025",10:00:00,"EST",,,"CCV5",,,,0.008,8,110,,,,,,,,,,"",,,"QAQC","CHLC1030202510312025",,,,,2025-10-31,,"Florida Lakewatch","21FLKWAT"
,,,"10/31/2025",13:00:00,"EST",,,"MBLK1",,,,1,8,1,0,0.001,0.001,0.001,0,0,1,,,"TI",,"TI","QAQC","CHLC1030202510312025",,,,,2025-10-31,"U","Florida Lakewatch","21FLKWAT"
,,,"10/31/2025",13:00:00,"EST",,,"CCV1",,,,0.008,8,22,0.004,0.018,0.008,0.007,0.004,0.013,134,,,"",,,"QAQC","CHLC1030202510312025",,,,,2025-10-31,,"Florida Lakewatch","21FLKWAT"
,,,"10/31/2025",13:00:00,"EST",,,"MBLK2",,,,1,8,23,0.005,0.005,0.005,0.005,0.005,0.005,1,,,"TI",,"TI","QAQC","CHLC1030202510312025",,,,,2025-10-31,"U","Florida Lakewatch","21FLKWAT"
,,,"10/31/2025",13:00:00,"EST",,,"CCV2",,,,0.008,8,44,0.003,0.019,0.009,0.008,0.003,0.01,240,,,"",,,"QAQC","CHLC1030202510312025",,,,,2025-10-31,,"Florida Lakewatch","21FLKWAT"
,,,"10/31/2025",13:00:00,"EST",,,"MBLK3",,,,1,8,45,-0.001,0.002,0.001,0.001,0,0.001,1,,,"TI",,"TI","QAQC","CHLC1030202510312025",,,,,2025-10-31,"U","Florida Lakewatch","21FLKWAT"
,,,"10/31/2025",13:00:00,"EST",,,"CCV3",,,,0.008,8,66,0.001,0.015,0.005,0.004,0.001,0.011,107,,,"",,,"QAQC","CHLC1030202510312025",,,,,2025-10-31,,"Florida Lakewatch","21FLKWAT"
,,,"10/31/2025",13:00:00,"EST",,,"MBLK4",,,,1,8,67,0.005,0.005,0.005,0.005,0.005,0.005,1,,,"TI",,"TI","QAQC","CHLC1030202510312025",,,,,2025-10-31,"U","Florida Lakewatch","21FLKWAT"
,,,"10/31/2025",13:00:00,"EST",,,"CCV4",,,,0.008,8,71,0.004,0.017,0.008,0.007,0.004,0.009,214,,,"",,,"Sample","CHLC1030202510312025",,,,,2025-10-31,,"Florida Lakewatch","21FLKWAT"
,,,"10/31/2025",13:00:00,"EST",,,"CCV4",,,,0.008,8,88,,,,,,,,,,"",,,"QAQC","CHLC1030202510312025",,,,,2025-10-31,,"Florida Lakewatch","21FLKWAT"
,,,"10/31/2025",13:00:00,"EST",,,"MBLK5",,,,1,8,89,,,,,,,,,,"",,,"QAQC","CHLC1030202510312025",,,,,2025-10-31,,"Florida Lakewatch","21FLKWAT"
,,,"10/31/2025",13:00:00,"EST",,,"CCV5",,,,0.008,8,110,,,,,,,,,,"",,,"QAQC","CHLC1030202510312025",,,,,2025-10-31,,"Florida Lakewatch","21FLKWAT"
,,,"10/07/2025",12:00:00,"EST",,,"MBLK1",,,,1,8,1,0.005,0.006,0.006,0.007,0.005,0.005,1,,,"TI",,"TI","QAQC","CHLC1006202510072025",,,,,2025-10-07,"U","Florida Lakewatch","21FLKWAT"
"09/10/2025",10:52:00,"EST","10/07/2025",12:00:00,"EST","Pasco","PAS-ARI","1","09/10/2025",10:50:00,"EST",0.25,8,2,0.004,0.006,0.006,0.006,0.003,0.003,2,,,"",,,"Sample","CHLC1006202510072025",,,2025-09-10,2025-09-10,2025-10-07,,"Florida Lakewatch","21FLKWAT"
"09/10/2025",10:23:00,"EST","10/07/2025",12:00:00,"EST","Pasco","PAS-ARI","2","09/10/2025",10:21:00,"EST",0.25,8,3,0.005,0.008,0.006,0.006,0.004,0.007,1,,,"TI",,"TI","Sample","CHLC1006202510072025",,,2025-09-10,2025-09-10,2025-10-07,"U","Florida Lakewatch","21FLKWAT"
"09/10/2025",10:40:00,"EST","10/07/2025",12:00:00,"EST","Pasco","PAS-ARI","3","09/10/2025",10:38:00,"EST",0.25,8,4,0.002,0.008,0.004,0.004,0.002,0.004,3,,,"",,,"Sample","CHLC1006202510072025",,,2025-09-10,2025-09-10,2025-10-07,,"Florida Lakewatch","21FLKWAT"
"09/10/2025",11:40:00,"EST","10/07/2025",12:00:00,"EST","Pasco","PAS-ARI","4","09/10/2025",11:38:00,"EST",0.25,8,5,0.003,0.006,0.005,0.005,0.003,0.003,3,,,"",,,"Sample","CHLC1006202510072025",,,2025-09-10,2025-09-10,2025-10-07,,"Florida Lakewatch","21FLKWAT"
"09/10/2025",10:02:00,"EST","10/07/2025",12:00:00,"EST","Pasco","PAS-ARI","5","09/10/2025",10:00:00,"EST",0.25,8,6,0.005,0.011,0.007,0.006,0.005,0.01,1,,,"U",,"U","Sample","CHLC1006202510072025",,,2025-09-10,2025-09-10,2025-10-07,"U","Florida Lakewatch","21FLKWAT"
"09/10/2025",11:50:00,"EST","10/07/2025",12:00:00,"EST","Pasco","PAS-ARI","6","09/10/2025",11:48:00,"EST",0.5,8,7,0.006,0.012,0.009,0.009,0.007,0.012,1,,,"TI",,"TI","Sample","CHLC1006202510072025",,,2025-09-10,2025-09-10,2025-10-07,"U","Florida Lakewatch","21FLKWAT"
"09/10/2025",09:48:00,"EST","10/07/2025",12:00:00,"EST","Pasco","PAS-ARI","7","09/10/2025",09:46:00,"EST",0.25,8,8,0.021,0.03,0.026,0.026,0.018,0.025,2,,,"",,,"Sample","CHLC1006202510072025",,,2025-09-10,2025-09-10,2025-10-07,,"Florida Lakewatch","21FLKWAT"
"09/10/2025",11:06:00,"EST","10/07/2025",12:00:00,"EST","Pasco","PAS-ARI","8","09/10/2025",11:04:00,"EST",0.25,8,9,0.006,0.011,0.009,0.009,0.007,0.008,3,,,"",,,"Sample","CHLC1006202510072025",,,2025-09-10,2025-09-10,2025-10-07,,"Florida Lakewatch","21FLKWAT"
"09/10/2025",11:18:00,"EST","10/07/2025",12:00:00,"EST","Pasco","PAS-ARI","9","09/10/2025",11:16:00,"EST",0.25,8,10,0.007,0.013,0.01,0.01,0.01,0.01,5,,,"",,,"Sample","CHLC1006202510072025",,,2025-09-10,2025-09-10,2025-10-07,,"Florida Lakewatch","21FLKWAT"
"09/10/2025",11:28:00,"EST","10/07/2025",12:00:00,"EST","Pasco","PAS-ARI","10","09/10/2025",11:26:00,"EST",0.5,8,11,0.006,0.013,0.01,0.009,0.007,0.012,1,,,"U",,"U","Sample","CHLC1006202510072025",,,2025-09-10,2025-09-10,2025-10-07,"U","Florida Lakewatch","21FLKWAT"
"09/10/2025",12:03:00,"EST","10/07/2025",12:00:00,"EST","Pasco","PAS-HUD","1","09/10/2025",12:01:00,"EST",0.5,8,12,0.007,0.012,0.01,0.01,0.009,0.009,2,,,"",,,"Sample","CHLC1006202510072025",,,2025-09-10,2025-09-10,2025-10-07,,"Florida Lakewatch","21FLKWAT"
"09/10/2025",09:33:00,"EST","10/07/2025",12:00:00,"EST","Pasco","PAS-HUD","2","09/10/2025",09:31:00,"EST",0.25,8,13,0.007,0.011,0.009,0.009,0.005,0.009,1,,,"TI",,"TI","Sample","CHLC1006202510072025",,,2025-09-10,2025-09-10,2025-10-07,"U","Florida Lakewatch","21FLKWAT"
"09/10/2025",12:15:00,"EST","10/07/2025",12:00:00,"EST","Pasco","PAS-HUD","3","09/10/2025",12:13:00,"EST",0.5,8,14,0.01,0.013,0.012,0.012,0.005,0.007,1,,,"TI",,"TI","Sample","CHLC1006202510072025",,,2025-09-10,2025-09-10,2025-10-07,"U","Florida Lakewatch","21FLKWAT"
"09/10/2025",09:16:00,"EST","10/07/2025",12:00:00,"EST","Pasco","PAS-HUD","4","09/10/2025",09:14:00,"EST",0.5,8,15,0.007,0.016,0.011,0.011,0.009,0.014,2,,,"",,,"Sample","CHLC1006202510072025",,,2025-09-10,2025-09-10,2025-10-07,,"Florida Lakewatch","21FLKWAT"
"09/10/2025",09:03:00,"EST","10/07/2025",12:00:00,"EST","Pasco","PAS-HUD","5","09/10/2025",09:01:00,"EST",0.25,8,16,0.006,0.013,0.009,0.009,0.005,0.01,2,,,"",,,"Sample","CHLC1006202510072025",,,2025-09-10,2025-09-10,2025-10-07,,"Florida Lakewatch","21FLKWAT"
"09/10/2025",12:26:00,"EST","10/07/2025",12:00:00,"EST","Pasco","PAS-HUD","6","09/10/2025",12:24:00,"EST",0.5,8,17,0.032,0.04,0.039,0.041,0.031,0.037,1,,,"U",,"U","Sample","CHLC1006202510072025",,,2025-09-10,2025-09-10,2025-10-07,"U","Florida Lakewatch","21FLKWAT"
"09/10/2025",13:18:00,"EST","10/07/2025",12:00:00,"EST","Pasco","PAS-HUD","7","09/10/2025",13:16:00,"EST",0.25,8,18,0.004,0.011,0.008,0.007,0.004,0.008,3,,,"",,,"Sample","CHLC1006202510072025",,,2025-09-10,2025-09-10,2025-10-07,,"Florida Lakewatch","21FLKWAT"
