"Preparation_Date","Preparation_Time","Preparation_Time_Zone","Analysis_Date","Analysis_Time","Analysis_Time_Zone","County","Lake","Station","Activity_Start_Date","Tube_Number","Dilution","Abs","Result_Value(PCU)","Result_Comments","QAQC_Qualifier","WIN_Value_Qualifier","Holding_Qualifier","MDL_PQL_Qualifier","Data_Category","Run_ID","Study","Comments","StartDate","PrepDate","AnDate","Org_Result_Value","Sampling_Agency_Name","Project_ID"
"10/14/25",15:40:00,"EST","10/15/25",11:39:00,"EST",,,"MBLK1",,,1,0,0,,,"QU","Q","TI","QAQC","COL1014202510152025","Student Project",,,2025-10-14,2025-10-15,"1","Florida Lakewatch","21FLKWAT"
"10/14/25",15:40:00,"EST","10/15/25",11:39:00,"EST","Marion","Downstream Fall_Belchior_Student","1","8/13/25",,1,0.1,73,,,"",,,"Sample","COL1014202510152025","Student Project",,2025-08-13,2025-10-14,2025-10-15,"73","Florida Lakewatch","21FLKWAT"
"10/14/25",15:40:00,"EST","10/15/25",11:39:00,"EST","Marion","Downstream Fall_Belchior_Student","2","8/13/25",,1,0.094,69,,,"",,,"Sample","COL1014202510152025","Student Project",,2025-08-13,2025-10-14,2025-10-15,"69","Florida Lakewatch","21FLKWAT"
"10/14/25",15:40:00,"EST","10/15/25",11:39:00,"EST","Marion","Downstream Spring_Belchior_Student","1","4/29/25",,1,0.035,26,,,"Q","Q",,"Sample","COL1014202510152025","Student Project",,2025-04-29,2025-10-14,2025-10-15,"26","Florida Lakewatch","21FLKWAT"
"10/14/25",15:40:00,"EST","10/15/25",11:39:00,"EST","Marion","Downstream Spring_Belchior_Student","2","4/29/25",,1,0.029,21,,,"Q","Q",,"Sample","COL1014202510152025","Student Project",,2025-04-29,2025-10-14,2025-10-15,"21","Florida Lakewatch","21FLKWAT"
"10/14/25",15:40:00,"EST","10/15/25",11:39:00,"EST","Marion","Downstream Spring_Belchior_Student","3","4/30/25",,1,0.085,62,,,"Q","Q",,"Sample","COL1014202510152025","Student Project",,2025-04-30,2025-10-14,2025-10-15,"62","Florida Lakewatch","21FLKWAT"
"10/14/25",15:40:00,"EST","10/15/25",11:39:00,"EST","Marion","Downstream Spring_Belchior_Student","4","4/30/25",,1,0.085,62,,,"Q","Q",,"Sample","COL1014202510152025","Student Project",,2025-04-30,2025-10-14,2025-10-15,"62","Florida Lakewatch","21FLKWAT"
"10/14/25",15:40:00,"EST","10/15/25",11:39:00,"EST","Marion","Downstream Spring_Belchior_Student","5","4/30/25",,1,0.093,68,,,"Q","Q",,"Sample","COL1014202510152025","Student Project",,2025-04-30,2025-10-14,2025-10-15,"68","Florida Lakewatch","21FLKWAT"
"10/14/25",15:40:00,"EST","10/15/25",11:39:00,"EST","Marion","Downstream Spring_Belchior_Student","6","4/30/25",,1,0.114,84,,,"Q","Q",,"Sample","COL1014202510152025","Student Project",,2025-04-30,2025-10-14,2025-10-15,"84","Florida Lakewatch","21FLKWAT"
"10/14/25",15:40:00,"EST","10/15/25",11:39:00,"EST","Marion","Upstream Fall_Belchior_Student","1","8/13/25",,1,0.071,52,,,"",,,"Sample","COL1014202510152025","Student Project",,2025-08-13,2025-10-14,2025-10-15,"52","Florida Lakewatch","21FLKWAT"
"10/14/25",15:40:00,"EST","10/15/25",11:39:00,"EST","Marion","Upstream Fall_Belchior_Student","2","8/13/25",,1,0.036,26,,,"",,,"Sample","COL1014202510152025","Student Project",,2025-08-13,2025-10-14,2025-10-15,"26","Florida Lakewatch","21FLKWAT"
"10/14/25",15:40:00,"EST","10/15/25",11:39:00,"EST","Marion","Upstream Fall_Belchior_Student","3","8/13/25",,1,0.035,26,,,"",,,"Sample","COL1014202510152025","Student Project",,2025-08-13,2025-10-14,2025-10-15,"26","Florida Lakewatch","21FLKWAT"
"10/14/25",15:40:00,"EST","10/15/25",11:39:00,"EST","Marion","Upstream Fall_Belchior_Student","4","8/13/25",,1,0.047,34,,,"",,,"Sample","COL1014202510152025","Student Project",,2025-08-13,2025-10-14,2025-10-15,"34","Florida Lakewatch","21FLKWAT"
"10/14/25",15:40:00,"EST","10/15/25",11:39:00,"EST","Marion","Upstream Spring_Belchior_Student","1","4/29/25",,1,0.069,51,,,"Q","Q",,"Sample","COL1014202510152025","Student Project",,2025-04-29,2025-10-14,2025-10-15,"51","Florida Lakewatch","21FLKWAT"
"10/14/25",15:40:00,"EST","10/15/25",11:39:00,"EST","Marion","Upstream Spring_Belchior_Student","2","4/29/25",,1,0.008,6,,,"Q","Q",,"Sample","COL1014202510152025","Student Project",,2025-04-29,2025-10-14,2025-10-15,"6","Florida Lakewatch","21FLKWAT"
"10/14/25",15:40:00,"EST","10/15/25",11:39:00,"EST","Marion","Upstream Spring_Belchior_Student","3","4/29/25",,1,0.007,5,,,"Q","Q",,"Sample","COL1014202510152025","Student Project",,2025-04-29,2025-10-14,2025-10-15,"5","Florida Lakewatch","21FLKWAT"
"10/14/25",15:40:00,"EST","10/15/25",11:39:00,"EST","Marion","Upstream Spring_Belchior_Student","4","4/29/25",,1,0.007,5,,,"Q","Q",,"Sample","COL1014202510152025","Student Project",,2025-04-29,2025-10-14,2025-10-15,"5","Florida Lakewatch","21FLKWAT"
"10/14/25",15:40:00,"EST","10/15/25",11:39:00,"EST","Marion","Ponar Fall_Belchior_Student","1","8/13/25",,1,0.086,63,,,"",,,"Sample","COL1014202510152025","Student Project",,2025-08-13,2025-10-14,2025-10-15,"63","Florida Lakewatch","21FLKWAT"
"10/14/25",15:40:00,"EST","10/15/25",11:39:00,"EST","Marion","Ponar Fall_Belchior_Student","2","8/13/25",,1,0.096,70,,,"",,,"Sample","COL1014202510152025","Student Project",,2025-08-13,2025-10-14,2025-10-15,"70","Florida Lakewatch","21FLKWAT"
"10/14/25",15:40:00,"EST","10/15/25",11:39:00,"EST","Marion","Ponar Fall_Belchior_Student","3","8/13/25",,1,0.077,56,,,"",,,"Sample","COL1014202510152025","Student Project",,2025-08-13,2025-10-14,2025-10-15,"56","Florida Lakewatch","21FLKWAT"
"10/14/25",15:40:00,"EST","10/15/25",11:39:00,"EST","Marion","Ponar Fall_Belchior_Student","DUP1","8/13/25",,1,0.077,56,,,"",,,"QAQC","COL1014202510152025","Student Project",,2025-08-13,2025-10-14,2025-10-15,"56","Florida Lakewatch","21FLKWAT"
"10/14/25",15:40:00,"EST","10/15/25",11:39:00,"EST",,,"ALTQC1",,,1,0.024,17,,,"Q","Q",,"QAQC","COL1014202510152025","Student Project",,,2025-10-14,2025-10-15,"17","Florida Lakewatch","21FLKWAT"
"10/14/25",15:40:00,"EST","10/15/25",11:39:00,"EST",,,"CCV1",,,1,0.034,25,,,"Q","Q",,"QAQC","COL1014202510152025","Student Project",,,2025-10-14,2025-10-15,"25","Florida Lakewatch","21FLKWAT"
"10/14/25",15:40:00,"EST","10/15/25",11:39:00,"EST",,,"MBLK2",,,1,0,0,,,"QU","Q","TI","QAQC","COL1014202510152025","Student Project",,,2025-10-14,2025-10-15,"1","Florida Lakewatch","21FLKWAT"
"10/14/25",15:40:00,"EST","10/15/25",11:39:00,"EST","Marion","Ponar Spring_Belchior_Student","1","4/29/25",,1,0.026,19,,,"Q","Q",,"Sample","COL1014202510152025","Student Project",,2025-04-29,2025-10-14,2025-10-15,"19","Florida Lakewatch","21FLKWAT"
"10/14/25",15:40:00,"EST","10/15/25",11:39:00,"EST","Marion","Ponar Spring_Belchior_Student","2","4/29/25",,1,0.023,17,,,"Q","Q",,"Sample","COL1014202510152025","Student Project",,2025-04-29,2025-10-14,2025-10-15,"17","Florida Lakewatch","21FLKWAT"
"10/14/25",15:40:00,"EST","10/15/25",11:39:00,"EST","Marion","Ponar Spring_Belchior_Student","3","4/29/25",,1,0.02,14,,,"Q","Q",,"Sample","COL1014202510152025","Student Project",,2025-04-29,2025-10-14,2025-10-15,"14","Florida Lakewatch","21FLKWAT"
"10/14/25",15:40:00,"EST","10/15/25",11:39:00,"EST","Marion","Canal Fall_Belchior_Student","1","8/12/25",,1,0.106,78,,,"",,,"Sample","COL1014202510152025","Student Project",,2025-08-12,2025-10-14,2025-10-15,"78","Florida Lakewatch","21FLKWAT"
"10/14/25",15:40:00,"EST","10/15/25",11:39:00,"EST","Marion","Canal Fall_Belchior_Student","2","8/12/25",,1,0.109,80,,,"",,,"Sample","COL1014202510152025","Student Project",,2025-08-12,2025-10-14,2025-10-15,"80","Florida Lakewatch","21FLKWAT"
"10/14/25",15:40:00,"EST","10/15/25",11:39:00,"EST","Marion","Canal Fall_Belchior_Student","3","8/12/25",,1,0.071,52,,,"",,,"Sample","COL1014202510152025","Student Project",,2025-08-12,2025-10-14,2025-10-15,"52","Florida Lakewatch","21FLKWAT"
"10/14/25",15:40:00,"EST","10/15/25",11:39:00,"EST","Marion","Canal Spring_Belchior_Student","1","4/30/25",,1,0.032,23,,,"Q","Q",,"Sample","COL1014202510152025","Student Project",,2025-04-30,2025-10-14,2025-10-15,"23","Florida Lakewatch","21FLKWAT"
"10/14/25",15:40:00,"EST","10/15/25",11:39:00,"EST","Marion","Canal Spring_Belchior_Student","2","4/30/25",,1,0.027,20,,,"Q","Q",,"Sample","COL1014202510152025","Student Project",,2025-04-30,2025-10-14,2025-10-15,"20","Florida Lakewatch","21FLKWAT"
"10/14/25",15:40:00,"EST","10/15/25",11:39:00,"EST","Marion","Canal Spring_Belchior_Student","3","4/30/25",,1,0.061,45,,,"Q","Q",,"Sample","COL1014202510152025","Student Project",,2025-04-30,2025-10-14,2025-10-15,"45","Florida Lakewatch","21FLKWAT"
"10/14/25",15:40:00,"EST","10/15/25",11:39:00,"EST","Marion","Reservoir Fall_Belchior_Student","1","8/13/25",,1,0.082,60,,,"",,,"Sample","COL1014202510152025","Student Project",,2025-08-13,2025-10-14,2025-10-15,"60","Florida Lakewatch","21FLKWAT"
"10/14/25",15:40:00,"EST","10/15/25",11:39:00,"EST","Marion","Reservoir Fall_Belchior_Student","2","8/13/25",,1,0.132,97,,,"",,,"Sample","COL1014202510152025","Student Project",,2025-08-13,2025-10-14,2025-10-15,"97","Florida Lakewatch","21FLKWAT"
"10/14/25",15:40:00,"EST","10/15/25",11:39:00,"EST","Marion","Reservoir Fall_Belchior_Student","3","8/13/25",,1,0.081,59,,,"",,,"Sample","COL1014202510152025","Student Project",,2025-08-13,2025-10-14,2025-10-15,"59","Florida Lakewatch","21FLKWAT"
"10/14/25",15:40:00,"EST","10/15/25",11:39:00,"EST","Marion","Reservoir Fall_Belchior_Student","3DUP","8/13/25",,1,0.082,60,,,"",,,"Sample","COL1014202510152025","Student Project",,2025-08-13,2025-10-14,2025-10-15,"60","Florida Lakewatch","21FLKWAT"
"10/14/25",15:40:00,"EST","10/15/25",11:39:00,"EST","Marion","Reservoir Spring_Belchior_Student","1","4/29/25",,1,0.025,18,,,"Q","Q",,"Sample","COL1014202510152025","Student Project",,2025-04-29,2025-10-14,2025-10-15,"18","Florida Lakewatch","21FLKWAT"
"10/14/25",15:40:00,"EST","10/15/25",11:39:00,"EST","Marion","Reservoir Spring_Belchior_Student","2","4/29/25",,1,0.025,18,,,"Q","Q",,"Sample","COL1014202510152025","Student Project",,2025-04-29,2025-10-14,2025-10-15,"18","Florida Lakewatch","21FLKWAT"
"10/14/25",15:40:00,"EST","10/15/25",11:39:00,"EST","Marion","Reservoir Spring_Belchior_Student","3","4/29/25",,1,0.02,14,,,"Q","Q",,"Sample","COL1014202510152025","Student Project",,2025-04-29,2025-10-14,2025-10-15,"14","Florida Lakewatch","21FLKWAT"
"10/14/25",15:40:00,"EST","10/15/25",11:39:00,"EST","Marion","Saint Johns Fall_Belchior_Student","1","8/12/25",,1,0.078,57,,,"",,,"Sample","COL1014202510152025","Student Project",,2025-08-12,2025-10-14,2025-10-15,"57","Florida Lakewatch","21FLKWAT"
"10/14/25",15:40:00,"EST","10/15/25",11:39:00,"EST","Marion","Saint Johns Fall_Belchior_Student","2","8/12/25",,1,0.083,61,,,"",,,"Sample","COL1014202510152025","Student Project",,2025-08-12,2025-10-14,2025-10-15,"61","Florida Lakewatch","21FLKWAT"
"10/14/25",15:40:00,"EST","10/15/25",11:39:00,"EST","Marion","Saint Johns Fall_Belchior_Student","3","8/12/25",,1,0.078,57,,,"",,,"Sample","COL1014202510152025","Student Project",,2025-08-12,2025-10-14,2025-10-15,"57","Florida Lakewatch","21FLKWAT"
"10/14/25",15:40:00,"EST","10/15/25",11:39:00,"EST","Marion","Saint Johns Fall_Belchior_Student","DUP2","8/12/25",,1,0.077,56,,,"",,,"QAQC","COL1014202510152025","Student Project",,2025-08-12,2025-10-14,2025-10-15,"56","Florida Lakewatch","21FLKWAT"
"10/14/25",15:40:00,"EST","10/15/25",11:39:00,"EST",,,"ALTQC2",,,1,0.025,18,,,"Q","Q",,"QAQC","COL1014202510152025","Student Project",,,2025-10-14,2025-10-15,"18","Florida Lakewatch","21FLKWAT"
"10/14/25",15:40:00,"EST","10/15/25",11:39:00,"EST",,,"CCV2",,,1,0.034,25,,,"Q","Q",,"QAQC","COL1014202510152025","Student Project",,,2025-10-14,2025-10-15,"25","Florida Lakewatch","21FLKWAT"
"10/14/25",15:40:00,"EST","10/15/25",11:39:00,"EST",,,"MBLK3",,,1,0,0,,,"QU","Q","TI","QAQC","COL1014202510152025","Student Project",,,2025-10-14,2025-10-15,"1","Florida Lakewatch","21FLKWAT"
"10/14/25",15:40:00,"EST","10/15/25",11:39:00,"EST","Marion","Saint Johns Fall_Belchior_Student","4","8/12/25",,1,0.088,65,,,"",,,"Sample","COL1014202510152025","Student Project",,2025-08-12,2025-10-14,2025-10-15,"65","Florida Lakewatch","21FLKWAT"
"10/14/25",15:40:00,"EST","10/15/25",11:39:00,"EST","Alachua","Lochloosa_Lajoie_Post-Doc","L5","8/20/25",,1,0.045,33,,,"",,,"Sample","COL1014202510152025","Student Project",,2025-08-20,2025-10-14,2025-10-15,"33","Florida Lakewatch","21FLKWAT"
"10/14/25",15:40:00,"EST","10/15/25",11:39:00,"EST","Alachua","Lochloosa_Lajoie_Post-Doc","L2","8/20/25",,1,0.042,31,,,"",,,"Sample","COL1014202510152025","Student Project",,2025-08-20,2025-10-14,2025-10-15,"31","Florida Lakewatch","21FLKWAT"
"10/14/25",15:40:00,"EST","10/15/25",11:39:00,"EST","Alachua","Lochloosa_Lajoie_Post-Doc","L4","8/20/25",,1,0.048,35,,,"",,,"Sample","COL1014202510152025","Student Project",,2025-08-20,2025-10-14,2025-10-15,"35","Florida Lakewatch","21FLKWAT"
"10/14/25",15:40:00,"EST","10/15/25",11:39:00,"EST","Alachua","Lochloosa_Lajoie_Post-Doc","OP2","8/20/25",,1,0.044,32,,,"",,,"Sample","COL1014202510152025","Student Project",,2025-08-20,2025-10-14,2025-10-15,"32","Florida Lakewatch","21FLKWAT"
"10/14/25",15:40:00,"EST","10/15/25",11:39:00,"EST","Alachua","Lochloosa_Lajoie_Post-Doc","OP1","8/20/25",,1,0.046,34,,,"",,,"Sample","COL1014202510152025","Student Project",,2025-08-20,2025-10-14,2025-10-15,"34","Florida Lakewatch","21FLKWAT"
"10/14/25",15:40:00,"EST","10/15/25",11:39:00,"EST","Alachua","Lochloosa_Lajoie_Post-Doc","OP3","8/20/25",,1,0.047,34,,,"",,,"Sample","COL1014202510152025","Student Project",,2025-08-20,2025-10-14,2025-10-15,"34","Florida Lakewatch","21FLKWAT"
"10/14/25",15:40:00,"EST","10/15/25",11:39:00,"EST","Alachua","Lochloosa_Lajoie_Post-Doc","LC","8/20/25",,1,0.088,65,,,"",,,"Sample","COL1014202510152025","Student Project",,2025-08-20,2025-10-14,2025-10-15,"65","Florida Lakewatch","21FLKWAT"
"10/14/25",15:40:00,"EST","10/15/25",11:39:00,"EST","Alachua","Lochloosa_Lajoie_Post-Doc","L5","9/23/25",,1,0.046,34,,,"",,,"Sample","COL1014202510152025","Student Project",,2025-09-23,2025-10-14,2025-10-15,"34","Florida Lakewatch","21FLKWAT"
"10/14/25",15:40:00,"EST","10/15/25",11:39:00,"EST","Alachua","Lochloosa_Lajoie_Post-Doc","L2","9/23/25",,1,0.049,36,,,"",,,"Sample","COL1014202510152025","Student Project",,2025-09-23,2025-10-14,2025-10-15,"36","Florida Lakewatch","21FLKWAT"
"10/14/25",15:40:00,"EST","10/15/25",11:39:00,"EST","Alachua","Lochloosa_Lajoie_Post-Doc","L4","9/23/25",,1,0.047,34,,,"",,,"Sample","COL1014202510152025","Student Project",,2025-09-23,2025-10-14,2025-10-15,"34","Florida Lakewatch","21FLKWAT"
"10/14/25",15:40:00,"EST","10/15/25",11:39:00,"EST","Alachua","Lochloosa_Lajoie_Post-Doc","OP2","9/23/25",,1,0.042,31,,,"",,,"Sample","COL1014202510152025","Student Project",,2025-09-23,2025-10-14,2025-10-15,"31","Florida Lakewatch","21FLKWAT"
"10/14/25",15:40:00,"EST","10/15/25",11:39:00,"EST","Alachua","Lochloosa_Lajoie_Post-Doc","OP1","9/23/25",,1,0.044,32,,,"",,,"Sample","COL1014202510152025","Student Project",,2025-09-23,2025-10-14,2025-10-15,"32","Florida Lakewatch","21FLKWAT"
"10/14/25",15:40:00,"EST","10/15/25",11:39:00,"EST","Alachua","Lochloosa_Lajoie_Post-Doc","OP3","9/23/25",,1,0.049,36,,,"",,,"Sample","COL1014202510152025","Student Project",,2025-09-23,2025-10-14,2025-10-15,"36","Florida Lakewatch","21FLKWAT"
"10/14/25",15:40:00,"EST","10/15/25",11:39:00,"EST","Alachua","Lochloosa_Lajoie_Post-Doc","LC","9/23/25",,1,0.073,54,,,"",,,"Sample","COL1014202510152025","Student Project",,2025-09-23,2025-10-14,2025-10-15,"54","Florida Lakewatch","21FLKWAT"
"10/14/25",15:40:00,"EST","10/15/25",11:39:00,"EST","Alachua","Lochloosa_Lajoie_Post-Doc","DUP3","9/23/25",,1,0.073,54,,,"",,,"QAQC","COL1014202510152025","Student Project",,2025-09-23,2025-10-14,2025-10-15,"54","Florida Lakewatch","21FLKWAT"
"10/14/25",15:40:00,"EST","10/15/25",11:39:00,"EST",,,"ALTQC3",,,1,0.025,18,,,"Q","Q",,"QAQC","COL1014202510152025","Student Project",,,2025-10-14,2025-10-15,"18","Florida Lakewatch","21FLKWAT"
"10/14/25",15:40:00,"EST","10/15/25",11:39:00,"EST",,,"CCV3",,,1,0.034,25,,,"Q","Q",,"QAQC","COL1014202510152025","Student Project",,,2025-10-14,2025-10-15,"25","Florida Lakewatch","21FLKWAT"
"10/14/25",15:40:00,"EST","10/15/25",11:39:00,"EST",,,"MBLK4",,,,,0,,,"QU","Q","TI","QAQC","COL1014202510152025","Student Project",,,2025-10-14,2025-10-15,"1","Florida Lakewatch","21FLKWAT"
"10/14/25",15:40:00,"EST","10/15/25",11:39:00,"EST",,,"DUP4",,,,,0,,,"QU","Q","TI","QAQC","COL1014202510152025","Student Project",,,2025-10-14,2025-10-15,"1","Florida Lakewatch","21FLKWAT"
"10/14/25",15:40:00,"EST","10/15/25",11:39:00,"EST",,,"ALTQC4",,,,,0,,"J","QU","Q","TI","QAQC","COL1014202510152025","Student Project",,,2025-10-14,2025-10-15,"1","Florida Lakewatch","21FLKWAT"
"10/14/25",15:40:00,"EST","10/15/25",11:39:00,"EST",,,"CCV4",,,,,0,,"J","QU","Q","TI","QAQC","COL1014202510152025","Student Project",,,2025-10-14,2025-10-15,"1","Florida Lakewatch","21FLKWAT"
"10/14/25",15:40:00,"EST","10/15/25",11:39:00,"EST",,,"MBLK5",,,,,0,,,"QU","Q","TI","QAQC","COL1014202510152025","Student Project",,,2025-10-14,2025-10-15,"1","Florida Lakewatch","21FLKWAT"
"10/14/25",15:40:00,"EST","10/15/25",11:39:00,"EST",,,"DUP5",,,,,0,,,"QU","Q","TI","QAQC","COL1014202510152025","Student Project",,,2025-10-14,2025-10-15,"1","Florida Lakewatch","21FLKWAT"
"10/14/25",15:40:00,"EST","10/15/25",11:39:00,"EST",,,"ALTQC5",,,,,0,,"J","QU","Q","TI","QAQC","COL1014202510152025","Student Project",,,2025-10-14,2025-10-15,"1","Florida Lakewatch","21FLKWAT"
"10/14/25",15:40:00,"EST","10/15/25",11:39:00,"EST",,,"CCV5",,,,,0,,"J","QU","Q","TI","QAQC","COL1014202510152025","Student Project",,,2025-10-14,2025-10-15,"1","Florida Lakewatch","21FLKWAT"
"9/19/25",13:29:00,"EST","10/24/25",12:33:00,"EST",,,"MBLK1",,,1,-0.001,0,,,"QU","Q","TI","QAQC","COL0919202510242025",,,,2025-09-19,2025-10-24,"1","Florida Lakewatch","21FLKWAT"
"9/19/25",13:29:00,"EST","10/24/25",12:33:00,"EST","Gadsden","Talquin","1","7/5/25",,1,0.042,32,,,"",,,"Sample","COL0919202510242025",,,2025-07-05,2025-09-19,2025-10-24,"32","Florida Lakewatch","21FLKWAT"
"9/19/25",13:29:00,"EST","10/24/25",12:33:00,"EST","Gulf","Air Strip-1","1","7/11/25",,1,0.085,64,,,"",,,"Sample","COL0919202510242025",,,2025-07-11,2025-09-19,2025-10-24,"64","Florida Lakewatch","21FLKWAT"
"9/19/25",13:29:00,"EST","10/24/25",12:33:00,"EST","Gulf","Cattle Dip-1","1","7/11/25",,10,0.113,843,,,"",,,"Sample","COL0919202510242025",,,2025-07-11,2025-09-19,2025-10-24,"843","Florida Lakewatch","21FLKWAT"
"9/19/25",13:29:00,"EST","10/24/25",12:33:00,"EST","Gulf","Depot Creek-1","1","7/11/25",,4,0.163,485,,,"",,,"Sample","COL0919202510242025",,,2025-07-11,2025-09-19,2025-10-24,"485","Florida Lakewatch","21FLKWAT"
"9/19/25",13:29:00,"EST","10/24/25",12:33:00,"EST","Gulf","Dove Field-1","1","7/11/25",,4,0.085,254,,,"",,,"Sample","COL0919202510242025",,,2025-07-11,2025-09-19,2025-10-24,"254","Florida Lakewatch","21FLKWAT"
"9/19/25",13:29:00,"EST","10/24/25",12:33:00,"EST","Gulf","Money Bayou-1","1","7/11/25",,4,0.176,524,,,"",,,"Sample","COL0919202510242025",,,2025-07-11,2025-09-19,2025-10-24,"524","Florida Lakewatch","21FLKWAT"
"9/19/25",13:29:00,"EST","10/24/25",12:33:00,"EST","Gulf","Pond Road-1","1","7/11/25",,4,0.194,577,,,"",,,"Sample","COL0919202510242025",,,2025-07-11,2025-09-19,2025-10-24,"577","Florida Lakewatch","21FLKWAT"
"9/19/25",13:29:00,"EST","10/24/25",12:33:00,"EST","Gulf","Simmons Bayou-1","1","7/11/25",,1,0.017,13,,,"",,,"Sample","COL0919202510242025",,,2025-07-11,2025-09-19,2025-10-24,"13","Florida Lakewatch","21FLKWAT"
"9/19/25",13:29:00,"EST","10/24/25",12:33:00,"EST","Hernando","Hernando Beach-2","1","7/23/25",,1,0.009,7,,,"",,,"Sample","COL0919202510242025",,,2025-07-23,2025-09-19,2025-10-24,"7","Florida Lakewatch","21FLKWAT"
"9/19/25",13:29:00,"EST","10/24/25",12:33:00,"EST","Hernando","Hernando Beach-2","DUP1","7/23/25",,1,0.008,6,,,"",,,"QAQC","COL0919202510242025",,,2025-07-23,2025-09-19,2025-10-24,"6","Florida Lakewatch","21FLKWAT"
"9/19/25",13:29:00,"EST","10/24/25",12:33:00,"EST",,,"ALTQC1",,,1,0.023,18,,,"Q","Q",,"QAQC","COL0919202510242025",,,,2025-09-19,2025-10-24,"18","Florida Lakewatch","21FLKWAT"
"9/19/25",13:29:00,"EST","10/24/25",12:33:00,"EST",,,"CCV1",,,1,0.034,26,,,"Q","Q",,"QAQC","COL0919202510242025",,,,2025-09-19,2025-10-24,"26","Florida Lakewatch","21FLKWAT"
"9/19/25",13:29:00,"EST","10/24/25",12:33:00,"EST",,,"MLBK2",,,1,-0.001,0,,,"QU","Q","TI","QAQC","COL0919202510242025",,,,2025-09-19,2025-10-24,"1","Florida Lakewatch","21FLKWAT"
"9/19/25",13:29:00,"EST","10/24/25",12:33:00,"EST","Jackson","Silver","1","7/20/25",,1,0.011,9,,,"",,,"Sample","COL0919202510242025",,,2025-07-20,2025-09-19,2025-10-24,"9","Florida Lakewatch","21FLKWAT"
"9/19/25",13:29:00,"EST","10/24/25",12:33:00,"EST","Lake","Griffin West","1","7/30/25",,1,0.117,87,,,"",,,"Sample","COL0919202510242025",,,2025-07-30,2025-09-19,2025-10-24,"87","Florida Lakewatch","21FLKWAT"
"9/19/25",13:29:00,"EST","10/24/25",12:33:00,"EST","Leon","Carr","1","7/10/25",,1,0.019,15,,,"",,,"Sample","COL0919202510242025",,,2025-07-10,2025-09-19,2025-10-24,"15","Florida Lakewatch","21FLKWAT"
"9/19/25",13:29:00,"EST","10/24/25",12:33:00,"EST","Leon","Jackson","1","7/30/25",,1,0.033,25,,,"",,,"Sample","COL0919202510242025",,,2025-07-30,2025-09-19,2025-10-24,"25","Florida Lakewatch","21FLKWAT"
"9/19/25",13:29:00,"EST","10/24/25",12:33:00,"EST","Liberty","Mystic","1","7/18/25",,1,0.01,8,,,"",,,"Sample","COL0919202510242025",,,2025-07-18,2025-09-19,2025-10-24,"8","Florida Lakewatch","21FLKWAT"
"9/19/25",13:29:00,"EST","10/24/25",12:33:00,"EST","Marion","Deerback","1","7/23/25",,1,0.022,17,,,"",,,"Sample","COL0919202510242025",,,2025-07-23,2025-09-19,2025-10-24,"17","Florida Lakewatch","21FLKWAT"
"9/19/25",13:29:00,"EST","10/24/25",12:33:00,"EST","Marion","Little Weir","1","7/5/25",,1,0.024,18,,,"",,,"Sample","COL0919202510242025",,,2025-07-05,2025-09-19,2025-10-24,"18","Florida Lakewatch","21FLKWAT"
"9/19/25",13:29:00,"EST","10/24/25",12:33:00,"EST","Marion","Weir","1","7/21/25",,1,0.015,12,,,"",,,"Sample","COL0919202510242025",,,2025-07-21,2025-09-19,2025-10-24,"12","Florida Lakewatch","21FLKWAT"
"9/19/25",13:29:00,"EST","10/24/25",12:33:00,"EST","Marion","Weir","DUP2","7/21/25",,1,0.015,12,,,"",,,"QAQC","COL0919202510242025",,,2025-07-21,2025-09-19,2025-10-24,"12","Florida Lakewatch","21FLKWAT"
"9/19/25",13:29:00,"EST","10/24/25",12:33:00,"EST",,,"ALTQC2",,,1,0.025,19,,,"Q","Q",,"QAQC","COL0919202510242025",,,,2025-09-19,2025-10-24,"19","Florida Lakewatch","21FLKWAT"
"9/19/25",13:29:00,"EST","10/24/25",12:33:00,"EST",,,"CCV2",,,1,0.034,26,,,"Q","Q",,"QAQC","COL0919202510242025",,,,2025-09-19,2025-10-24,"26","Florida Lakewatch","21FLKWAT"
"9/19/25",13:29:00,"EST","10/24/25",12:33:00,"EST",,,"MLBK3",,,1,0,1,,,"QU","Q","TI","QAQC","COL0919202510242025",,,,2025-09-19,2025-10-24,"1","Florida Lakewatch","21FLKWAT"
"9/19/25",13:29:00,"EST","10/24/25",12:33:00,"EST","Pinellas","Crescent","1","7/9/25",,1,0.041,31,,,"",,,"Sample","COL0919202510242025",,,2025-07-09,2025-09-19,2025-10-24,"31","Florida Lakewatch","21FLKWAT"
"9/19/25",13:29:00,"EST","10/24/25",12:33:00,"EST","Seminole","Cub","DUP3","7/31/25",,1,0.031,23,,,"",,,"QAQC","COL0919202510242025",,,2025-07-31,2025-09-19,2025-10-24,"23","Florida Lakewatch","21FLKWAT"
"9/19/25",13:29:00,"EST","10/24/25",12:33:00,"EST",,,"ALTQC3",,,1,0.025,19,,,"Q","Q",,"QAQC","COL0919202510242025",,,,2025-09-19,2025-10-24,"19","Florida Lakewatch","21FLKWAT"
"9/19/25",13:29:00,"EST","10/24/25",12:33:00,"EST",,,"CCV3",,,1,0.034,26,,,"Q","Q",,"QAQC","COL0919202510242025",,,,2025-09-19,2025-10-24,"26","Florida Lakewatch","21FLKWAT"
"9/19/25",13:29:00,"EST","10/24/25",12:33:00,"EST",,,"MLBK4",,,,,0,,,"QU","Q","TI","QAQC","COL0919202510242025",,,,2025-09-19,2025-10-24,"1","Florida Lakewatch","21FLKWAT"
"9/19/25",13:29:00,"EST","10/24/25",12:33:00,"EST",,,"DUP4",,,,,0,,,"QU","Q","TI","QAQC","COL0919202510242025",,,,2025-09-19,2025-10-24,"1","Florida Lakewatch","21FLKWAT"
"9/19/25",13:29:00,"EST","10/24/25",12:33:00,"EST",,,"ALTQC4",,,,,0,,"J","QU","Q","TI","QAQC","COL0919202510242025",,,,2025-09-19,2025-10-24,"1","Florida Lakewatch","21FLKWAT"
"9/19/25",13:29:00,"EST","10/24/25",12:33:00,"EST",,,"CCV4",,,,,0,,"J","QU","Q","TI","QAQC","COL0919202510242025",,,,2025-09-19,2025-10-24,"1","Florida Lakewatch","21FLKWAT"
"9/19/25",13:29:00,"EST","10/24/25",12:33:00,"EST",,,"MLBK5",,,,,0,,,"QU","Q","TI","QAQC","COL0919202510242025",,,,2025-09-19,2025-10-24,"1","Florida Lakewatch","21FLKWAT"
"9/19/25",13:29:00,"EST","10/24/25",12:33:00,"EST",,,"DUP5",,,,,0,,,"QU","Q","TI","QAQC","COL0919202510242025",,,,2025-09-19,2025-10-24,"1","Florida Lakewatch","21FLKWAT"
"9/19/25",13:29:00,"EST","10/24/25",12:33:00,"EST",,,"ALTQC5",,,,,0,,"J","QU","Q","TI","QAQC","COL0919202510242025",,,,2025-09-19,2025-10-24,"1","Florida Lakewatch","21FLKWAT"
"9/19/25",13:29:00,"EST","10/24/25",12:33:00,"EST",,,"CCV5",,,,,0,,"J","QU","Q","TI","QAQC","COL0919202510242025",,,,2025-09-19,2025-10-24,"1","Florida Lakewatch","21FLKWAT"
"10/28/25",12:00:00,"EST","10/29/25",16:02:00,"EST",,,"MBLK1",,,1,0,0,,,"QU","Q","TI","QAQC","COL1028202510292025",,,,2025-10-28,2025-10-29,"1","Florida Lakewatch","21FLKWAT"
"10/28/25",12:00:00,"EST","10/29/25",16:02:00,"EST","Alachua","Holden","1","7/31/25",,1,0.087,64,,,"",,,"Sample","COL1028202510292025",,,2025-07-31,2025-10-28,2025-10-29,"64","Florida Lakewatch","21FLKWAT"
"10/28/25",12:00:00,"EST","10/29/25",16:02:00,"EST","Alachua","Orange","2","7/11/25",,4,0.124,363,,,"",,,"Sample","COL1028202510292025",,"Student sample",2025-07-11,2025-10-28,2025-10-29,"363","Florida Lakewatch","21FLKWAT"
"10/28/25",12:00:00,"EST","10/29/25",16:02:00,"EST","Bay","Powell","1","7/9/25",,1,0.078,57,,,"",,,"Sample","COL1028202510292025",,,2025-07-09,2025-10-28,2025-10-29,"57","ST. ANDREW BAY RESOURCE MANAGEMENT ASSOCIATION INC.","21FLKWAT"
"10/28/25",12:00:00,"EST","10/29/25",16:02:00,"EST","Bay","Powell Creek East-1","1","7/9/25",,2,0.15,220,,,"",,,"Sample","COL1028202510292025",,,2025-07-09,2025-10-28,2025-10-29,"220","ST. ANDREW BAY RESOURCE MANAGEMENT ASSOCIATION INC.","21FLKWAT"
"10/28/25",12:00:00,"EST","10/29/25",16:02:00,"EST","Bay","Powell Creek East-2","1","7/9/25",,2,0.165,242,,,"",,,"Sample","COL1028202510292025",,,2025-07-09,2025-10-28,2025-10-29,"242","ST. ANDREW BAY RESOURCE MANAGEMENT ASSOCIATION INC.","21FLKWAT"
"10/28/25",12:00:00,"EST","10/29/25",16:02:00,"EST","Brevard","Blue Trail-1","1","7/24/25",,1,0.031,23,,,"",,,"Sample","COL1028202510292025",,,2025-07-24,2025-10-28,2025-10-29,"23","Florida Lakewatch","21FLKWAT"
"10/28/25",12:00:00,"EST","10/29/25",16:02:00,"EST","Charlotte","WF-6","1","4/22/25",,1,0.123,90,,,"Q","Q",,"Sample","COL1028202510292025",,,2025-04-22,2025-10-28,2025-10-29,"90","Florida Lakewatch","21FLKWAT"
"10/28/25",12:00:00,"EST","10/29/25",16:02:00,"EST","Charlotte","WF-6","DUP1","4/22/25",,1,0.123,90,,,"Q","Q",,"QAQC","COL1028202510292025",,,2025-04-22,2025-10-28,2025-10-29,"90","Florida Lakewatch","21FLKWAT"
"10/28/25",12:00:00,"EST","10/29/25",16:02:00,"EST",,,"ALTQC1",,,1,0.024,17,,,"Q","Q",,"QAQC","COL1028202510292025",,,,2025-10-28,2025-10-29,"17","Florida Lakewatch","21FLKWAT"
"10/28/25",12:00:00,"EST","10/29/25",16:02:00,"EST",,,"CCV1",,,1,0.036,26,,,"Q","Q",,"QAQC","COL1028202510292025",,,,2025-10-28,2025-10-29,"26","Florida Lakewatch","21FLKWAT"
"10/28/25",12:00:00,"EST","10/29/25",16:02:00,"EST",,,"MBLK2",,,1,0,0,,,"QU","Q","TI","QAQC","COL1028202510292025",,,,2025-10-28,2025-10-29,"1","Florida Lakewatch","21FLKWAT"
"10/28/25",12:00:00,"EST","10/29/25",16:02:00,"EST","Citrus","Floral City","1","4/5/25",,2,0.12,176,,,"Q","Q",,"Sample","COL1028202510292025",,,2025-04-05,2025-10-28,2025-10-29,"176","Florida Lakewatch","21FLKWAT"
"10/28/25",12:00:00,"EST","10/29/25",16:02:00,"EST","Franklin","Alligator Harbor-1","1","7/9/25",,1,0.01,7,,,"",,,"Sample","COL1028202510292025",,,2025-07-09,2025-10-28,2025-10-29,"7","Florida Lakewatch","21FLKWAT"
"10/28/25",12:00:00,"EST","10/29/25",16:02:00,"EST","Franklin","Alligator Harbor-2","1","7/9/25",,1,0.01,7,,,"",,,"Sample","COL1028202510292025",,,2025-07-09,2025-10-28,2025-10-29,"7","Florida Lakewatch","21FLKWAT"
"10/28/25",12:00:00,"EST","10/29/25",16:02:00,"EST","Franklin","Alligator Harbor-3","1","7/9/25",,1,0.013,9,,,"",,,"Sample","COL1028202510292025",,,2025-07-09,2025-10-28,2025-10-29,"9","Florida Lakewatch","21FLKWAT"
"10/28/25",12:00:00,"EST","10/29/25",16:02:00,"EST","Franklin","Alligator Harbor-4","1","7/9/25",,1,0.014,10,,,"",,,"Sample","COL1028202510292025",,,2025-07-09,2025-10-28,2025-10-29,"10","Florida Lakewatch","21FLKWAT"
"10/28/25",12:00:00,"EST","10/29/25",16:02:00,"EST","Franklin","Alligator Harbor-5","1","7/9/25",,1,0.01,7,,,"",,,"Sample","COL1028202510292025",,,2025-07-09,2025-10-28,2025-10-29,"7","Florida Lakewatch","21FLKWAT"
"10/28/25",12:00:00,"EST","10/29/25",16:02:00,"EST","Franklin","Alligator Harbor-6","1","7/9/25",,1,0.016,12,,,"",,,"Sample","COL1028202510292025",,,2025-07-09,2025-10-28,2025-10-29,"12","Florida Lakewatch","21FLKWAT"
"10/28/25",12:00:00,"EST","10/29/25",16:02:00,"EST","Franklin","Alligator Harbor-7","1","7/9/25",,1,0.007,5,,,"",,,"Sample","COL1028202510292025",,,2025-07-09,2025-10-28,2025-10-29,"5","Florida Lakewatch","21FLKWAT"
"10/28/25",12:00:00,"EST","10/29/25",16:02:00,"EST","Gilchrist","Gilchrist Blue Spring Run-1","1","7/17/25",,1,0.003,2,,,"",,,"Sample","COL1028202510292025",,,2025-07-17,2025-10-28,2025-10-29,"2","Florida Lakewatch","21FLKWAT"
"10/28/25",12:00:00,"EST","10/29/25",16:02:00,"EST","Highlands","Catfish Creek-3","1","4/22/25",,1,0.059,43,,,"Q","Q",,"Sample","COL1028202510292025",,,2025-04-22,2025-10-28,2025-10-29,"43","Florida Lakewatch","21FLKWAT"
"10/28/25",12:00:00,"EST","10/29/25",16:02:00,"EST","Highlands","Lynn","1","4/30/25",,1,0.006,4,,,"Q","Q",,"Sample","COL1028202510292025",,,2025-04-30,2025-10-28,2025-10-29,"4","Florida Lakewatch","21FLKWAT"
"10/28/25",12:00:00,"EST","10/29/25",16:02:00,"EST","Hillsborough","Elizabeth","DUP2","7/3/25",,1,0.041,30,,,"",,,"QAQC","COL1028202510292025",,,2025-07-03,2025-10-28,2025-10-29,"30","Florida Lakewatch","21FLKWAT"
"10/28/25",12:00:00,"EST","10/29/25",16:02:00,"EST",,,"ALTQC2",,,1,0.024,17,,,"Q","Q",,"QAQC","COL1028202510292025",,,,2025-10-28,2025-10-29,"17","Florida Lakewatch","21FLKWAT"
"10/28/25",12:00:00,"EST","10/29/25",16:02:00,"EST",,,"CCV2",,,1,0.034,25,,,"Q","Q",,"QAQC","COL1028202510292025",,,,2025-10-28,2025-10-29,"25","Florida Lakewatch","21FLKWAT"
"10/28/25",12:00:00,"EST","10/29/25",16:02:00,"EST",,,"MBLK3",,,1,0,0,,,"QU","Q","TI","QAQC","COL1028202510292025",,,,2025-10-28,2025-10-29,"1","Florida Lakewatch","21FLKWAT"
"10/28/25",12:00:00,"EST","10/29/25",16:02:00,"EST","Hillsborough","Osceola","1","4/28/25",,1,0.026,19,,,"Q","Q",,"Sample","COL1028202510292025",,,2025-04-28,2025-10-28,2025-10-29,"19","Florida Lakewatch","21FLKWAT"
"10/28/25",12:00:00,"EST","10/29/25",16:02:00,"EST","Hillsborough","West Meadows-3","1","4/4/25",,1,0.06,44,,,"Q","Q",,"Sample","COL1028202510292025",,,2025-04-04,2025-10-28,2025-10-29,"44","Florida Lakewatch","21FLKWAT"
"10/28/25",12:00:00,"EST","10/29/25",16:02:00,"EST","Hillsborough","West Meadows-15","1","4/4/25",,1,0.017,12,,,"Q","Q",,"Sample","COL1028202510292025",,,2025-04-04,2025-10-28,2025-10-29,"12","Florida Lakewatch","21FLKWAT"
"10/28/25",12:00:00,"EST","10/29/25",16:02:00,"EST","Hillsborough","Zambito East","1","4/20/25",,1,0.098,72,,,"Q","Q",,"Sample","COL1028202510292025",,,2025-04-20,2025-10-28,2025-10-29,"72","Florida Lakewatch","21FLKWAT"
"10/28/25",12:00:00,"EST","10/29/25",16:02:00,"EST","Okaloosa","CBA Niceville-5","1","4/10/25",,1,0.011,8,,,"Q","Q",,"Sample","COL1028202510292025",,,2025-04-10,2025-10-28,2025-10-29,"8","CHOCTAWHATCHEE BASIN ALLIANCE","BAYRALLY"
"10/28/25",12:00:00,"EST","10/29/25",16:02:00,"EST","Pinellas","Hewitt","1","1/30/25",,1,0.02,14,,,"Q","Q",,"Sample","COL1028202510292025",,,2025-01-30,2025-10-28,2025-10-29,"14","Florida Lakewatch","21FLKWAT"
"10/28/25",12:00:00,"EST","10/29/25",16:02:00,"EST","Pinellas","Hewitt","1","4/30/25",,1,0.018,13,,,"Q","Q",,"Sample","COL1028202510292025",,,2025-04-30,2025-10-28,2025-10-29,"13","Florida Lakewatch","21FLKWAT"
"10/28/25",12:00:00,"EST","10/29/25",16:02:00,"EST","Pinellas","Hewitt","1","7/30/25",,1,0.019,14,,,"",,,"Sample","COL1028202510292025",,,2025-07-30,2025-10-28,2025-10-29,"14","Florida Lakewatch","21FLKWAT"
"10/28/25",12:00:00,"EST","10/29/25",16:02:00,"EST","Santa Rosa","Ski Watch","1","4/11/25",,1,0.011,8,,,"Q","Q",,"Sample","COL1028202510292025",,,2025-04-11,2025-10-28,2025-10-29,"8","Florida Lakewatch","21FLKWAT"
"10/28/25",12:00:00,"EST","10/29/25",16:02:00,"EST","Sarasota","Upper Myakka","DUP3","7/1/25",,4,0.079,231,,,"",,,"QAQC","COL1028202510292025",,,2025-07-01,2025-10-28,2025-10-29,"231","Florida Lakewatch","21FLKWAT"
"10/28/25",12:00:00,"EST","10/29/25",16:02:00,"EST",,,"ALTQC3",,,1,0.025,18,,,"Q","Q",,"QAQC","COL1028202510292025",,,,2025-10-28,2025-10-29,"18","Florida Lakewatch","21FLKWAT"
"10/28/25",12:00:00,"EST","10/29/25",16:02:00,"EST",,,"CCV3",,,1,0.034,25,,,"Q","Q",,"QAQC","COL1028202510292025",,,,2025-10-28,2025-10-29,"25","Florida Lakewatch","21FLKWAT"
"10/28/25",12:00:00,"EST","10/29/25",16:02:00,"EST",,,"MBLK4",,,,,0,,,"QU","Q","TI","QAQC","COL1028202510292025",,,,2025-10-28,2025-10-29,"1","Florida Lakewatch","21FLKWAT"
"10/28/25",12:00:00,"EST","10/29/25",16:02:00,"EST",,,"DUP4",,,,,0,,,"QU","Q","TI","QAQC","COL1028202510292025",,,,2025-10-28,2025-10-29,"1","Florida Lakewatch","21FLKWAT"
"10/28/25",12:00:00,"EST","10/29/25",16:02:00,"EST",,,"ALTQC4",,,,,0,,"J","QU","Q","TI","QAQC","COL1028202510292025",,,,2025-10-28,2025-10-29,"1","Florida Lakewatch","21FLKWAT"
"10/28/25",12:00:00,"EST","10/29/25",16:02:00,"EST",,,"CCV4",,,,,0,,"J","QU","Q","TI","QAQC","COL1028202510292025",,,,2025-10-28,2025-10-29,"1","Florida Lakewatch","21FLKWAT"
"10/28/25",12:00:00,"EST","10/29/25",16:02:00,"EST",,,"MBLK5",,,,,0,,,"QU","Q","TI","QAQC","COL1028202510292025",,,,2025-10-28,2025-10-29,"1","Florida Lakewatch","21FLKWAT"
"10/28/25",12:00:00,"EST","10/29/25",16:02:00,"EST",,,"DUP5",,,,,0,,,"QU","Q","TI","QAQC","COL1028202510292025",,,,2025-10-28,2025-10-29,"1","Florida Lakewatch","21FLKWAT"
"10/28/25",12:00:00,"EST","10/29/25",16:02:00,"EST",,,"ALTQC5",,,,,0,,"J","QU","Q","TI","QAQC","COL1028202510292025",,,,2025-10-28,2025-10-29,"1","Florida Lakewatch","21FLKWAT"
"10/28/25",12:00:00,"EST","10/29/25",16:02:00,"EST",,,"CCV5",,,,,0,,"J","QU","Q","TI","QAQC","COL1028202510292025",,,,2025-10-28,2025-10-29,"1","Florida Lakewatch","21FLKWAT"
"10/28/25",14:00:00,"EST","10/30/25",14:04:00,"EST",,,"MBLK1",,,1,0,0,,,"QU","Q","TI","QAQC","COL1028202510302025",,,,2025-10-28,2025-10-30,"1","Florida Lakewatch","21FLKWAT"
"10/28/25",14:00:00,"EST","10/30/25",14:04:00,"EST","Collier","Harveys","1","7/2/25",,1,0.06,44,,,"",,,"Sample","COL1028202510302025",,,2025-07-02,2025-10-28,2025-10-30,"44","Florida Lakewatch","21FLKWAT"
"10/28/25",14:00:00,"EST","10/30/25",14:04:00,"EST","Collier","SB-61","1","7/18/25",,1,0.024,17,,,"",,,"Sample","COL1028202510302025",,,2025-07-18,2025-10-28,2025-10-30,"17","Florida Lakewatch","21FLKWAT"
"10/28/25",14:00:00,"EST","10/30/25",14:04:00,"EST","Levy","Cedar Key-1","1","7/28/25",,1,0.026,19,,,"",,,"Sample","COL1028202510302025",,,2025-07-28,2025-10-28,2025-10-30,"19","Florida Lakewatch","21FLKWAT"
"10/28/25",14:00:00,"EST","10/30/25",14:04:00,"EST","Levy","Cedar Key-2","1","7/28/25",,1,0.026,19,,,"",,,"Sample","COL1028202510302025",,,2025-07-28,2025-10-28,2025-10-30,"19","Florida Lakewatch","21FLKWAT"
"10/28/25",14:00:00,"EST","10/30/25",14:04:00,"EST","Marion","Rainbow River-2","1","7/8/25",,1,0.003,2,,,"",,,"Sample","COL1028202510302025",,,2025-07-08,2025-10-28,2025-10-30,"2","Florida Lakewatch","21FLKWAT"
"10/28/25",14:00:00,"EST","10/30/25",14:04:00,"EST","Marion","Rainbow River-3","1","7/8/25",,1,0.001,0,,,"U",,"TI","Sample","COL1028202510302025",,,2025-07-08,2025-10-28,2025-10-30,"1","Florida Lakewatch","21FLKWAT"
"10/28/25",14:00:00,"EST","10/30/25",14:04:00,"EST","Marion","Withlacoochee River-Dunnellon","1","7/8/25",,1,0.014,10,,,"",,,"Sample","COL1028202510302025",,,2025-07-08,2025-10-28,2025-10-30,"10","Florida Lakewatch","21FLKWAT"
"10/28/25",14:00:00,"EST","10/30/25",14:04:00,"EST","Monroe","Tarpon Basin-1","1","4/26/25",,1,0.011,8,,,"Q","Q",,"Sample","COL1028202510302025",,,2025-04-26,2025-10-28,2025-10-30,"8","Florida Lakewatch","21FLKWAT"
"10/28/25",14:00:00,"EST","10/30/25",14:04:00,"EST","Monroe","Tarpon Basin-2","1","4/26/25",,1,0.007,5,,,"Q","Q",,"Sample","COL1028202510302025",,,2025-04-26,2025-10-28,2025-10-30,"5","Florida Lakewatch","21FLKWAT"
"10/28/25",14:00:00,"EST","10/30/25",14:04:00,"EST","Monroe","Tarpon Basin-3","1","4/26/25",,1,0.006,4,,,"Q","Q",,"Sample","COL1028202510302025",,,2025-04-26,2025-10-28,2025-10-30,"4","Florida Lakewatch","21FLKWAT"
"10/28/25",14:00:00,"EST","10/30/25",14:04:00,"EST","Monroe","Tarpon Basin-1","1","7/27/25",,1,0.012,8,,,"",,,"Sample","COL1028202510302025",,,2025-07-27,2025-10-28,2025-10-30,"8","Florida Lakewatch","21FLKWAT"
"10/28/25",14:00:00,"EST","10/30/25",14:04:00,"EST","Monroe","Tarpon Basin-2","1","7/28/25",,1,0.025,18,,,"",,,"Sample","COL1028202510302025",,,2025-07-28,2025-10-28,2025-10-30,"18","Florida Lakewatch","21FLKWAT"
"10/28/25",14:00:00,"EST","10/30/25",14:04:00,"EST","Monroe","Tarpon Basin-3","1","7/29/25",,1,0.02,14,,,"",,,"Sample","COL1028202510302025",,,2025-07-29,2025-10-28,2025-10-30,"14","Florida Lakewatch","21FLKWAT"
"10/28/25",14:00:00,"EST","10/30/25",14:04:00,"EST","Monroe","Tarpon Basin-3","DUP1","7/27/25",,1,0.02,14,,,"",,,"QAQC","COL1028202510302025",,,2025-07-27,2025-10-28,2025-10-30,"14","Florida Lakewatch","21FLKWAT"
"10/28/25",14:00:00,"EST","10/30/25",14:04:00,"EST",,,"ALTQC1",,,1,0.024,17,,,"Q","Q",,"QAQC","COL1028202510302025",,,,2025-10-28,2025-10-30,"17","Florida Lakewatch","21FLKWAT"
"10/28/25",14:00:00,"EST","10/30/25",14:04:00,"EST",,,"CCV1",,,1,0.033,24,,,"Q","Q",,"QAQC","COL1028202510302025",,,,2025-10-28,2025-10-30,"24","Florida Lakewatch","21FLKWAT"
"10/28/25",14:00:00,"EST","10/30/25",14:04:00,"EST",,,"MBLK2",,,1,0,0,,,"QU","Q","TI","QAQC","COL1028202510302025",,,,2025-10-28,2025-10-30,"1","Florida Lakewatch","21FLKWAT"
"10/28/25",14:00:00,"EST","10/30/25",14:04:00,"EST","Okaloosa","Bass","1","7/31/25",,1,0.019,14,,,"",,,"Sample","COL1028202510302025",,,2025-07-31,2025-10-28,2025-10-30,"14","Florida Lakewatch","21FLKWAT"
"10/28/25",14:00:00,"EST","10/30/25",14:04:00,"EST","Sarasota","Cormorant","1","7/14/25",,1,0.063,46,,,"",,,"Sample","COL1028202510302025",,,2025-07-14,2025-10-28,2025-10-30,"46","Florida Lakewatch","21FLKWAT"
"10/28/25",14:00:00,"EST","10/30/25",14:04:00,"EST","Sarasota","3","1","7/19/25",,1,0.051,37,,,"",,,"Sample","COL1028202510302025",,,2025-07-19,2025-10-28,2025-10-30,"37","Florida Lakewatch","21FLKWAT"
"10/28/25",14:00:00,"EST","10/30/25",14:04:00,"EST","Seminole","Lost","1","4/12/25",,1,0.023,17,,,"Q","Q",,"Sample","COL1028202510302025",,,2025-04-12,2025-10-28,2025-10-30,"17","Florida Lakewatch","21FLKWAT"
"10/28/25",14:00:00,"EST","10/30/25",14:04:00,"EST","Seminole","Lost","DUP2","4/12/25",,1,0.023,17,,,"Q","Q",,"QAQC","COL1028202510302025",,,2025-04-12,2025-10-28,2025-10-30,"17","Florida Lakewatch","21FLKWAT"
"10/28/25",14:00:00,"EST","10/30/25",14:04:00,"EST",,,"ALTQC2",,,1,0.024,17,,,"Q","Q",,"QAQC","COL1028202510302025",,,,2025-10-28,2025-10-30,"17","Florida Lakewatch","21FLKWAT"
"10/28/25",14:00:00,"EST","10/30/25",14:04:00,"EST",,,"CCV2",,,1,0.035,25,,,"Q","Q",,"QAQC","COL1028202510302025",,,,2025-10-28,2025-10-30,"25","Florida Lakewatch","21FLKWAT"
"10/28/25",14:00:00,"EST","10/30/25",14:04:00,"EST",,,"MBLK3",,,1,0,0,,,"QU","Q","TI","QAQC","COL1028202510302025",,,,2025-10-28,2025-10-30,"1","Florida Lakewatch","21FLKWAT"
"10/28/25",14:00:00,"EST","10/30/25",14:04:00,"EST","Seminole","Miami Springs-1","1","4/29/25",,1,0.004,2,,,"Q","Q",,"Sample","COL1028202510302025",,,2025-04-29,2025-10-28,2025-10-30,"2","Florida Lakewatch","21FLKWAT"
"10/28/25",14:00:00,"EST","10/30/25",14:04:00,"EST","Seminole","Miami Springs-2","1","4/29/25",,1,0.004,2,,,"Q","Q",,"Sample","COL1028202510302025",,,2025-04-29,2025-10-28,2025-10-30,"2","Florida Lakewatch","21FLKWAT"
"10/28/25",14:00:00,"EST","10/30/25",14:04:00,"EST","Seminole","Miami Springs-3","1","4/29/25",,1,0.005,3,,,"Q","Q",,"Sample","COL1028202510302025",,,2025-04-29,2025-10-28,2025-10-30,"3","Florida Lakewatch","21FLKWAT"
"10/28/25",14:00:00,"EST","10/30/25",14:04:00,"EST","Seminole","Quail Pond","1","4/30/25",,1,0.031,23,,,"Q","Q",,"Sample","COL1028202510302025",,,2025-04-30,2025-10-28,2025-10-30,"23","Florida Lakewatch","21FLKWAT"
"10/28/25",14:00:00,"EST","10/30/25",14:04:00,"EST","Seminole","Quail Pond","1","7/2/25",,1,0.027,20,,,"",,,"Sample","COL1028202510302025",,,2025-07-02,2025-10-28,2025-10-30,"20","Florida Lakewatch","21FLKWAT"
"10/28/25",14:00:00,"EST","10/30/25",14:04:00,"EST","Sumter","Big Gant","1","7/1/25",,1,0.034,25,,,"",,,"Sample","COL1028202510302025",,,2025-07-01,2025-10-28,2025-10-30,"25","Florida Lakewatch","21FLKWAT"
"10/28/25",14:00:00,"EST","10/30/25",14:04:00,"EST","Volusia","Lindley","1","7/30/25",,1,0.021,15,,,"",,,"Sample","COL1028202510302025",,,2025-07-30,2025-10-28,2025-10-30,"15","Florida Lakewatch","21FLKWAT"
"10/28/25",14:00:00,"EST","10/30/25",14:04:00,"EST","Volusia","Waterford","1","1/13/25",,1,0.046,34,,,"Q","Q",,"Sample","COL1028202510302025",,,2025-01-13,2025-10-28,2025-10-30,"34","Florida Lakewatch","21FLKWAT"
"10/28/25",14:00:00,"EST","10/30/25",14:04:00,"EST","Volusia","Waterford","DUP3","1/13/25",,1,0.046,34,,,"Q","Q",,"QAQC","COL1028202510302025",,,2025-01-13,2025-10-28,2025-10-30,"34","Florida Lakewatch","21FLKWAT"
"10/28/25",14:00:00,"EST","10/30/25",14:04:00,"EST",,,"ALTQC3",,,1,0.024,17,,,"Q","Q",,"QAQC","COL1028202510302025",,,,2025-10-28,2025-10-30,"17","Florida Lakewatch","21FLKWAT"
"10/28/25",14:00:00,"EST","10/30/25",14:04:00,"EST",,,"CCV3",,,1,0.034,25,,,"Q","Q",,"QAQC","COL1028202510302025",,,,2025-10-28,2025-10-30,"25","Florida Lakewatch","21FLKWAT"
"10/28/25",14:00:00,"EST","10/30/25",14:04:00,"EST",,,"MBLK4",,,1,,0,,,"QU","Q","TI","QAQC","COL1028202510302025",,,,2025-10-28,2025-10-30,"1","Florida Lakewatch","21FLKWAT"
"10/28/25",14:00:00,"EST","10/30/25",14:04:00,"EST",,,"DUP4",,,1,,0,,,"QU","Q","TI","QAQC","COL1028202510302025",,,,2025-10-28,2025-10-30,"1","Florida Lakewatch","21FLKWAT"
"10/28/25",14:00:00,"EST","10/30/25",14:04:00,"EST",,,"ALTQC4",,,1,,0,,"J","QU","Q","TI","QAQC","COL1028202510302025",,,,2025-10-28,2025-10-30,"1","Florida Lakewatch","21FLKWAT"
"10/28/25",14:00:00,"EST","10/30/25",14:04:00,"EST",,,"CCV4",,,1,,0,,"J","QU","Q","TI","QAQC","COL1028202510302025",,,,2025-10-28,2025-10-30,"1","Florida Lakewatch","21FLKWAT"
"10/28/25",14:00:00,"EST","10/30/25",14:04:00,"EST",,,"MBLK5",,,1,,0,,,"QU","Q","TI","QAQC","COL1028202510302025",,,,2025-10-28,2025-10-30,"1","Florida Lakewatch","21FLKWAT"
"10/28/25",14:00:00,"EST","10/30/25",14:04:00,"EST",,,"DUP5",,,1,,0,,,"QU","Q","TI","QAQC","COL1028202510302025",,,,2025-10-28,2025-10-30,"1","Florida Lakewatch","21FLKWAT"
"10/28/25",14:00:00,"EST","10/30/25",14:04:00,"EST",,,"ALTQC5",,,1,,0,,"J","QU","Q","TI","QAQC","COL1028202510302025",,,,2025-10-28,2025-10-30,"1","Florida Lakewatch","21FLKWAT"
"10/28/25",14:00:00,"EST","10/30/25",14:04:00,"EST",,,"CCV5",,,1,,0,,"J","QU","Q","TI","QAQC","COL1028202510302025",,,,2025-10-28,2025-10-30,"1","Florida Lakewatch","21FLKWAT"
"9/29/25",13:29:00,"EST","9/30/25",10:22:00,"EST",,,"MBLK1",,,1,0.001,0,,,"",,,"QAQC","COL0929202509302025",,,,2025-09-29,2025-09-30,"1","Florida Lakewatch","21FLKWAT"
"9/29/25",13:29:00,"EST","9/30/25",10:22:00,"EST","Hillsborough","Carrol_Comparision","1","7/2/25",,1,0.015,11,,,"",,,"Sample","COL0929202509302025",,,2025-07-02,2025-09-29,2025-09-30,"11","Florida Lakewatch","21FLKWAT"
"9/29/25",13:29:00,"EST","9/30/25",10:22:00,"EST","Hillsborough","Carrol_Comparision","2","7/2/25",,1,0.014,10,,,"",,,"Sample","COL0929202509302025",,,2025-07-02,2025-09-29,2025-09-30,"10","Florida Lakewatch","21FLKWAT"
"9/29/25",13:29:00,"EST","9/30/25",10:22:00,"EST","Hillsborough","Carrol_Comparision","3","7/2/25",,1,0.014,10,,,"",,,"Sample","COL0929202509302025",,,2025-07-02,2025-09-29,2025-09-30,"10","Florida Lakewatch","21FLKWAT"
"9/29/25",13:29:00,"EST","9/30/25",10:22:00,"EST","Hillsborough","Dead Lady_Comparision","1","7/9/25",,1,0.106,77,,,"",,,"Sample","COL0929202509302025",,,2025-07-09,2025-09-29,2025-09-30,"77","Florida Lakewatch","21FLKWAT"
"9/29/25",13:29:00,"EST","9/30/25",10:22:00,"EST","Hillsborough","Dead Lady_Comparision","2","7/9/25",,1,0.106,77,,,"",,,"Sample","COL0929202509302025",,,2025-07-09,2025-09-29,2025-09-30,"77","Florida Lakewatch","21FLKWAT"
"9/29/25",13:29:00,"EST","9/30/25",10:22:00,"EST","Hillsborough","Dead Lady_Comparision","3","7/9/25",,1,0.115,84,,,"",,,"Sample","COL0929202509302025",,,2025-07-09,2025-09-29,2025-09-30,"84","Florida Lakewatch","21FLKWAT"
"9/29/25",13:29:00,"EST","9/30/25",10:22:00,"EST","Pasco","Jovita_Comparision","1","7/18/25",,1,0.016,11,,,"",,,"Sample","COL0929202509302025",,,2025-07-18,2025-09-29,2025-09-30,"11","Florida Lakewatch","21FLKWAT"
"9/29/25",13:29:00,"EST","9/30/25",10:22:00,"EST","Pasco","Jovita_Comparision","2","7/18/25",,1,0.014,10,,,"",,,"Sample","COL0929202509302025",,,2025-07-18,2025-09-29,2025-09-30,"10","Florida Lakewatch","21FLKWAT"
"9/29/25",13:29:00,"EST","9/30/25",10:22:00,"EST","Pasco","Jovita_Comparision","3","7/18/25",,1,0.014,10,,,"",,,"Sample","COL0929202509302025",,,2025-07-18,2025-09-29,2025-09-30,"10","Florida Lakewatch","21FLKWAT"
"9/29/25",13:29:00,"EST","9/30/25",10:22:00,"EST","Hillsborough","Cooper","DUP1","8/8/25",,1,0.054,39,,,"",,,"QAQC","COL0929202509302025",,,2025-08-08,2025-09-29,2025-09-30,"39","Florida Lakewatch","21FLKWAT"
"9/29/25",13:29:00,"EST","9/30/25",10:22:00,"EST",,,"ALTQC1",,,1,0.025,18,,,"",,,"QAQC","COL0929202509302025",,,,2025-09-29,2025-09-30,"18","Florida Lakewatch","21FLKWAT"
"9/29/25",13:29:00,"EST","9/30/25",10:22:00,"EST",,,"CCV1",,,1,0.034,25,,,"",,,"Sample","COL0929202509302025",,,,2025-09-29,2025-09-30,"25","Florida Lakewatch","21FLKWAT"
"9/29/25",13:29:00,"EST","9/30/25",10:22:00,"EST",,,"MBLK2",,,1,0.001,0,,,"",,,"Sample","COL0929202509302025",,,,2025-09-29,2025-09-30,"1","Florida Lakewatch","21FLKWAT"
"9/29/25",13:29:00,"EST","9/30/25",10:22:00,"EST","Hillsborough","Cooper_Comparison Study","1","8/8/25",,1,0.057,41,,,"",,,"Sample","COL0929202509302025",,,2025-08-08,2025-09-29,2025-09-30,"41","Florida Lakewatch","21FLKWAT"
"9/29/25",13:29:00,"EST","9/30/25",10:22:00,"EST","Hillsborough","Cooper_Comparison Study","2","8/8/25",,1,0.057,41,,,"",,,"Sample","COL0929202509302025",,,2025-08-08,2025-09-29,2025-09-30,"41","Florida Lakewatch","21FLKWAT"
"9/29/25",13:29:00,"EST","9/30/25",10:22:00,"EST","Hillsborough","Cooper_Comparison Study","3","8/8/25",,1,0.056,41,,,"",,,"Sample","COL0929202509302025",,,2025-08-08,2025-09-29,2025-09-30,"41","Florida Lakewatch","21FLKWAT"
"9/29/25",13:29:00,"EST","9/30/25",10:22:00,"EST","Hillsborough","Keystone_Comparison Study","1","8/5/25",,1,0.121,88,,,"",,,"Sample","COL0929202509302025",,,2025-08-05,2025-09-29,2025-09-30,"88","Florida Lakewatch","21FLKWAT"
"9/29/25",13:29:00,"EST","9/30/25",10:22:00,"EST","Hillsborough","Keystone_Comparison Study","2","8/5/25",,1,0.105,76,,,"",,,"Sample","COL0929202509302025",,,2025-08-05,2025-09-29,2025-09-30,"76","Florida Lakewatch","21FLKWAT"
"9/29/25",13:29:00,"EST","9/30/25",10:22:00,"EST","Hillsborough","Keystone_Comparison Study","3","8/5/25",,1,0.102,74,,,"",,,"Sample","COL0929202509302025",,,2025-08-05,2025-09-29,2025-09-30,"74","Florida Lakewatch","21FLKWAT"
"9/29/25",13:29:00,"EST","9/30/25",10:22:00,"EST","Hillsborough","Twin_Comparison","1","7/22/25",,1,0.041,30,,,"",,,"Sample","COL0929202509302025",,,2025-07-22,2025-09-29,2025-09-30,"30","Florida Lakewatch","21FLKWAT"
"9/29/25",13:29:00,"EST","9/30/25",10:22:00,"EST","Hillsborough","Twin_Comparison","2","7/22/25",,1,0.042,30,,,"",,,"Sample","COL0929202509302025",,,2025-07-22,2025-09-29,2025-09-30,"30","Florida Lakewatch","21FLKWAT"
"9/29/25",13:29:00,"EST","9/30/25",10:22:00,"EST",,,,,,,,0,,,"",,,"QAQC","COL0929202509302025",,,,2025-09-29,2025-09-30,"1","Florida Lakewatch","21FLKWAT"
"9/29/25",13:29:00,"EST","9/30/25",10:22:00,"EST","Hillsborough","Twin_Comparison","3","7/22/25",,1,0.043,31,,,"",,,"QAQC","COL0929202509302025",,,2025-07-22,2025-09-29,2025-09-30,"31","Florida Lakewatch","21FLKWAT"
"9/29/25",13:29:00,"EST","9/30/25",10:22:00,"EST","Hillsborough","Twin_Comparison","DUP2","7/22/25",,1,0.043,31,,,"",,,"Sample","COL0929202509302025",,,2025-07-22,2025-09-29,2025-09-30,"31","Florida Lakewatch","21FLKWAT"
"9/29/25",13:29:00,"EST","9/30/25",10:22:00,"EST",,,"ALTQC2",,,1,0.025,18,,,"Q","Q",,"Sample","COL0929202509302025",,,,2025-09-29,2025-09-30,"18","Florida Lakewatch","21FLKWAT"
"9/29/25",13:29:00,"EST","9/30/25",10:22:00,"EST",,,"CCV2",,,1,0.034,25,,,"Q","Q",,"Sample","COL0929202509302025",,,,2025-09-29,2025-09-30,"25","Florida Lakewatch","21FLKWAT"
"9/29/25",13:29:00,"EST","9/30/25",10:22:00,"EST",,,"MBLK3",,,1,,0,,,"QU","Q","TI","Sample","COL0929202509302025",,,,2025-09-29,2025-09-30,"1","Florida Lakewatch","21FLKWAT"
"9/29/25",13:29:00,"EST","9/30/25",10:22:00,"EST",,,"DUP3",,,,,0,,,"QU","Q","TI","QAQC","COL0929202509302025",,,,2025-09-29,2025-09-30,"1","Florida Lakewatch","21FLKWAT"
"9/29/25",13:29:00,"EST","9/30/25",10:22:00,"EST",,,"ALTQC3",,,,,0,,,"QU","Q","TI","QAQC","COL0929202509302025",,,,2025-09-29,2025-09-30,"1","Florida Lakewatch","21FLKWAT"
"9/29/25",13:29:00,"EST","9/30/25",10:22:00,"EST",,,"CCV3",,,,,0,,,"QU","Q","TI","QAQC","COL0929202509302025",,,,2025-09-29,2025-09-30,"1","Florida Lakewatch","21FLKWAT"
"9/29/25",13:29:00,"EST","9/30/25",10:22:00,"EST",,,"MLBK4",,,,,0,,,"QU","Q","TI","QAQC","COL0929202509302025",,,,2025-09-29,2025-09-30,"1","Florida Lakewatch","21FLKWAT"
"9/29/25",13:29:00,"EST","9/30/25",10:22:00,"EST",,,"DUP4",,,,,0,,,"QU","Q","TI","QAQC","COL0929202509302025",,,,2025-09-29,2025-09-30,"1","Florida Lakewatch","21FLKWAT"
"9/29/25",13:29:00,"EST","9/30/25",10:22:00,"EST",,,"ALTQC4",,,,,0,,"J","QU","Q","TI","QAQC","COL0929202509302025",,,,2025-09-29,2025-09-30,"1","Florida Lakewatch","21FLKWAT"
"9/29/25",13:29:00,"EST","9/30/25",10:22:00,"EST",,,"CCV4",,,,,0,,"J","QU","Q","TI","QAQC","COL0929202509302025",,,,2025-09-29,2025-09-30,"1","Florida Lakewatch","21FLKWAT"
"9/29/25",13:29:00,"EST","9/30/25",10:22:00,"EST",,,"MLBK5",,,,,0,,,"QU","Q","TI","QAQC","COL0929202509302025",,,,2025-09-29,2025-09-30,"1","Florida Lakewatch","21FLKWAT"
"9/29/25",13:29:00,"EST","9/30/25",10:22:00,"EST",,,"DUP5",,,,,0,,,"QU","Q","TI","QAQC","COL0929202509302025",,,,2025-09-29,2025-09-30,"1","Florida Lakewatch","21FLKWAT"
"9/29/25",13:29:00,"EST","9/30/25",10:22:00,"EST",,,"ALTQC5",,,,,0,,"J","QU","Q","TI","QAQC","COL0929202509302025",,,,2025-09-29,2025-09-30,"1","Florida Lakewatch","21FLKWAT"
"9/29/25",13:29:00,"EST","9/30/25",10:22:00,"EST",,,"CCV5",,,,,0,,"J","QU","Q","TI","QAQC","COL0929202509302025",,,,2025-09-29,2025-09-30,"1","Florida Lakewatch","21FLKWAT"
"11/3/25",15:00:00,"EST","11/5/25",14:52:00,"EST",,,"MBLK1",,,1,0,1,,,"QU","Q","TI","QAQC","COL1103202511052025",,,,2025-11-03,2025-11-05,"1","Florida Lakewatch","21FLKWAT"
"11/3/25",15:00:00,"EST","11/5/25",14:52:00,"EST","Putnam","Anderson Cue","1","9/2/25",,1,0.005,4,,,"",,,"Sample","COL1103202511052025",,,2025-09-02,2025-11-03,2025-11-05,"4","Florida Lakewatch","21FLKWAT"
"11/3/25",15:00:00,"EST","11/5/25",14:52:00,"EST","Putnam","Anderson Cue","2","9/2/25",,1,0.007,6,,,"",,,"Sample","COL1103202511052025",,,2025-09-02,2025-11-03,2025-11-05,"6","Florida Lakewatch","21FLKWAT"
"11/3/25",15:00:00,"EST","11/5/25",14:52:00,"EST","Putnam","Anderson Cue","3","9/2/25",,1,0.006,5,,,"",,,"Sample","COL1103202511052025",,,2025-09-02,2025-11-03,2025-11-05,"5","Florida Lakewatch","21FLKWAT"
"11/3/25",15:00:00,"EST","11/5/25",14:52:00,"EST","Putnam","Barco","1","9/2/25",,1,0.007,6,,,"",,,"Sample","COL1103202511052025",,,2025-09-02,2025-11-03,2025-11-05,"6","Florida Lakewatch","21FLKWAT"
"11/3/25",15:00:00,"EST","11/5/25",14:52:00,"EST","Putnam","Barco","2","9/2/25",,1,0.008,6,,,"",,,"Sample","COL1103202511052025",,,2025-09-02,2025-11-03,2025-11-05,"6","Florida Lakewatch","21FLKWAT"
"11/3/25",15:00:00,"EST","11/5/25",14:52:00,"EST","Putnam","Barco","3","9/2/25",,1,0.009,7,,,"",,,"Sample","COL1103202511052025",,,2025-09-02,2025-11-03,2025-11-05,"7","Florida Lakewatch","21FLKWAT"
"11/3/25",15:00:00,"EST","11/5/25",14:52:00,"EST","Putnam","Enslow","1","9/2/25",,1,0.03,23,,,"",,,"Sample","COL1103202511052025",,,2025-09-02,2025-11-03,2025-11-05,"23","Florida Lakewatch","21FLKWAT"
"11/3/25",15:00:00,"EST","11/5/25",14:52:00,"EST","Putnam","Enslow","2","9/2/25",,1,0.036,27,,,"",,,"Sample","COL1103202511052025",,,2025-09-02,2025-11-03,2025-11-05,"27","Florida Lakewatch","21FLKWAT"
"11/3/25",15:00:00,"EST","11/5/25",14:52:00,"EST","Putnam","Enslow","3","9/2/25",,1,0.048,36,,,"",,,"Sample","COL1103202511052025",,,2025-09-02,2025-11-03,2025-11-05,"36","Florida Lakewatch","21FLKWAT"
"11/3/25",15:00:00,"EST","11/5/25",14:52:00,"EST","Putnam","Goose","1","9/3/25",,2,0.149,220,,,"",,,"Sample","COL1103202511052025",,,2025-09-03,2025-11-03,2025-11-05,"220","Florida Lakewatch","21FLKWAT"
"11/3/25",15:00:00,"EST","11/5/25",14:52:00,"EST","Putnam","Goose","2","9/3/25",,2,0.152,224,,,"",,,"Sample","COL1103202511052025",,,2025-09-03,2025-11-03,2025-11-05,"224","Florida Lakewatch","21FLKWAT"
"11/3/25",15:00:00,"EST","11/5/25",14:52:00,"EST","Putnam","Goose","3","9/3/25",,2,0.148,218,,,"",,,"Sample","COL1103202511052025",,,2025-09-03,2025-11-03,2025-11-05,"218","Florida Lakewatch","21FLKWAT"
"11/3/25",15:00:00,"EST","11/5/25",14:52:00,"EST","Putnam","McCloud","1","9/2/25",,1,0.018,14,,,"",,,"Sample","COL1103202511052025",,,2025-09-02,2025-11-03,2025-11-05,"14","Florida Lakewatch","21FLKWAT"
"11/3/25",15:00:00,"EST","11/5/25",14:52:00,"EST","Putnam","McCloud","2","9/2/25",,1,0.016,12,,,"",,,"Sample","COL1103202511052025",,,2025-09-02,2025-11-03,2025-11-05,"12","Florida Lakewatch","21FLKWAT"
"11/3/25",15:00:00,"EST","11/5/25",14:52:00,"EST","Putnam","McCloud","3","9/2/25",,1,0.017,13,,,"",,,"Sample","COL1103202511052025",,,2025-09-02,2025-11-03,2025-11-05,"13","Florida Lakewatch","21FLKWAT"
"11/3/25",15:00:00,"EST","11/5/25",14:52:00,"EST","Putnam","Ross","1","9/3/25",,4,0.113,334,,,"",,,"Sample","COL1103202511052025",,,2025-09-03,2025-11-03,2025-11-05,"334","Florida Lakewatch","21FLKWAT"
"11/3/25",15:00:00,"EST","11/5/25",14:52:00,"EST","Putnam","Ross","2","9/3/25",,4,0.117,346,,,"",,,"Sample","COL1103202511052025",,,2025-09-03,2025-11-03,2025-11-05,"346","Florida Lakewatch","21FLKWAT"
"11/3/25",15:00:00,"EST","11/5/25",14:52:00,"EST","Putnam","Ross","3","9/3/25",,4,0.116,343,,,"",,,"Sample","COL1103202511052025",,,2025-09-03,2025-11-03,2025-11-05,"343","Florida Lakewatch","21FLKWAT"
"11/3/25",15:00:00,"EST","11/5/25",14:52:00,"EST","Putnam","Rowan","1","9/2/25",,1,0.098,73,,,"",,,"Sample","COL1103202511052025",,,2025-09-02,2025-11-03,2025-11-05,"73","Florida Lakewatch","21FLKWAT"
"11/3/25",15:00:00,"EST","11/5/25",14:52:00,"EST","Putnam","Rowan","DUP1","9/2/25",,1,0.098,73,,,"",,,"QAQC","COL1103202511052025",,,2025-09-02,2025-11-03,2025-11-05,"73","Florida Lakewatch","21FLKWAT"
"11/3/25",15:00:00,"EST","11/5/25",14:52:00,"EST",,,"ALTQC1",,,1,0.024,18,,,"Q","Q",,"QAQC","COL1103202511052025",,,,2025-11-03,2025-11-05,"18","Florida Lakewatch","21FLKWAT"
"11/3/25",15:00:00,"EST","11/5/25",14:52:00,"EST",,,"CCV1",,,1,0.033,25,,,"Q","Q",,"QAQC","COL1103202511052025",,,,2025-11-03,2025-11-05,"25","Florida Lakewatch","21FLKWAT"
"11/3/25",15:00:00,"EST","11/5/25",14:52:00,"EST",,,"MBLK2",,,1,0,1,,,"QU","Q","TI","QAQC","COL1103202511052025",,,,2025-11-03,2025-11-05,"1","Florida Lakewatch","21FLKWAT"
"11/3/25",15:00:00,"EST","11/5/25",14:52:00,"EST","Putnam","Rowan","2","9/2/25",,1,0.098,73,,,"",,,"Sample","COL1103202511052025",,,2025-09-02,2025-11-03,2025-11-05,"73","Florida Lakewatch","21FLKWAT"
"11/3/25",15:00:00,"EST","11/5/25",14:52:00,"EST","Putnam","Rowan","3","9/2/25",,1,0.097,72,,,"",,,"Sample","COL1103202511052025",,,2025-09-02,2025-11-03,2025-11-05,"72","Florida Lakewatch","21FLKWAT"
"11/3/25",15:00:00,"EST","11/5/25",14:52:00,"EST","Putnam","Suggs","1","9/3/25",,2,0.15,221,,,"",,,"Sample","COL1103202511052025",,,2025-09-03,2025-11-03,2025-11-05,"221","Florida Lakewatch","21FLKWAT"
"11/3/25",15:00:00,"EST","11/5/25",14:52:00,"EST","Putnam","Suggs","2","9/3/25",,2,0.143,211,,,"",,,"Sample","COL1103202511052025",,,2025-09-03,2025-11-03,2025-11-05,"211","Florida Lakewatch","21FLKWAT"
"11/3/25",15:00:00,"EST","11/5/25",14:52:00,"EST","Putnam","Suggs","3","9/3/25",,2,0.143,211,,,"",,,"Sample","COL1103202511052025",,,2025-09-03,2025-11-03,2025-11-05,"211","Florida Lakewatch","21FLKWAT"
"11/3/25",15:00:00,"EST","11/5/25",14:52:00,"EST","Orange","Big Sand","2","7/21/25",,1,0.018,14,,,"",,,"Sample","COL1103202511052025",,,2025-07-21,2025-11-03,2025-11-05,"14","Florida Lakewatch","21FLKWAT"
"11/3/25",15:00:00,"EST","11/5/25",14:52:00,"EST","Volusia","St. John's Harney-3","1","7/24/25",,4,0.106,314,,,"",,,"Sample","COL1103202511052025",,,2025-07-24,2025-11-03,2025-11-05,"314","Florida Lakewatch","21FLKWAT"
"11/3/25",15:00:00,"EST","11/5/25",14:52:00,"EST","Volusia","St. John's Jesup-1","1","7/24/25",,4,0.112,331,,,"",,,"Sample","COL1103202511052025",,,2025-07-24,2025-11-03,2025-11-05,"331","Florida Lakewatch","21FLKWAT"
"11/3/25",15:00:00,"EST","11/5/25",14:52:00,"EST","Volusia","St. John's Lemon Bluff-2","1","7/24/25",,4,0.123,363,,,"",,,"Sample","COL1103202511052025",,,2025-07-24,2025-11-03,2025-11-05,"363","Florida Lakewatch","21FLKWAT"
"11/3/25",15:00:00,"EST","11/5/25",14:52:00,"EST","Volusia","Mud","1","7/24/25",,4,0.061,181,,,"",,,"Sample","COL1103202511052025",,,2025-07-24,2025-11-03,2025-11-05,"181","Florida Lakewatch","21FLKWAT"
"11/3/25",15:00:00,"EST","11/5/25",14:52:00,"EST","Wakulla","Wakulla River-1","1","4/17/25",,1,0.007,6,,,"Q","Q",,"Sample","COL1103202511052025",,,2025-04-17,2025-11-03,2025-11-05,"6","Florida Lakewatch","21FLKWAT"
"11/3/25",15:00:00,"EST","11/5/25",14:52:00,"EST","Wakulla","Wakulla River-2","1","4/17/25",,1,0.006,5,,,"Q","Q",,"Sample","COL1103202511052025",,,2025-04-17,2025-11-03,2025-11-05,"5","Florida Lakewatch","21FLKWAT"
"11/3/25",15:00:00,"EST","11/5/25",14:52:00,"EST","Wakulla","Wakulla River-3","1","4/17/25",,1,0.007,6,,,"Q","Q",,"Sample","COL1103202511052025",,,2025-04-17,2025-11-03,2025-11-05,"6","Florida Lakewatch","21FLKWAT"
"11/3/25",15:00:00,"EST","11/5/25",14:52:00,"EST","Walton","Allen","1","7/27/25",,1,0.128,95,,,"",,,"Sample","COL1103202511052025",,,2025-07-27,2025-11-03,2025-11-05,"95","CHOCTAWHATCHEE BASIN ALLIANCE","BAYRALLY"
"11/3/25",15:00:00,"EST","11/5/25",14:52:00,"EST","Walton","CBA Mullet Creek-1","1","7/20/25",,1,0.033,25,,,"",,,"Sample","COL1103202511052025",,,2025-07-20,2025-11-03,2025-11-05,"25","CHOCTAWHATCHEE BASIN ALLIANCE","BAYRALLY"
"11/3/25",15:00:00,"EST","11/5/25",14:52:00,"EST","Walton","CBA Mullet Creek-1","DUP2","7/20/25",,1,0.033,25,,,"",,,"QAQC","COL1103202511052025",,,2025-07-20,2025-11-03,2025-11-05,"25","CHOCTAWHATCHEE BASIN ALLIANCE","BAYRALLY"
"11/3/25",15:00:00,"EST","11/5/25",14:52:00,"EST",,,"ALTQC2",,,1,0.024,18,,,"Q","Q",,"QAQC","COL1103202511052025",,,,2025-11-03,2025-11-05,"18","Florida Lakewatch","21FLKWAT"
"11/3/25",15:00:00,"EST","11/5/25",14:52:00,"EST",,,"CCV2",,,1,0.034,26,,,"Q","Q",,"QAQC","COL1103202511052025",,,,2025-11-03,2025-11-05,"26","Florida Lakewatch","21FLKWAT"
"11/3/25",15:00:00,"EST","11/5/25",14:52:00,"EST",,,"MBLK3",,,1,0,1,,,"QU","Q","TI","QAQC","COL1103202511052025",,,,2025-11-03,2025-11-05,"1","Florida Lakewatch","21FLKWAT"
"11/3/25",15:00:00,"EST","11/5/25",14:52:00,"EST","Walton","CBA Mullet Creek-2","1","7/20/25",,1,0.033,25,,,"",,,"Sample","COL1103202511052025",,,2025-07-20,2025-11-03,2025-11-05,"25","CHOCTAWHATCHEE BASIN ALLIANCE","BAYRALLY"
"11/3/25",15:00:00,"EST","11/5/25",14:52:00,"EST","Walton","CBA Mullet Creek-3","1","7/20/25",,1,0.034,26,,,"",,,"Sample","COL1103202511052025",,,2025-07-20,2025-11-03,2025-11-05,"26","CHOCTAWHATCHEE BASIN ALLIANCE","BAYRALLY"
"11/3/25",15:00:00,"EST","11/5/25",14:52:00,"EST","Walton","Deer","1","7/25/25",,1,0.087,64,,,"",,,"Sample","COL1103202511052025",,,2025-07-25,2025-11-03,2025-11-05,"64","CHOCTAWHATCHEE BASIN ALLIANCE","BAYRALLY"
"11/3/25",15:00:00,"EST","11/5/25",14:52:00,"EST","Walton","Draper","1","4/24/25",,1,0.024,18,,,"Q","Q",,"Sample","COL1103202511052025",,,2025-04-24,2025-11-03,2025-11-05,"18","CHOCTAWHATCHEE BASIN ALLIANCE","BAYRALLY"
"11/3/25",15:00:00,"EST","11/5/25",14:52:00,"EST","Walton","Draper","1","7/29/25",,1,0.026,20,,,"",,,"Sample","COL1103202511052025",,,2025-07-29,2025-11-03,2025-11-05,"20","CHOCTAWHATCHEE BASIN ALLIANCE","BAYRALLY"
"11/3/25",15:00:00,"EST","11/5/25",14:52:00,"EST","Walton","Eastern","1","7/24/25",,1,0.035,26,,,"",,,"Sample","COL1103202511052025",,,2025-07-24,2025-11-03,2025-11-05,"26","CHOCTAWHATCHEE BASIN ALLIANCE","BAYRALLY"
"11/3/25",15:00:00,"EST","11/5/25",14:52:00,"EST","Walton","Eastern North","1","7/25/25",,1,0.026,20,,,"",,,"Sample","COL1103202511052025",,,2025-07-25,2025-11-03,2025-11-05,"20","CHOCTAWHATCHEE BASIN ALLIANCE","BAYRALLY"
"11/3/25",15:00:00,"EST","11/5/25",14:52:00,"EST","Walton","Fuller","1","7/28/25",,1,0.168,124,,,"",,,"Sample","COL1103202511052025",,,2025-07-28,2025-11-03,2025-11-05,"124","CHOCTAWHATCHEE BASIN ALLIANCE","BAYRALLY"
"11/3/25",15:00:00,"EST","11/5/25",14:52:00,"EST","Walton","Grayton","1","7/22/25",,1,0.055,41,,,"",,,"Sample","COL1103202511052025",,,2025-07-22,2025-11-03,2025-11-05,"41","CHOCTAWHATCHEE BASIN ALLIANCE","BAYRALLY"
"11/3/25",15:00:00,"EST","11/5/25",14:52:00,"EST","Walton","Little Red Fish","2","7/26/25",,1,0.055,41,,,"",,,"Sample","COL1103202511052025",,,2025-07-26,2025-11-03,2025-11-05,"41","CHOCTAWHATCHEE BASIN ALLIANCE","BAYRALLY"
"11/3/25",15:00:00,"EST","11/5/25",14:52:00,"EST","Walton","Morris","1","7/3/25",,1,0.057,42,,,"",,,"Sample","COL1103202511052025",,,2025-07-03,2025-11-03,2025-11-05,"42","CHOCTAWHATCHEE BASIN ALLIANCE","BAYRALLY"
"11/3/25",15:00:00,"EST","11/5/25",14:52:00,"EST","Walton","Oyster","1","7/9/25",,1,0.097,72,,,"",,,"Sample","COL1103202511052025",,,2025-07-09,2025-11-03,2025-11-05,"72","CHOCTAWHATCHEE BASIN ALLIANCE","BAYRALLY"
"11/3/25",15:00:00,"EST","11/5/25",14:52:00,"EST","Walton","Powell","1","7/9/25",,1,0.061,45,,,"",,,"Sample","COL1103202511052025",,,2025-07-09,2025-11-03,2025-11-05,"45","CHOCTAWHATCHEE BASIN ALLIANCE","BAYRALLY"
"11/3/25",15:00:00,"EST","11/5/25",14:52:00,"EST","Walton","Stallworth","3","4/17/25",,1,0.033,25,,,"Q","Q",,"Sample","COL1103202511052025",,,2025-04-17,2025-11-03,2025-11-05,"25","CHOCTAWHATCHEE BASIN ALLIANCE","BAYRALLY"
"11/3/25",15:00:00,"EST","11/5/25",14:52:00,"EST","Walton","Stallworth","1","7/3/25",,1,0.03,23,,,"",,,"Sample","COL1103202511052025",,,2025-07-03,2025-11-03,2025-11-05,"23","CHOCTAWHATCHEE BASIN ALLIANCE","BAYRALLY"
"11/3/25",15:00:00,"EST","11/5/25",14:52:00,"EST","Walton","Tresca","1","7/25/25",,1,0.066,49,,,"",,,"Sample","COL1103202511052025",,,2025-07-25,2025-11-03,2025-11-05,"49","CHOCTAWHATCHEE BASIN ALLIANCE","BAYRALLY"
"11/3/25",15:00:00,"EST","11/5/25",14:52:00,"EST","Walton","Western","1","7/22/25",,1,0.053,39,,,"",,,"Sample","COL1103202511052025",,,2025-07-22,2025-11-03,2025-11-05,"39","CHOCTAWHATCHEE BASIN ALLIANCE","BAYRALLY"
"11/3/25",15:00:00,"EST","11/5/25",14:52:00,"EST","Walton","Western Northeast","1","7/21/25",,1,0.121,89,,,"",,,"Sample","COL1103202511052025",,,2025-07-21,2025-11-03,2025-11-05,"89","CHOCTAWHATCHEE BASIN ALLIANCE","BAYRALLY"
"11/3/25",15:00:00,"EST","11/5/25",14:52:00,"EST","Pasco","Wisteria","1","7/22/25",,1,0.045,34,,,"",,,"Sample","COL1103202511052025",,,2025-07-22,2025-11-03,2025-11-05,"34","Florida Lakewatch","21FLKWAT"
"11/3/25",15:00:00,"EST","11/5/25",14:52:00,"EST","Pasco","Wisteria","DUP3","7/22/25",,1,0.045,34,,,"",,,"QAQC","COL1103202511052025",,,2025-07-22,2025-11-03,2025-11-05,"34","Florida Lakewatch","21FLKWAT"
"11/3/25",15:00:00,"EST","11/5/25",14:52:00,"EST",,,"ALTQC3",,,1,0.025,19,,,"Q","Q",,"QAQC","COL1103202511052025",,,,2025-11-03,2025-11-05,"19","Florida Lakewatch","21FLKWAT"
"11/3/25",15:00:00,"EST","11/5/25",14:52:00,"EST",,,"CCV3",,,1,0.034,26,,,"Q","Q",,"QAQC","COL1103202511052025",,,,2025-11-03,2025-11-05,"26","Florida Lakewatch","21FLKWAT"
"11/3/25",15:00:00,"EST","11/5/25",14:52:00,"EST",,,"MBLK4",,,1,,1,,,"QU","Q","TI","QAQC","COL1103202511052025",,,,2025-11-03,2025-11-05,"1","Florida Lakewatch","21FLKWAT"
"11/3/25",15:00:00,"EST","11/5/25",14:52:00,"EST",,,"DUP4",,,1,,1,,,"QU","Q","TI","QAQC","COL1103202511052025",,,,2025-11-03,2025-11-05,"1","Florida Lakewatch","21FLKWAT"
"11/3/25",15:00:00,"EST","11/5/25",14:52:00,"EST",,,"ALTQC4",,,1,,1,,"J","QU","Q","TI","QAQC","COL1103202511052025",,,,2025-11-03,2025-11-05,"1","Florida Lakewatch","21FLKWAT"
"11/3/25",15:00:00,"EST","11/5/25",14:52:00,"EST",,,"CCV4",,,1,,1,,"J","QU","Q","TI","QAQC","COL1103202511052025",,,,2025-11-03,2025-11-05,"1","Florida Lakewatch","21FLKWAT"
"11/3/25",15:00:00,"EST","11/5/25",14:52:00,"EST",,,"MBLK5",,,1,,1,,,"QU","Q","TI","QAQC","COL1103202511052025",,,,2025-11-03,2025-11-05,"1","Florida Lakewatch","21FLKWAT"
"11/3/25",15:00:00,"EST","11/5/25",14:52:00,"EST",,,"DUP5",,,1,,1,,,"QU","Q","TI","QAQC","COL1103202511052025",,,,2025-11-03,2025-11-05,"1","Florida Lakewatch","21FLKWAT"
"11/3/25",15:00:00,"EST","11/5/25",14:52:00,"EST",,,"ALTQC5",,,1,,1,,"J","QU","Q","TI","QAQC","COL1103202511052025",,,,2025-11-03,2025-11-05,"1","Florida Lakewatch","21FLKWAT"
"11/3/25",15:00:00,"EST","11/5/25",14:52:00,"EST",,,"CCV5",,,1,,1,,"J","QU","Q","TI","QAQC","COL1103202511052025",,,,2025-11-03,2025-11-05,"1","Florida Lakewatch","21FLKWAT"
"11/4/25",13:29:00,"EST","11/5/25",10:53:00,"EST",,,"MBLK1",,,1,0.001,0,,,"QU","Q","TI","QAQC","COL1104202511052025",,,,2025-11-04,2025-11-05,"1","Florida Lakewatch","21FLKWAT"
"11/4/25",13:29:00,"EST","11/5/25",10:53:00,"EST","Alachua","Orange","1","7/11/25",,1,0.168,125,,,"",,,"Sample","COL1104202511052025",,,2025-07-11,2025-11-04,2025-11-05,"125","Florida Lakewatch","21FLKWAT"
"11/4/25",13:29:00,"EST","11/5/25",10:53:00,"EST","Alachua","Orange","3","7/11/25",,2,0.176,263,,,"",,,"Sample","COL1104202511052025",,,2025-07-11,2025-11-04,2025-11-05,"263","Florida Lakewatch","21FLKWAT"
"11/4/25",13:29:00,"EST","11/5/25",10:53:00,"EST","Alachua","Orange","5","8/12/25",,2,0.121,180,,,"",,,"Sample","COL1104202511052025",,,2025-08-12,2025-11-04,2025-11-05,"180","Florida Lakewatch","21FLKWAT"
"11/4/25",13:29:00,"EST","11/5/25",10:53:00,"EST","Charlotte","WF-4","DUP1","7/17/25",,1,0.098,73,,,"",,,"QAQC","COL1104202511052025",,,2025-07-17,2025-11-04,2025-11-05,"73","Florida Lakewatch","21FLKWAT"
"11/4/25",13:29:00,"EST","11/5/25",10:53:00,"EST",,,"ALTQC1",,,1,0.025,18,,,"Q","Q",,"QAQC","COL1104202511052025",,,,2025-11-04,2025-11-05,"18","Florida Lakewatch","21FLKWAT"
"11/4/25",13:29:00,"EST","11/5/25",10:53:00,"EST",,,"CCV1",,,1,0.034,25,,,"Q","Q",,"QAQC","COL1104202511052025",,,,2025-11-04,2025-11-05,"25","Florida Lakewatch","21FLKWAT"
"11/4/25",13:29:00,"EST","11/5/25",10:53:00,"EST",,,"MLBK2",,,1,0,0,,,"QU","Q","TI","QAQC","COL1104202511052025",,,,2025-11-04,2025-11-05,"1","Florida Lakewatch","21FLKWAT"
"11/4/25",13:29:00,"EST","11/5/25",10:53:00,"EST","Columbia","Rum Island Spring-1","1","7/17/25",,1,0.008,6,,,"",,,"Sample","COL1104202511052025",,,2025-07-17,2025-11-04,2025-11-05,"6","Florida Lakewatch","21FLKWAT"
"11/4/25",13:29:00,"EST","11/5/25",10:53:00,"EST","Gilchrist","Ginnie Spring Run-1","1","7/17/25",,1,0.004,3,,,"",,,"Sample","COL1104202511052025",,,2025-07-17,2025-11-04,2025-11-05,"3","Florida Lakewatch","21FLKWAT"
"11/4/25",13:29:00,"EST","11/5/25",10:53:00,"EST","Hillsborough","Cedar West","1","7/26/25",,1,0.043,32,,,"",,,"Sample","COL1104202511052025",,,2025-07-26,2025-11-04,2025-11-05,"32","Florida Lakewatch","21FLKWAT"
"11/4/25",13:29:00,"EST","11/5/25",10:53:00,"EST","Lake","Bay","1","7/18/25",,1,0.147,110,,,"",,,"Sample","COL1104202511052025",,,2025-07-18,2025-11-04,2025-11-05,"110","Florida Lakewatch","21FLKWAT"
"11/4/25",13:29:00,"EST","11/5/25",10:53:00,"EST","Lake","Florence","1","7/8/25",,1,0.015,11,,,"",,,"Sample","COL1104202511052025",,,2025-07-08,2025-11-04,2025-11-05,"11","Florida Lakewatch","21FLKWAT"
"11/4/25",13:29:00,"EST","11/5/25",10:53:00,"EST","Leon","Miccusukee","1","8/15/25",,1,0.094,70,,,"",,,"Sample","COL1104202511052025",,,2025-08-15,2025-11-04,2025-11-05,"70","Florida Lakewatch","21FLKWAT"
"11/4/25",13:29:00,"EST","11/5/25",10:53:00,"EST","Leon","Miccusukee","2","8/15/25",,1,0.065,48,,,"",,,"Sample","COL1104202511052025",,,2025-08-15,2025-11-04,2025-11-05,"48","Florida Lakewatch","21FLKWAT"
"11/4/25",13:29:00,"EST","11/5/25",10:53:00,"EST","Leon","Miccusukee","3","8/15/25",,1,0.076,56,,,"",,,"Sample","COL1104202511052025",,,2025-08-15,2025-11-04,2025-11-05,"56","Florida Lakewatch","21FLKWAT"
"11/4/25",13:29:00,"EST","11/5/25",10:53:00,"EST","Leon","Miccusukee","4","8/15/25",,1,0.056,42,,,"",,,"Sample","COL1104202511052025",,,2025-08-15,2025-11-04,2025-11-05,"42","Florida Lakewatch","21FLKWAT"
"11/4/25",13:29:00,"EST","11/5/25",10:53:00,"EST","Leon","Miccusukee","5","8/15/25",,1,0.076,56,,,"",,,"Sample","COL1104202511052025",,,2025-08-15,2025-11-04,2025-11-05,"56","Florida Lakewatch","21FLKWAT"
"11/4/25",13:29:00,"EST","11/5/25",10:53:00,"EST","Orange","Avalon","1","7/26/25",,1,0.06,45,,,"",,,"Sample","COL1104202511052025",,,2025-07-26,2025-11-04,2025-11-05,"45","Florida Lakewatch","21FLKWAT"
"11/4/25",13:29:00,"EST","11/5/25",10:53:00,"EST","Orange","Claire","1","7/18/25",,1,0.048,36,,,"",,,"Sample","COL1104202511052025",,,2025-07-18,2025-11-04,2025-11-05,"36","Florida Lakewatch","21FLKWAT"
"11/4/25",13:29:00,"EST","11/5/25",10:53:00,"EST","Orange","Claire","DUP2","7/18/25",,1,0.048,36,,,"",,,"QAQC","COL1104202511052025",,,2025-07-18,2025-11-04,2025-11-05,"36","Florida Lakewatch","21FLKWAT"
"11/4/25",13:29:00,"EST","11/5/25",10:53:00,"EST",,,"ALTQC2",,,1,0.025,18,,,"Q","Q",,"QAQC","COL1104202511052025",,,,2025-11-04,2025-11-05,"18","Florida Lakewatch","21FLKWAT"
"11/4/25",13:29:00,"EST","11/5/25",10:53:00,"EST",,,"CCV2",,,1,0.033,24,,,"Q","Q",,"QAQC","COL1104202511052025",,,,2025-11-04,2025-11-05,"24","Florida Lakewatch","21FLKWAT"
"11/4/25",13:29:00,"EST","11/5/25",10:53:00,"EST",,,"MLBK3",,,1,0,0,,,"QU","Q","TI","QAQC","COL1104202511052025",,,,2025-11-04,2025-11-05,"1","Florida Lakewatch","21FLKWAT"
"11/4/25",13:29:00,"EST","11/5/25",10:53:00,"EST","Orange","Eola","1","7/24/25",,1,0.023,17,,,"",,,"Sample","COL1104202511052025",,,2025-07-24,2025-11-04,2025-11-05,"17","Florida Lakewatch","21FLKWAT"
"11/4/25",13:29:00,"EST","11/5/25",10:53:00,"EST","Orange","Holden","1","7/25/25",,1,0.014,10,,,"",,,"Sample","COL1104202511052025",,,2025-07-25,2025-11-04,2025-11-05,"10","Florida Lakewatch","21FLKWAT"
"11/4/25",13:29:00,"EST","11/5/25",10:53:00,"EST","Orange","Lee","1","7/24/25",,1,0.032,24,,,"",,,"Sample","COL1104202511052025",,,2025-07-24,2025-11-04,2025-11-05,"24","Florida Lakewatch","21FLKWAT"
"11/4/25",13:29:00,"EST","11/5/25",10:53:00,"EST","Orange","Little Hickorynut","1","7/27/25",,1,0.052,39,,,"",,,"Sample","COL1104202511052025",,,2025-07-27,2025-11-04,2025-11-05,"39","Florida Lakewatch","21FLKWAT"
"11/4/25",13:29:00,"EST","11/5/25",10:53:00,"EST","Orange","Weldona","1","7/30/25",,1,0.014,10,,,"",,,"Sample","COL1104202511052025",,,2025-07-30,2025-11-04,2025-11-05,"10","Florida Lakewatch","21FLKWAT"
"11/4/25",13:29:00,"EST","11/5/25",10:53:00,"EST","Sarasota","Egret","1","7/14/25",,1,0.046,34,,,"",,,"Sample","COL1104202511052025",,,2025-07-14,2025-11-04,2025-11-05,"34","Florida Lakewatch","21FLKWAT"
"11/4/25",13:29:00,"EST","11/5/25",10:53:00,"EST","Sarasota","Heron","1","7/14/25",,1,0.049,36,,,"",,,"Sample","COL1104202511052025",,,2025-07-14,2025-11-04,2025-11-05,"36","Florida Lakewatch","21FLKWAT"
"11/4/25",13:29:00,"EST","11/5/25",10:53:00,"EST","Washington","CBA Holmes Creek-3","DUP3","7/16/25",,1,0.009,6,,,"",,,"QAQC","COL1104202511052025",,,2025-07-16,2025-11-04,2025-11-05,"6","CHOCTAWHATCHEE BASIN ALLIANCE","BAYRALLY"
"11/4/25",13:29:00,"EST","11/5/25",10:53:00,"EST",,,"ALTQC3",,,1,0.024,18,,,"Q","Q",,"QAQC","COL1104202511052025",,,,2025-11-04,2025-11-05,"18","Florida Lakewatch","21FLKWAT"
"11/4/25",13:29:00,"EST","11/5/25",10:53:00,"EST",,,"CCV3",,,1,0.034,25,,,"Q","Q",,"QAQC","COL1104202511052025",,,,2025-11-04,2025-11-05,"25","Florida Lakewatch","21FLKWAT"
"11/4/25",13:29:00,"EST","11/5/25",10:53:00,"EST",,,"MLBK4",,,,,0,,,"QU","Q","TI","QAQC","COL1104202511052025",,,,2025-11-04,2025-11-05,"1","Florida Lakewatch","21FLKWAT"
"11/4/25",13:29:00,"EST","11/5/25",10:53:00,"EST",,,"DUP4",,,,,0,,,"QU","Q","TI","QAQC","COL1104202511052025",,,,2025-11-04,2025-11-05,"1","Florida Lakewatch","21FLKWAT"
"11/4/25",13:29:00,"EST","11/5/25",10:53:00,"EST",,,"ALTQC4",,,,,0,,"J","QU","Q","TI","QAQC","COL1104202511052025",,,,2025-11-04,2025-11-05,"1","Florida Lakewatch","21FLKWAT"
"11/4/25",13:29:00,"EST","11/5/25",10:53:00,"EST",,,"CCV4",,,,,0,,"J","QU","Q","TI","QAQC","COL1104202511052025",,,,2025-11-04,2025-11-05,"1","Florida Lakewatch","21FLKWAT"
"11/4/25",13:29:00,"EST","11/5/25",10:53:00,"EST",,,"MLBK5",,,,,0,,,"QU","Q","TI","QAQC","COL1104202511052025",,,,2025-11-04,2025-11-05,"1","Florida Lakewatch","21FLKWAT"
"11/4/25",13:29:00,"EST","11/5/25",10:53:00,"EST",,,"DUP5",,,,,0,,,"QU","Q","TI","QAQC","COL1104202511052025",,,,2025-11-04,2025-11-05,"1","Florida Lakewatch","21FLKWAT"
"11/4/25",13:29:00,"EST","11/5/25",10:53:00,"EST",,,"ALTQC5",,,,,0,,"J","QU","Q","TI","QAQC","COL1104202511052025",,,,2025-11-04,2025-11-05,"1","Florida Lakewatch","21FLKWAT"
"11/4/25",13:29:00,"EST","11/5/25",10:53:00,"EST",,,"CCV5",,,,,0,,"J","QU","Q","TI","QAQC","COL1104202511052025",,,,2025-11-04,2025-11-05,"1","Florida Lakewatch","21FLKWAT"
"11/17/25",11:02:00,"EST","11/18/25",11:08:00,"EST",,,"MBLK1",,,1,0,0,,,"U",,"TI","QAQC","COL1117202511182025",,,,2025-11-17,2025-11-18,"1","Florida Lakewatch","21FLKWAT"
"11/17/25",11:02:00,"EST","11/18/25",11:08:00,"EST","Citrus","Crystal River-1","1","7/14/25",,1,0.02,15,,,"",,,"Sample","COL1117202511182025",,,2025-07-14,2025-11-17,2025-11-18,"15","Florida Lakewatch","21FLKWAT"
"11/17/25",11:02:00,"EST","11/18/25",11:08:00,"EST","Citrus","Crystal River-6","1","7/19/25",,1,0.014,10,,,"",,,"Sample","COL1117202511182025",,,2025-07-19,2025-11-17,2025-11-18,"10","Florida Lakewatch","21FLKWAT"
"11/17/25",11:02:00,"EST","11/18/25",11:08:00,"EST","Citrus","Crystal River-7","1","7/14/25",,1,0.019,14,,,"",,,"Sample","COL1117202511182025",,,2025-07-14,2025-11-17,2025-11-18,"14","Florida Lakewatch","21FLKWAT"
"11/17/25",11:02:00,"EST","11/18/25",11:08:00,"EST","Clay","Asbury North","1","7/28/25",,1,0.008,6,,,"",,,"Sample","COL1117202511182025",,,2025-07-28,2025-11-17,2025-11-18,"6","Florida Lakewatch","21FLKWAT"
"11/17/25",11:02:00,"EST","11/18/25",11:08:00,"EST","Hernando","Hernando Beach-1","1","10/8/25",,1,0.014,10,,,"",,,"Sample","COL1117202511182025",,,2025-10-08,2025-11-17,2025-11-18,"10","Florida Lakewatch","21FLKWAT"
"11/17/25",11:02:00,"EST","11/18/25",11:08:00,"EST","Hernando","Hernando Beach-3","1","10/8/25",,1,0.018,13,,,"",,,"Sample","COL1117202511182025",,,2025-10-08,2025-11-17,2025-11-18,"13","Florida Lakewatch","21FLKWAT"
"11/17/25",11:02:00,"EST","11/18/25",11:08:00,"EST","Hernando","Hernando Beach-5","1","10/8/25",,1,0.021,16,,,"",,,"Sample","COL1117202511182025",,,2025-10-08,2025-11-17,2025-11-18,"16","Florida Lakewatch","21FLKWAT"
"11/17/25",11:02:00,"EST","11/18/25",11:08:00,"EST","Hernando","Hernando Beach-6","1","10/8/25",,1,0.017,13,,,"",,,"Sample","COL1117202511182025",,,2025-10-08,2025-11-17,2025-11-18,"13","Florida Lakewatch","21FLKWAT"
"11/17/25",11:02:00,"EST","11/18/25",11:08:00,"EST","Highlands","Clay","1","7/24/25",,1,0.017,13,,,"",,,"Sample","COL1117202511182025",,,2025-07-24,2025-11-17,2025-11-18,"13","Florida Lakewatch","21FLKWAT"
"11/17/25",11:02:00,"EST","11/18/25",11:08:00,"EST","Highlands","Jackson","1","7/14/25",,1,0.013,10,,,"",,,"Sample","COL1117202511182025",,,2025-07-14,2025-11-17,2025-11-18,"10","Florida Lakewatch","21FLKWAT"
"11/17/25",11:02:00,"EST","11/18/25",11:08:00,"EST","Hillsborough","Armistead","DUP1","7/29/25",,1,0.104,77,,,"",,,"QAQC","COL1117202511182025",,,2025-07-29,2025-11-17,2025-11-18,"77","Florida Lakewatch","21FLKWAT"
"11/17/25",11:02:00,"EST","11/18/25",11:08:00,"EST",,,"ALTQC1",,,1,0.024,18,,,"",,,"QAQC","COL1117202511182025",,,,2025-11-17,2025-11-18,"18","Florida Lakewatch","21FLKWAT"
"11/17/25",11:02:00,"EST","11/18/25",11:08:00,"EST",,,"CCV1",,,1,0.034,25,,,"",,,"QAQC","COL1117202511182025",,,,2025-11-17,2025-11-18,"25","Florida Lakewatch","21FLKWAT"
"11/17/25",11:02:00,"EST","11/18/25",11:08:00,"EST",,,"MBLK2",,,1,-0.001,-1,,,"U",,"TI","QAQC","COL1117202511182025",,,,2025-11-17,2025-11-18,"1","Florida Lakewatch","21FLKWAT"
"11/17/25",11:02:00,"EST","11/18/25",11:08:00,"EST","Lake","Bear","1","10/1/25",,2,0.127,188,,,"",,,"Sample","COL1117202511182025",,,2025-10-01,2025-11-17,2025-11-18,"188","Florida Lakewatch","21FLKWAT"
"11/17/25",11:02:00,"EST","11/18/25",11:08:00,"EST","Lake","Louisa","1","10/1/25",,4,0.118,350,,,"",,,"Sample","COL1117202511182025",,,2025-10-01,2025-11-17,2025-11-18,"350","Florida Lakewatch","21FLKWAT"
"11/17/25",11:02:00,"EST","11/18/25",11:08:00,"EST","Orange","Hickorynut","1","7/27/25",,1,0.048,36,,,"",,,"Sample","COL1117202511182025",,,2025-07-27,2025-11-17,2025-11-18,"36","Florida Lakewatch","21FLKWAT"
"11/17/25",11:02:00,"EST","11/18/25",11:08:00,"EST","Orange","Hickorynut South","1","7/27/25",,1,0.083,62,,,"",,,"Sample","COL1117202511182025",,,2025-07-27,2025-11-17,2025-11-18,"62","Florida Lakewatch","21FLKWAT"
"11/17/25",11:02:00,"EST","11/18/25",11:08:00,"EST","Orange","Ola","1","7/17/25",,1,0.019,14,,,"",,,"Sample","COL1117202511182025",,,2025-07-17,2025-11-17,2025-11-18,"14","Florida Lakewatch","21FLKWAT"
"11/17/25",11:02:00,"EST","11/18/25",11:08:00,"EST","Pinellas","Saundra","1","10/2/25",,1,0.067,50,,,"",,,"Sample","COL1117202511182025",,,2025-10-02,2025-11-17,2025-11-18,"50","Florida Lakewatch","21FLKWAT"
"11/17/25",11:02:00,"EST","11/18/25",11:08:00,"EST","Putnam","Anderson Cue","1","10/7/25",,1,0.008,6,,,"",,,"Sample","COL1117202511182025",,,2025-10-07,2025-11-17,2025-11-18,"6","Florida Lakewatch","21FLKWAT"
"11/17/25",11:02:00,"EST","11/18/25",11:08:00,"EST","Putnam","Anderson Cue","2","10/7/25",,1,0.009,7,,,"",,,"Sample","COL1117202511182025",,,2025-10-07,2025-11-17,2025-11-18,"7","Florida Lakewatch","21FLKWAT"
"11/17/25",11:02:00,"EST","11/18/25",11:08:00,"EST","Putnam","Anderson Cue","3","10/7/25",,1,0.009,7,,,"",,,"Sample","COL1117202511182025",,,2025-10-07,2025-11-17,2025-11-18,"7","Florida Lakewatch","21FLKWAT"
"11/17/25",11:02:00,"EST","11/18/25",11:08:00,"EST","Putnam","Barco","1","10/7/25",,1,0.007,5,,,"",,,"Sample","COL1117202511182025",,,2025-10-07,2025-11-17,2025-11-18,"5","Florida Lakewatch","21FLKWAT"
"11/17/25",11:02:00,"EST","11/18/25",11:08:00,"EST","Putnam","Barco","2","10/7/25",,1,0.008,6,,,"",,,"Sample","COL1117202511182025",,,2025-10-07,2025-11-17,2025-11-18,"6","Florida Lakewatch","21FLKWAT"
"11/17/25",11:02:00,"EST","11/18/25",11:08:00,"EST","Putnam","Barco","3","10/7/25",,1,0.008,6,,,"",,,"Sample","COL1117202511182025",,,2025-10-07,2025-11-17,2025-11-18,"6","Florida Lakewatch","21FLKWAT"
"11/17/25",11:02:00,"EST","11/18/25",11:08:00,"EST","Putnam","Blue","DUP2","10/5/25",,1,0.013,10,,,"",,,"QAQC","COL1117202511182025",,,2025-10-05,2025-11-17,2025-11-18,"10","Florida Lakewatch","21FLKWAT"
"11/17/25",11:02:00,"EST","11/18/25",11:08:00,"EST",,,"ALTQC2",,,1,0.025,19,,,"",,,"QAQC","COL1117202511182025",,,,2025-11-17,2025-11-18,"19","Florida Lakewatch","21FLKWAT"
"11/17/25",11:02:00,"EST","11/18/25",11:08:00,"EST",,,"CCV2",,,1,0.033,25,,,"",,,"QAQC","COL1117202511182025",,,,2025-11-17,2025-11-18,"25","Florida Lakewatch","21FLKWAT"
"11/17/25",11:02:00,"EST","11/18/25",11:08:00,"EST",,,"MBLK3",,,1,-0.001,-1,,,"U",,"TI","QAQC","COL1117202511182025",,,,2025-11-17,2025-11-18,"1","Florida Lakewatch","21FLKWAT"
"11/17/25",11:02:00,"EST","11/18/25",11:08:00,"EST","Putnam","Enslow","1","10/7/25",,1,0.037,27,,,"",,,"Sample","COL1117202511182025",,,2025-10-07,2025-11-17,2025-11-18,"27","Florida Lakewatch","21FLKWAT"
"11/17/25",11:02:00,"EST","11/18/25",11:08:00,"EST","Putnam","Enslow","2","10/7/25",,1,0.042,31,,,"",,,"Sample","COL1117202511182025",,,2025-10-07,2025-11-17,2025-11-18,"31","Florida Lakewatch","21FLKWAT"
"11/17/25",11:02:00,"EST","11/18/25",11:08:00,"EST","Putnam","Enslow","3","10/7/25",,1,0.049,36,,,"",,,"Sample","COL1117202511182025",,,2025-10-07,2025-11-17,2025-11-18,"36","Florida Lakewatch","21FLKWAT"
"11/17/25",11:02:00,"EST","11/18/25",11:08:00,"EST","Putnam","Goose","1","10/8/25",,4,0.065,193,,,"",,,"Sample","COL1117202511182025",,,2025-10-08,2025-11-17,2025-11-18,"193","Florida Lakewatch","21FLKWAT"
"11/17/25",11:02:00,"EST","11/18/25",11:08:00,"EST","Putnam","Goose","2","10/8/25",,4,0.067,199,,,"",,,"Sample","COL1117202511182025",,,2025-10-08,2025-11-17,2025-11-18,"199","Florida Lakewatch","21FLKWAT"
"11/17/25",11:02:00,"EST","11/18/25",11:08:00,"EST","Putnam","Goose","3","10/8/25",,4,0.064,190,,,"",,,"Sample","COL1117202511182025",,,2025-10-08,2025-11-17,2025-11-18,"190","Florida Lakewatch","21FLKWAT"
"11/17/25",11:02:00,"EST","11/18/25",11:08:00,"EST","Putnam","McCloud","1","10/7/25",,1,0.015,11,,,"",,,"Sample","COL1117202511182025",,,2025-10-07,2025-11-17,2025-11-18,"11","Florida Lakewatch","21FLKWAT"
"11/17/25",11:02:00,"EST","11/18/25",11:08:00,"EST","Putnam","McCloud","2","10/7/25",,1,0.011,8,,,"",,,"Sample","COL1117202511182025",,,2025-10-07,2025-11-17,2025-11-18,"8","Florida Lakewatch","21FLKWAT"
"11/17/25",11:02:00,"EST","11/18/25",11:08:00,"EST","Putnam","McCloud","3","10/7/25",,1,0.025,19,,,"",,,"Sample","COL1117202511182025",,,2025-10-07,2025-11-17,2025-11-18,"19","Florida Lakewatch","21FLKWAT"
"11/17/25",11:02:00,"EST","11/18/25",11:08:00,"EST","Putnam","Ross","1","10/8/25",,4,0.111,329,,,"",,,"Sample","COL1117202511182025",,,2025-10-08,2025-11-17,2025-11-18,"329","Florida Lakewatch","21FLKWAT"
"11/17/25",11:02:00,"EST","11/18/25",11:08:00,"EST","Putnam","Ross","2","10/8/25",,4,0.104,308,,,"",,,"Sample","COL1117202511182025",,,2025-10-08,2025-11-17,2025-11-18,"308","Florida Lakewatch","21FLKWAT"
"11/17/25",11:02:00,"EST","11/18/25",11:08:00,"EST","Putnam","Ross","3","10/8/25",,4,0.101,299,,,"",,,"Sample","COL1117202511182025",,,2025-10-08,2025-11-17,2025-11-18,"299","Florida Lakewatch","21FLKWAT"
"11/17/25",11:02:00,"EST","11/18/25",11:08:00,"EST","Putnam","Rowan","1","10/7/25",,1,0.089,66,,,"",,,"Sample","COL1117202511182025",,,2025-10-07,2025-11-17,2025-11-18,"66","Florida Lakewatch","21FLKWAT"
"11/17/25",11:02:00,"EST","11/18/25",11:08:00,"EST","Putnam","Rowan","2","10/7/25",,1,0.092,68,,,"",,,"Sample","COL1117202511182025",,,2025-10-07,2025-11-17,2025-11-18,"68","Florida Lakewatch","21FLKWAT"
"11/17/25",11:02:00,"EST","11/18/25",11:08:00,"EST","Putnam","Rowan","3","10/7/25",,1,0.087,65,,,"",,,"Sample","COL1117202511182025",,,2025-10-07,2025-11-17,2025-11-18,"65","Florida Lakewatch","21FLKWAT"
"11/17/25",11:02:00,"EST","11/18/25",11:08:00,"EST","Putnam","Suggs","1","10/8/25",,4,0.069,205,,,"",,,"Sample","COL1117202511182025",,,2025-10-08,2025-11-17,2025-11-18,"205","Florida Lakewatch","21FLKWAT"
"11/17/25",11:02:00,"EST","11/18/25",11:08:00,"EST","Putnam","Suggs","2","10/8/25",,4,0.07,208,,,"",,,"Sample","COL1117202511182025",,,2025-10-08,2025-11-17,2025-11-18,"208","Florida Lakewatch","21FLKWAT"
"11/17/25",11:02:00,"EST","11/18/25",11:08:00,"EST","Putnam","Suggs","3","10/8/25",,4,0.071,211,,,"",,,"Sample","COL1117202511182025",,,2025-10-08,2025-11-17,2025-11-18,"211","Florida Lakewatch","21FLKWAT"
"11/17/25",11:02:00,"EST","11/18/25",11:08:00,"EST","Putnam","Suggs","DUP3","10/8/25",,4,0.07,208,,,"",,,"QAQC","COL1117202511182025",,,2025-10-08,2025-11-17,2025-11-18,"208","Florida Lakewatch","21FLKWAT"
"11/17/25",11:02:00,"EST","11/18/25",11:08:00,"EST",,,"ALTQC3",,,1,0.024,18,,,"",,,"QAQC","COL1117202511182025",,,,2025-11-17,2025-11-18,"18","Florida Lakewatch","21FLKWAT"
"11/17/25",11:02:00,"EST","11/18/25",11:08:00,"EST",,,"CCV3",,,1,0.032,24,,,"",,,"QAQC","COL1117202511182025",,,,2025-11-17,2025-11-18,"24","Florida Lakewatch","21FLKWAT"
"11/17/25",11:02:00,"EST","11/18/25",11:08:00,"EST",,,"MBLK4",,,,,0,,,"U",,"TI","QAQC","COL1117202511182025",,,,2025-11-17,2025-11-18,"1","Florida Lakewatch","21FLKWAT"
"11/17/25",11:02:00,"EST","11/18/25",11:08:00,"EST",,,"DUP4",,,,,0,,,"QU","Q","TI","QAQC","COL1117202511182025",,,,2025-11-17,2025-11-18,"1","Florida Lakewatch","21FLKWAT"
"11/17/25",11:02:00,"EST","11/18/25",11:08:00,"EST",,,"ALTQC4",,,,,0,,"J","QU","Q","TI","QAQC","COL1117202511182025",,,,2025-11-17,2025-11-18,"1","Florida Lakewatch","21FLKWAT"
"11/17/25",11:02:00,"EST","11/18/25",11:08:00,"EST",,,"CCV4",,,,,0,,"J","QU","Q","TI","QAQC","COL1117202511182025",,,,2025-11-17,2025-11-18,"1","Florida Lakewatch","21FLKWAT"
"11/17/25",11:02:00,"EST","11/18/25",11:08:00,"EST",,,"MBLK5",,,,,0,,,"QU","Q","TI","QAQC","COL1117202511182025",,,,2025-11-17,2025-11-18,"1","Florida Lakewatch","21FLKWAT"
"11/17/25",11:02:00,"EST","11/18/25",11:08:00,"EST",,,"DUP5",,,,,0,,,"QU","Q","TI","QAQC","COL1117202511182025",,,,2025-11-17,2025-11-18,"1","Florida Lakewatch","21FLKWAT"
"11/17/25",11:02:00,"EST","11/18/25",11:08:00,"EST",,,"ALTQC5",,,,,0,,"J","QU","Q","TI","QAQC","COL1117202511182025",,,,2025-11-17,2025-11-18,"1","Florida Lakewatch","21FLKWAT"
"11/17/25",11:02:00,"EST","11/18/25",11:08:00,"EST",,,"CCV5",,,,,0,,"J","QU","Q","TI","QAQC","COL1117202511182025",,,,2025-11-17,2025-11-18,"1","Florida Lakewatch","21FLKWAT"
"7/10/25",14:23:00,"EDT","7/14/25",10:56:00,"EDT","Bay","Powell Creek East-1","1","4/2/25",,1,0.051,40,,,"",,,"Sample","COL0710202507142025",,,2025-04-02,2025-07-10,2025-07-14,"40","ST. ANDREW BAY RESOURCE MANAGEMENT ASSOCIATION INC.","21FLKWAT"
"7/10/25",14:23:00,"EDT","7/14/25",10:56:00,"EDT","Bay","Powell Creek East-2","1","4/2/25",,2,0.137,212,,,"",,,"Sample","COL0710202507142025",,,2025-04-02,2025-07-10,2025-07-14,"212","ST. ANDREW BAY RESOURCE MANAGEMENT ASSOCIATION INC.","21FLKWAT"
"7/10/25",14:23:00,"EDT","7/14/25",10:56:00,"EDT","Bay","Pretty Bayou-1","1","4/9/25",,1,0.025,20,,,"",,,"Sample","COL0710202507142025",,,2025-04-09,2025-07-10,2025-07-14,"20","ST. ANDREW BAY RESOURCE MANAGEMENT ASSOCIATION INC.","21FLKWAT"
"7/10/25",14:23:00,"EDT","7/14/25",10:56:00,"EDT","Bay","Robinson Bayou-1","1","4/9/25",,1,0.035,27,,,"",,,"Sample","COL0710202507142025",,,2025-04-09,2025-07-10,2025-07-14,"27","ST. ANDREW BAY RESOURCE MANAGEMENT ASSOCIATION INC.","21FLKWAT"
"7/10/25",14:23:00,"EDT","7/14/25",10:56:00,"EDT","Bay","St. Andrew Bay-6","1","4/28/25",,1,0.008,7,,,"",,,"Sample","COL0710202507142025",,,2025-04-28,2025-07-10,2025-07-14,"7","ST. ANDREW BAY RESOURCE MANAGEMENT ASSOCIATION INC.","21FLKWAT"
"7/10/25",14:23:00,"EDT","7/14/25",10:56:00,"EDT","Bay","St. Andrew Bay-7","1","4/28/25",,1,0.001,1,,,"",,,"Sample","COL0710202507142025",,,2025-04-28,2025-07-10,2025-07-14,"1","ST. ANDREW BAY RESOURCE MANAGEMENT ASSOCIATION INC.","21FLKWAT"
"7/10/25",14:23:00,"EDT","7/14/25",10:56:00,"EDT","Bay","St. Andrew Bay-12","1","4/28/25",,1,0.005,4,,,"",,,"Sample","COL0710202507142025",,,2025-04-28,2025-07-10,2025-07-14,"4","ST. ANDREW BAY RESOURCE MANAGEMENT ASSOCIATION INC.","21FLKWAT"
"7/10/25",14:23:00,"EDT","7/14/25",10:56:00,"EDT","Bay","Upper Goose Bayou-1","1","4/9/25",,1,0.022,18,,,"",,,"Sample","COL0710202507142025",,,2025-04-09,2025-07-10,2025-07-14,"18","ST. ANDREW BAY RESOURCE MANAGEMENT ASSOCIATION INC.","21FLKWAT"
"7/10/25",14:23:00,"EDT","7/14/25",10:56:00,"EDT","Bay","Warren Bayou-1","1","4/14/25",,1,0.021,17,,,"",,,"Sample","COL0710202507142025",,,2025-04-14,2025-07-10,2025-07-14,"17","ST. ANDREW BAY RESOURCE MANAGEMENT ASSOCIATION INC.","21FLKWAT"
"7/10/25",14:23:00,"EDT","7/14/25",10:56:00,"EDT","Bay","West Bay-1","1","4/14/25",,1,0.02,16,,,"",,,"Sample","COL0710202507142025",,,2025-04-14,2025-07-10,2025-07-14,"16","ST. ANDREW BAY RESOURCE MANAGEMENT ASSOCIATION INC.","21FLKWAT"
"7/10/25",14:23:00,"EDT","7/14/25",10:56:00,"EDT","Bay","West Bay-2","1","4/14/25",,1,0.019,15,,,"",,,"Sample","COL0710202507142025",,,2025-04-14,2025-07-10,2025-07-14,"15","ST. ANDREW BAY RESOURCE MANAGEMENT ASSOCIATION INC.","21FLKWAT"
"7/10/25",14:23:00,"EDT","7/14/25",10:56:00,"EDT","Bay","West Bay-3","1","4/14/25",,1,0.023,18,,,"",,,"Sample","COL0710202507142025",,,2025-04-14,2025-07-10,2025-07-14,"18","ST. ANDREW BAY RESOURCE MANAGEMENT ASSOCIATION INC.","21FLKWAT"
"7/10/25",14:23:00,"EDT","7/14/25",10:56:00,"EDT","Bay","West Bay-4","1","4/14/25",,1,0.016,13,,,"",,,"Sample","COL0710202507142025",,,2025-04-14,2025-07-10,2025-07-14,"13","ST. ANDREW BAY RESOURCE MANAGEMENT ASSOCIATION INC.","21FLKWAT"
"7/10/25",14:23:00,"EDT","7/14/25",10:56:00,"EDT","Bay","West Bay-12","1","4/14/25",,1,0.029,23,,,"",,,"Sample","COL0710202507142025",,,2025-04-14,2025-07-10,2025-07-14,"23","ST. ANDREW BAY RESOURCE MANAGEMENT ASSOCIATION INC.","21FLKWAT"
"7/10/25",14:23:00,"EDT","7/14/25",10:56:00,"EDT",,,"ALTQC1",,,1,0.023,18,,,"Q","Q",,"QAQC","COL0710202507142025",,,,2025-07-10,2025-07-14,"18","Florida Lakewatch","21FLKWAT"
"7/10/25",14:23:00,"EDT","7/14/25",10:56:00,"EDT","Gulf","St. Joseph Bay-1","1","1/29/25",,1,0.009,8,,,"Q","Q",,"Sample","COL0710202507142025",,,2025-01-29,2025-07-10,2025-07-14,"8","Florida Lakewatch","21FLKWAT"
"7/10/25",14:23:00,"EDT","7/14/25",10:56:00,"EDT","Gulf","St. Joseph Bay-2","1","1/29/25",,1,0.006,5,,,"Q","Q",,"Sample","COL0710202507142025",,,2025-01-29,2025-07-10,2025-07-14,"5","Florida Lakewatch","21FLKWAT"
"7/10/25",14:23:00,"EDT","7/14/25",10:56:00,"EDT","Gulf","St. Joseph Bay-3","1","1/29/25",,1,0.009,8,,,"Q","Q",,"Sample","COL0710202507142025",,,2025-01-29,2025-07-10,2025-07-14,"8","Florida Lakewatch","21FLKWAT"
"7/10/25",14:23:00,"EDT","7/14/25",10:56:00,"EDT","Gulf","St. Joseph Bay-4","1","1/29/25",,1,0.008,7,,,"Q","Q",,"Sample","COL0710202507142025",,,2025-01-29,2025-07-10,2025-07-14,"7","Florida Lakewatch","21FLKWAT"
"7/10/25",14:23:00,"EDT","7/14/25",10:56:00,"EDT","Gulf","St. Joseph Bay-5","1","1/29/25",,1,0.007,6,,,"Q","Q",,"Sample","COL0710202507142025",,,2025-01-29,2025-07-10,2025-07-14,"6","Florida Lakewatch","21FLKWAT"
"7/10/25",14:23:00,"EDT","7/14/25",10:56:00,"EDT","Gulf","St. Joseph Bay-6","1","1/29/25",,1,0.01,8,,,"Q","Q",,"Sample","COL0710202507142025",,,2025-01-29,2025-07-10,2025-07-14,"8","Florida Lakewatch","21FLKWAT"
"7/10/25",14:23:00,"EDT","7/14/25",10:56:00,"EDT","Gulf","St. Joseph Bay-7","1","1/29/25",,1,0.007,6,,,"Q","Q",,"Sample","COL0710202507142025",,,2025-01-29,2025-07-10,2025-07-14,"6","Florida Lakewatch","21FLKWAT"
"7/10/25",14:23:00,"EDT","7/14/25",10:56:00,"EDT","Gulf","St. Joseph Bay-8","1","1/29/25",,1,0.02,16,,,"Q","Q",,"Sample","COL0710202507142025",,,2025-01-29,2025-07-10,2025-07-14,"16","Florida Lakewatch","21FLKWAT"
"7/10/25",14:23:00,"EDT","7/14/25",10:56:00,"EDT","Gulf","St. Joseph Bay-9","1","1/29/25",,1,0.007,6,,,"Q","Q",,"Sample","COL0710202507142025",,,2025-01-29,2025-07-10,2025-07-14,"6","Florida Lakewatch","21FLKWAT"
"7/10/25",14:23:00,"EDT","7/14/25",10:56:00,"EDT","Lake","Palatlakaha","1","4/14/25",,4,0.153,472,,,"",,,"Sample","COL0710202507142025",,,2025-04-14,2025-07-10,2025-07-14,"472","Florida Lakewatch","21FLKWAT"
"7/10/25",14:23:00,"EDT","7/14/25",10:56:00,"EDT","Lake","Royal","1","4/7/25",,1,0.039,31,,,"",,,"Sample","COL0710202507142025",,,2025-04-07,2025-07-10,2025-07-14,"31","Florida Lakewatch","21FLKWAT"
"7/10/25",14:23:00,"EDT","7/14/25",10:56:00,"EDT","Lake","Winona","1","4/14/25",,2,0.114,176,,,"",,,"Sample","COL0710202507142025",,,2025-04-14,2025-07-10,2025-07-14,"176","Florida Lakewatch","21FLKWAT"
"7/10/25",14:23:00,"EDT","7/14/25",10:56:00,"EDT","Putnam","Anderson Cue","1","5/13/25",,1,0.017,14,,,"",,,"Sample","COL0710202507142025",,,2025-05-13,2025-07-10,2025-07-14,"14","Florida Lakewatch","21FLKWAT"
"7/10/25",14:23:00,"EDT","7/14/25",10:56:00,"EDT","Putnam","Anderson Cue","2","5/13/25",,1,0.01,8,,,"",,,"Sample","COL0710202507142025",,,2025-05-13,2025-07-10,2025-07-14,"8","Florida Lakewatch","21FLKWAT"
"7/10/25",14:23:00,"EDT","7/14/25",10:56:00,"EDT","Putnam","Anderson Cue","3","5/13/25",,1,0.008,7,,,"",,,"Sample","COL0710202507142025",,,2025-05-13,2025-07-10,2025-07-14,"7","Florida Lakewatch","21FLKWAT"
"7/10/25",14:23:00,"EDT","7/14/25",10:56:00,"EDT","Putnam","Barco","1","5/13/25",,1,0.008,7,,,"",,,"Sample","COL0710202507142025",,,2025-05-13,2025-07-10,2025-07-14,"7","Florida Lakewatch","21FLKWAT"
"7/10/25",14:23:00,"EDT","7/14/25",10:56:00,"EDT","Putnam","Barco","2","5/13/25",,1,0.008,7,,,"",,,"Sample","COL0710202507142025",,,2025-05-13,2025-07-10,2025-07-14,"7","Florida Lakewatch","21FLKWAT"
"7/10/25",14:23:00,"EDT","7/14/25",10:56:00,"EDT","Putnam","Barco","3","5/13/25",,1,0.008,7,,,"",,,"Sample","COL0710202507142025",,,2025-05-13,2025-07-10,2025-07-14,"7","Florida Lakewatch","21FLKWAT"
"7/10/25",14:23:00,"EDT","7/14/25",10:56:00,"EDT","Putnam","Enslow","1","5/13/25",,1,0.029,23,,,"",,,"Sample","COL0710202507142025",,,2025-05-13,2025-07-10,2025-07-14,"23","Florida Lakewatch","21FLKWAT"
"7/10/25",14:23:00,"EDT","7/14/25",10:56:00,"EDT",,,"ALTQC2",,,1,0.022,18,,,"Q","Q",,"QAQC","COL0710202507142025",,,,2025-07-10,2025-07-14,"18","Florida Lakewatch","21FLKWAT"
"7/10/25",14:23:00,"EDT","7/14/25",10:56:00,"EDT","Putnam","Enslow","2","5/13/25",,1,0.031,24,,,"",,,"Sample","COL0710202507142025",,,2025-05-13,2025-07-10,2025-07-14,"24","Florida Lakewatch","21FLKWAT"
"7/10/25",14:23:00,"EDT","7/14/25",10:56:00,"EDT","Putnam","Enslow","3","5/13/25",,1,0.034,27,,,"",,,"Sample","COL0710202507142025",,,2025-05-13,2025-07-10,2025-07-14,"27","Florida Lakewatch","21FLKWAT"
"7/10/25",14:23:00,"EDT","7/14/25",10:56:00,"EDT","Putnam","Goose","1","5/14/25",,4,0.106,328,,,"",,,"Sample","COL0710202507142025",,,2025-05-14,2025-07-10,2025-07-14,"328","Florida Lakewatch","21FLKWAT"
"7/10/25",14:23:00,"EDT","7/14/25",10:56:00,"EDT","Putnam","Goose","2","5/14/25",,4,0.117,362,,,"",,,"Sample","COL0710202507142025",,,2025-05-14,2025-07-10,2025-07-14,"362","Florida Lakewatch","21FLKWAT"
"7/10/25",14:23:00,"EDT","7/14/25",10:56:00,"EDT","Putnam","Goose","3","5/14/25",,4,0.107,331,,,"",,,"Sample","COL0710202507142025",,,2025-05-14,2025-07-10,2025-07-14,"331","Florida Lakewatch","21FLKWAT"
"7/10/25",14:23:00,"EDT","7/14/25",10:56:00,"EDT","Putnam","McCloud","1","5/13/25",,1,0.025,20,,,"",,,"Sample","COL0710202507142025",,,2025-05-13,2025-07-10,2025-07-14,"20","Florida Lakewatch","21FLKWAT"
"7/10/25",14:23:00,"EDT","7/14/25",10:56:00,"EDT","Putnam","McCloud","2","5/13/25",,1,0.015,12,,,"",,,"Sample","COL0710202507142025",,,2025-05-13,2025-07-10,2025-07-14,"12","Florida Lakewatch","21FLKWAT"
"7/10/25",14:23:00,"EDT","7/14/25",10:56:00,"EDT","Putnam","McCloud","3","5/13/25",,1,0.016,13,,,"",,,"Sample","COL0710202507142025",,,2025-05-13,2025-07-10,2025-07-14,"13","Florida Lakewatch","21FLKWAT"
"7/10/25",14:23:00,"EDT","7/14/25",10:56:00,"EDT","Putnam","Ross","1","5/14/25",,4,0.134,414,,,"",,,"Sample","COL0710202507142025",,,2025-05-14,2025-07-10,2025-07-14,"414","Florida Lakewatch","21FLKWAT"
"7/10/25",14:23:00,"EDT","7/14/25",10:56:00,"EDT","Putnam","Ross","2","5/14/25",,4,0.131,405,,,"",,,"Sample","COL0710202507142025",,,2025-05-14,2025-07-10,2025-07-14,"405","Florida Lakewatch","21FLKWAT"
"7/10/25",14:23:00,"EDT","7/14/25",10:56:00,"EDT","Putnam","Ross","3","5/14/25",,4,0.12,371,,,"",,,"Sample","COL0710202507142025",,,2025-05-14,2025-07-10,2025-07-14,"371","Florida Lakewatch","21FLKWAT"
"7/10/25",14:23:00,"EDT","7/14/25",10:56:00,"EDT","Putnam","Rowan","1","5/13/25",,1,0.168,130,,,"",,,"Sample","COL0710202507142025",,,2025-05-13,2025-07-10,2025-07-14,"130","Florida Lakewatch","21FLKWAT"
"7/10/25",14:23:00,"EDT","7/14/25",10:56:00,"EDT","Putnam","Rowan","2","5/13/25",,1,0.162,125,,,"",,,"Sample","COL0710202507142025",,,2025-05-13,2025-07-10,2025-07-14,"125","Florida Lakewatch","21FLKWAT"
"7/10/25",14:23:00,"EDT","7/14/25",10:56:00,"EDT","Putnam","Rowan","3","5/13/25",,1,0.165,127,,,"",,,"Sample","COL0710202507142025",,,2025-05-13,2025-07-10,2025-07-14,"127","Florida Lakewatch","21FLKWAT"
"7/10/25",14:23:00,"EDT","7/14/25",10:56:00,"EDT","Putnam","Suggs","1","5/14/25",,4,0.11,340,,,"",,,"Sample","COL0710202507142025",,,2025-05-14,2025-07-10,2025-07-14,"340","Florida Lakewatch","21FLKWAT"
"7/10/25",14:23:00,"EDT","7/14/25",10:56:00,"EDT","Putnam","Suggs","2","5/14/25",,4,0.106,328,,,"",,,"Sample","COL0710202507142025",,,2025-05-14,2025-07-10,2025-07-14,"328","Florida Lakewatch","21FLKWAT"
"7/10/25",14:23:00,"EDT","7/14/25",10:56:00,"EDT","Putnam","Suggs","3","5/14/25",,4,0.122,377,,,"",,,"Sample","COL0710202507142025",,,2025-05-14,2025-07-10,2025-07-14,"377","Florida Lakewatch","21FLKWAT"
"7/10/25",14:23:00,"EDT","7/14/25",10:56:00,"EDT","Highlands","Annie","1","4/16/25",,1,0.092,71,,,"",,,"Sample","COL0710202507142025",,,2025-04-16,2025-07-10,2025-07-14,"71","Florida Lakewatch","21FLKWAT"
"7/10/25",14:23:00,"EDT","7/14/25",10:56:00,"EDT","Highlands","Clay","1","4/26/25",,1,0.022,18,,,"",,,"Sample","COL0710202507142025",,,2025-04-26,2025-07-10,2025-07-14,"18","Florida Lakewatch","21FLKWAT"
"7/10/25",14:23:00,"EDT","7/14/25",10:56:00,"EDT",,,"ALTQC3",,,1,0.022,18,,,"Q","Q",,"QAQC","COL0710202507142025",,,,2025-07-10,2025-07-14,"18","Florida Lakewatch","21FLKWAT"
"7/10/25",14:23:00,"EDT","7/14/25",10:56:00,"EDT",,,"ALTQC4",,,,,1,,"J","QU","Q","TI","QAQC","COL0710202507142025",,,,2025-07-10,2025-07-14,"1","Florida Lakewatch","21FLKWAT"
"7/10/25",14:23:00,"EDT","7/14/25",10:56:00,"EDT",,,"ALTQC5",,,,,1,,"J","QU","Q","TI","QAQC","COL0710202507142025",,,,2025-07-10,2025-07-14,"1","Florida Lakewatch","21FLKWAT"
"7/21/25",13:50:59,"EST","7/22/25",13:01:00,"EST","Alachua","Lochloosa_Lajoie_Post-Doc","OP2","6/23/25",,1,0.053,39,,,"",,,"Sample","COL0721202507222025","Student Project",,2025-06-23,2025-07-21,2025-07-22,"39","Florida Lakewatch","21FLKWAT"
"7/21/25",13:50:59,"EST","7/22/25",13:01:00,"EST","Alachua","Lochloosa_Lajoie_Post-Doc","OP1","6/23/25",,1,0.051,38,,,"",,,"Sample","COL0721202507222025","Student Project",,2025-06-23,2025-07-21,2025-07-22,"38","Florida Lakewatch","21FLKWAT"
"7/21/25",13:50:59,"EST","7/22/25",13:01:00,"EST","Alachua","Lochloosa_Lajoie_Post-Doc","OP3","6/23/25",,1,0.051,38,,,"",,,"Sample","COL0721202507222025","Student Project",,2025-06-23,2025-07-21,2025-07-22,"38","Florida Lakewatch","21FLKWAT"
"7/21/25",13:50:59,"EST","7/22/25",13:01:00,"EST","Alachua","Lochloosa_Lajoie_Post-Doc","LC","6/23/25",,1,0.072,53,,,"",,,"Sample","COL0721202507222025","Student Project",,2025-06-23,2025-07-21,2025-07-22,"53","Florida Lakewatch","21FLKWAT"
"7/21/25",13:50:59,"EST","7/22/25",13:01:00,"EST","Alachua","Lochloosa_Lajoie_Post-Doc","L5","6/23/25",,1,0.056,41,,,"",,,"Sample","COL0721202507222025","Student Project",,2025-06-23,2025-07-21,2025-07-22,"41","Florida Lakewatch","21FLKWAT"
"7/21/25",13:50:59,"EST","7/22/25",13:01:00,"EST","Alachua","Lochloosa_Lajoie_Post-Doc","L2","6/23/25",,1,0.055,41,,,"",,,"Sample","COL0721202507222025","Student Project",,2025-06-23,2025-07-21,2025-07-22,"41","Florida Lakewatch","21FLKWAT"
"7/21/25",13:50:59,"EST","7/22/25",13:01:00,"EST","Alachua","Lochloosa_Lajoie_Post-Doc","L4","6/23/25",,1,0.057,42,,,"",,,"Sample","COL0721202507222025","Student Project",,2025-06-23,2025-07-21,2025-07-22,"42","Florida Lakewatch","21FLKWAT"
"7/21/25",13:50:59,"EST","7/22/25",13:01:00,"EST","Bay","Beatty Bayou-1","1","6/23/25",,1,0.039,29,,,"",,,"Sample","COL0721202507222025",,,2025-06-23,2025-07-21,2025-07-22,"29","ST. ANDREW BAY RESOURCE MANAGEMENT ASSOCIATION INC.","21FLKWAT"
"7/21/25",13:50:59,"EST","7/22/25",13:01:00,"EST","Bay","Callaway Bayou-2","1","4/23/25",,1,0.013,10,,,"",,,"Sample","COL0721202507222025",,,2025-04-23,2025-07-21,2025-07-22,"10","ST. ANDREW BAY RESOURCE MANAGEMENT ASSOCIATION INC.","21FLKWAT"
